chapter_id,date,sentence
ch1,"October 6th, 1783","They’d been into the whiskey, I could tell, never mind that it was first thing in the morning."
ch7,"April 6th, 1784",Jamie is snoring companionably beside me.
ch4,"January 1st, 1784",The fever has gone!
ch3,"December 1st, 1783","I’m very glad, because it was the quilt from my bed."
ch2,"November 1st, 1783","“Surging all the way to the sea,” Father said as he stood beside me, staring at it."
ch5,"February 1st, 1784",It seemed to take forever.
ch6,"March 3rd, 1784",I’ve always loved maple syrup making time.
ch1,"October 6th, 1783",Thank goodness John is with us or we would have lost our way for certain.
ch1,"October 6th, 1783",It’s fortunate indeed that Laddie is such a good-natured dog.
ch3,"December 1st, 1783","The German families had the best custom of all, I think."
ch12,"September 6th, 1784",Father came home with a basket full of fish last night and we had boiled fish for dinner.
ch1,"October 6th, 1783","It is very good of him to do so, as his family will have to camp here and wait for him to return before they go on."
ch1,"October 6th, 1783","One old lady passed me by just now and muttered “Tory cowards” under her breath, but not so much under her breath that I could not hear."
ch1,"October 6th, 1783","John showed us how to clean them, then cook them by burying them in the ashes of our fire until the flesh separated off the bones."
ch3,"December 1st, 1783",We have a barrel of salt pork sitting outside the door (what joy!)
ch1,"October 6th, 1783",The strangest thing.
ch2,"November 1st, 1783",It is very crowded and dirty.
ch10,"July 2nd, 1784",I saw Mother relax then.
ch8,"May 2nd, 1784",I collected dandelion greens for a salad and Mother boiled fish with potatoes and turnips and some of Grannie’s herbs.
ch3,"December 1st, 1783",I told her that proves he’s sweet on her.
ch1,"October 6th, 1783",I started to run toward them but the sound of Ned Bolton’s voice stopped me as surely as if he had reached out and struck me.
ch1,"October 6th, 1783","He started to chase after it, but Jamie whistled him off."
ch2,"November 1st, 1783","Thank goodness it is no longer raining, but the weather is much colder."
ch1,"October 6th, 1783",I was right to worry about the waves.
ch9,"June 1st, 1784","When we reach the beginning of the rapids, we passengers all disembark and take whatever is most precious to us, in case one of the boats does tip."
ch12,"September 6th, 1784","I could not stop my tongue from wagging, asking him how Hannah was, did her family have their cabin built yet, and a thousand other questions, not to mention, how did he ever get a horse and from where?"
ch1,"October 6th, 1783","There is a dog sitting at the edge of our campsite, staring at us."
ch2,"November 1st, 1783",He must get there before the river begins to freeze up.
ch11,"August 2nd, 1784","Just imagine, next spring we will have lilacs in the doorway again."
ch1,"October 6th, 1783",She looks so puzzled every time she hiccups that I can’t help but laugh at her.
ch10,"July 2nd, 1784","Angus and Duncan will help us get our place built, then they will build shanties of their own on their properties."
ch12,"September 6th, 1784","I will tell of the bee tomorrow, and also of all the other good things that happened."
ch1,"October 6th, 1783",Father climbed up and helped Mother and Grannie up beside him.
ch2,"November 1st, 1783",There’s no way I will ever forget what happened.
ch10,"July 2nd, 1784","I do that and then pull them through the hatchel to comb the stalks out and just leave the fibre, then Grannie spins it."
ch8,"May 2nd, 1784",It is reassuring to see all the supplies that are being sent along with us.
ch2,"November 1st, 1783",Poor baby!
ch2,"November 1st, 1783",His name is Duncan.
ch1,"October 6th, 1783","Oh, how I hope we can travel up to Canada together."
ch12,"September 6th, 1784","Best of all, Hannah and her family brought their tent and are staying over."
ch2,"November 1st, 1783","Mrs. Livingstone, whose family lives just a few cabins away, came over this morning with a crock of yeast starter so that we can make our own bread."
ch1,"October 6th, 1783","I want to write, though."
ch4,"January 1st, 1784",(Hannah told me this morning that he had.)
ch1,"October 6th, 1783",I think Grannie is getting provoked at Mother.
ch3,"December 1st, 1783",Most of the others are boys.
ch4,"January 1st, 1784",Others are talking that way as well.
ch13,"October 3rd, 1784",I’m sure most of the fish high-tailed it out of there in the first five minutes.
ch3,"December 1st, 1783","I am grateful to your Mother, Mary, for letting me have that blanket."
ch9,"June 1st, 1784",It is very interesting.
ch12,"September 6th, 1784",Just when things were beginning to go well — how could I be so stupid!
ch9,"June 1st, 1784",The summer is wearing on and they have not yet finished surveying the lots.
ch8,"May 2nd, 1784",I only understand that I have but one threadbare dress and my coat is in tatters.
ch6,"March 3rd, 1784","Now, instead of grumbling, people are beginning to make plans and even look forward to our journey upriver."
ch2,"November 1st, 1783",We walk all day with only a brief stop for a cold meal.
ch1,"October 6th, 1783",And wildcats.
ch1,"October 6th, 1783",We found ourselves standing right on the edge.
ch3,"December 1st, 1783",Nor do we have a bootmaker here to make us new boots when the ones we are wearing give out.
ch1,"October 6th, 1783",They tied his hands to the pommel and whipped the mule forward.
ch10,"July 2nd, 1784","Also, I am very 
very
 tired."
ch2,"November 1st, 1783","They were sent to a terrible prison near Albany and found themselves sharing a tiny, dark hole of a cell there."
ch10,"July 2nd, 1784",It is most amusing to watch them together.
ch13,"October 3rd, 1784",Poor Duncan.
ch5,"February 1st, 1784",The weather is truly horrid.
ch1,"October 6th, 1783",Lizzie Crane’s father was one of them.
ch12,"September 6th, 1784",The men were all laughing and shouting to each other as they began to gather up all the brushwood and small trees that Father and Angus and Duncan had cut down.
ch1,"October 6th, 1783",It is strangely soothing.
ch10,"July 2nd, 1784",I hope Father will put in windows.
ch6,"March 3rd, 1784",She fancies herself the best judge anywhere of when the syrup has reached the right stage.
ch1,"October 6th, 1783",We are all too exhausted to move.
ch5,"February 1st, 1784","I’m trying to get back into her good graces by tending to the evening stew and looking very virtuous and industrious, but I do not think it is working."
ch5,"February 1st, 1784",Normally we would spend the winter knitting the wool that Grannie spun.
ch11,"August 2nd, 1784",It makes me feel quite light inside.
ch2,"November 1st, 1783",We will set out with the Rosses for Sorel.
ch1,"October 6th, 1783","Dear Canada: With Nothing But Our Courage
October 1783
They burned the schoolhouse down!"
ch1,"October 6th, 1783","“Go after him!” Mother cried, but I already was."
ch1,"October 6th, 1783","There’s supper to be made,” Grannie chided her."
ch14,"November 1st, 1784","I have come to the end of the pages in this journal, but my birthday is next month and I will ask Father if he could find a new one for me."
ch1,"October 6th, 1783","Jamie is running wild, but she has not said one word to him."
ch5,"February 1st, 1784",I’ve heard the stories of those who have tried.
ch1,"October 6th, 1783",The lake is huge and the waves are enormous and the boat we are sailing in is so very small!
ch5,"February 1st, 1784",I whipped around and there was Danny grinning like a great booby.
ch5,"February 1st, 1784",Even Grannie was speechless.
ch1,"October 6th, 1783",They are going to settle in a big town in Québec called Montréal.
ch13,"October 3rd, 1784",I knew that many of the soldiers’ families have been coming up during this past summer and I supposed his might as well.
ch2,"November 1st, 1783",She fusses and will not feed or eat the warm sops that Mother makes for her.
ch1,"October 6th, 1783","It will not last the night, though."
ch3,"December 1st, 1783","The whole cabin smells of hot, wet wool."
ch2,"November 1st, 1783","I keep thinking of the way she used to gurgle and smile at me …
I have to stop writing."
ch8,"May 2nd, 1784","They did give him ammunition, though, so he will be able to hunt."
ch9,"June 1st, 1784","When we put in to shore for our noon meal we are immediately attacked by the black flies and mosquitoes, and the flies descend in such droves to cover our food that it is hard to take a bite without crunching down on one of them."
ch2,"November 1st, 1783",More good news is that the cabin we have been allotted is very close to the Ross family’s.
ch1,"October 6th, 1783",But maybe it is not.
ch5,"February 1st, 1784","He did lecture me soundly, however, and made a point of walking home with me after school to tell the whole family about my “unseemly” behaviour."
ch1,"October 6th, 1783","“Thank you for trying, Mary,” she said to me, “but you’d better give her back."
ch2,"November 1st, 1783","We attempt to dry our clothes out by the fire, but they are still damp in the morning."
ch2,"November 1st, 1783","We are making do, that’s what is important."
ch1,"October 6th, 1783","Mother and Father were sleeping under a tarpaulin with baby Margaret, and Grannie was tucked away in a kind of tent that Father sets up for her."
ch8,"May 2nd, 1784","We had been promised more clothing, too, but it seems that the difficulties of distributing clothing are too great."
ch7,"April 6th, 1784",I just discovered it yesterday.
ch7,"April 6th, 1784",I held my breath while the women took their places and set the younger girls to threading needles.
ch1,"October 6th, 1783",I had not realized how much his presence reassured me.
ch1,"October 6th, 1783",Poor little Jamie will be loaded down with as much as he can bear.
ch1,"October 6th, 1783","He admits now that he has been very worried as to whether we were on the right track or not, and John knows this country."
ch2,"November 1st, 1783","Then just keep your eyes lowered and walk out with me.”
“We never believed it would work, but it did!” Angus said."
ch2,"November 1st, 1783",It must be so hard for him to see all of us so happy when he had to leave his family behind in Albany — but something tells me there is more to it than that.
ch1,"October 6th, 1783","Mrs. Ross is particularly distressed, Hannah says."
ch3,"December 1st, 1783",No wonder Mother is so sad.
ch1,"October 6th, 1783",An Indian has just walked into our campsite!
ch1,"October 6th, 1783",They lifted my dear father up and sat him on a mule — backwards!
ch5,"February 1st, 1784","Just as suddenly, it slipped out of her grasp and fell to the floor."
ch3,"December 1st, 1783",We will take as many as we can over to the Livingstones’ to reciprocate for the fine Christmas dinner they gave us.
ch1,"October 6th, 1783",I’ve never heard them argue so before.
ch13,"October 3rd, 1784","“No,” he answered, and would say no more."
ch1,"October 6th, 1783",She said she had to make me take notice of her because her mother had threatened to muzzle her if she didn’t be quiet.
ch12,"September 6th, 1784",Jamie has been set to winding the wool onto the niddy noddy as she spins it.
ch7,"April 6th, 1784",The whole hall was packed and shaking.
ch14,"November 1st, 1784",They have brought three rabbits that they snared.
ch9,"June 1st, 1784",Bloodroot for sore noses.
ch2,"November 1st, 1783",Grannie was able to make a nice mush for Margaret but she was so fussy she wouldn’t eat it.
ch11,"August 2nd, 1784",No sooner were we settled in than Grannie insisted on planting her lilac bush.
ch2,"November 1st, 1783","Instead, when she unrolled her bundle, there were two dresses and shawls in there."
ch3,"December 1st, 1783","It made my heart ache to look at her, it just brought back so many thoughts of baby Margaret."
ch10,"July 2nd, 1784","It was very amusing to see him nip them off so delicately, one by one."
ch4,"January 1st, 1784",The fever seems to be lessening.
ch12,"September 6th, 1784","But there is something about him … Even when he’s dancing, his mouth is laughing, but his eyes are sad."
ch3,"December 1st, 1783","There are quite a few Scottish families here, so Hannah and I and the other Scottish children will be going singing at the doors of every house, just as we used to do in Albany."
ch12,"September 6th, 1784","Mind you, Hannah is not sleeping in it."
ch2,"November 1st, 1783",Most of its leaves have fallen off and I’m afraid it might be dead.
ch12,"September 6th, 1784",We must have boundless quantities of food on hand.
ch5,"February 1st, 1784",My life has settled down into such a routine — sometimes I even forget that I haven’t lived here forever.
ch1,"October 6th, 1783",She has the most beautiful long curly hair.
ch1,"October 6th, 1783","In fact, she was always singing, and we loved to sing with her."
ch1,"October 6th, 1783",I had to tell him a story to settle him back down.
ch2,"November 1st, 1783",But cold.
ch3,"December 1st, 1783","I just stood in the doorway and sniffed until Grannie gave me a push and said, “What ails you, child?"
ch1,"October 6th, 1783","I feel like a feather bed that’s been shaken out, turned upside down and jumped on."
ch2,"November 1st, 1783",I was very glad to hand her back to Mother to be fed this evening.
ch2,"November 1st, 1783",I am frightened for her.
ch1,"October 6th, 1783","There are five sailors manning the boat: four to row and one to steer, but the sailors are happy because the wind is so strong that they can run with the sail up and do not have to row."
ch13,"October 3rd, 1784","Now that there is not so much work to do in the garden, I have been knitting and knitting and knitting."
ch9,"June 1st, 1784","(And Laddie, when Grannie is not looking.)"
ch1,"October 6th, 1783",She sounded as if she had been frightened worse than I.
ch13,"October 3rd, 1784","The pigeons are migrating and great flocks of them are flying by every day, so Father made a trap for them."
ch11,"August 2nd, 1784",Father is making furniture for us.
ch5,"February 1st, 1784",He was rubbing at his cheek and his face looked tired and drawn with pain.
ch2,"November 1st, 1783","“Merci,”
 we said, and the woman fairly beamed back at us."
ch6,"March 3rd, 1784",Hannah came out today to sit in front of her cabin and we just soaked up the sunshine.
ch10,"July 2nd, 1784",Angus is so enthusiastic about starting out all over again here in Canada.
ch1,"October 6th, 1783",There were times the last two days when I did not think I could walk another step.
ch2,"November 1st, 1783","Québec
We are following alongside the Richelieu River."
ch1,"October 6th, 1783",Thank goodness the feather tick was on top or we would have been jounced right off.
ch1,"October 6th, 1783",I wonder if he is from one of the homesteads we passed by today?
ch1,"October 6th, 1783",She is so distraught and her eyes look so empty.
ch1,"October 6th, 1783",I even thought I saw eyes gleaming out of the blackness.
ch1,"October 6th, 1783",That’s where the families of soldiers in Sir John Johnson’s King’s Royal Regiment of New York — Angus’s regiment — are supposed to meet up.
ch10,"July 2nd, 1784",There wouldn’t be anyone left who wouldn’t hate him.
ch2,"November 1st, 1783","It doesn’t look one bit different from America, but the land is not as mountainous as it was at the southern end of the lake."
ch1,"October 6th, 1783",Grannie is napping in her shelter.
ch1,"October 6th, 1783",Her voice was angry.
ch2,"November 1st, 1783","Mother puts stones on the hearth to heat up and Jamie and I take one each, wrapped in a rag, when we go to bed."
ch6,"March 3rd, 1784",Mr. Mitchell closed down the school and the whole community turned out to help.
ch1,"October 6th, 1783","“They gave me as low a price as they could get away with.”
“Even for Blue and Bess?” she asked."
ch2,"November 1st, 1783",We have a small barrel full.
ch1,"October 6th, 1783",It was all I could do to hold Jamie down.
ch5,"February 1st, 1784","Dear Canada: With Nothing But Our Courage
February 1784
Another month begun."
ch6,"March 3rd, 1784","The best part as far as I’m concerned, of course, is scooping the syrup out of the kettles and throwing it onto the snow to harden into taffy."
ch1,"October 6th, 1783","She looked stricken, not at all like the smiling girl I met yesterday."
ch1,"October 6th, 1783","I suppose I get my size from Grannie — or lack of size, I should probably say."
ch12,"September 6th, 1784",My leg is still unbelievably painful but we had the best surprise today.
ch2,"November 1st, 1783",The rain has stopped but we are still damp and dripping.
ch1,"October 6th, 1783",It must be so beautiful around our house.
ch10,"July 2nd, 1784","There is not much Mother and Jamie and I can do to help them with that, but we can help them pull the logs over to the cabin site."
ch2,"November 1st, 1783",Her poor mother was busy trying to round up Mrs. Denny’s three little treasures and could not keep an eye on her.
ch1,"October 6th, 1783",So did the rub.
ch13,"October 3rd, 1784","To lose your country is bad enough, but to lose your family as well!"
ch2,"November 1st, 1783",His eyes look very sad.
ch1,"October 6th, 1783",And the smell of the burned out cornfield was in our noses the whole time.
ch1,"October 6th, 1783",Father gave it to me for my twelfth birthday and I’ve not written in it yet.
ch13,"October 3rd, 1784",Probably we will give them English names.
ch9,"June 1st, 1784",Now I’m remembering old Blue and missing him.
ch10,"July 2nd, 1784",Finally we were able to set up the tents.
ch11,"August 2nd, 1784","He is building bunks against the walls for Jamie and me up in the loft, and two larger beds in the main room for Mother and himself and for Grannie."
ch3,"December 1st, 1783","Of course, once we leave Machiche, there is no telling when we will find another school."
ch1,"October 6th, 1783",At least Father is allowing Jamie to keep Laddie.
ch1,"October 6th, 1783","We cannot take old Blue, nor Bess — not even the chickens!"
ch1,"October 6th, 1783","Fort Niagara, where they are going, is far to the west of here and they have just been travelling with us until the river turned and they could turn with it."
ch1,"October 6th, 1783","We’ve been on the move for two days now, heading north, and I am bone weary and sick to death."
ch2,"November 1st, 1783","I see Mother trying to feed her now, but Margaret is just crying and crying."
ch1,"October 6th, 1783",Grannie insisted on digging up a piece of the lilac bush that grows in our doorway.
ch2,"November 1st, 1783","He was looking back, too."
ch2,"November 1st, 1783",There are two soldiers walking alongside him.
ch14,"November 1st, 1784","“Thank you,” he said."
ch7,"April 6th, 1784","I was seated next to Mother and for the first time since we were forced out of our home, I saw her face relax and soften."
ch1,"October 6th, 1783",But I won’t let myself think of that.
ch2,"November 1st, 1783",I do hope we will be able to stay together.
ch3,"December 1st, 1783","“Here, child,” she said, and gave me a small square of embroidered linen."
ch1,"October 6th, 1783",Wolves and bears.
ch1,"October 6th, 1783",I was certain a hundred Indians were watching my every move.
ch1,"October 6th, 1783","Later
Father came back late tonight."
ch2,"November 1st, 1783",Put these dresses on over those uniforms and cover your heads with the shawls.
ch9,"June 1st, 1784",What in the world does that mean?
ch1,"October 6th, 1783",We are in the woods with hardly any shelter.
ch1,"October 6th, 1783","Later
I must just add this one bit, although I am now snuggled down under my blanket and can barely see to write."
ch7,"April 6th, 1784",He made it for her and was very proud of it.
ch1,"October 6th, 1783",How can they call themselves Christians and do such a thing to us?
ch13,"October 3rd, 1784","Mr. Murchison asked Father if he would consider it, but he hardly needed to pose the question."
ch9,"June 1st, 1784",This is actually a very pleasant way to travel.
ch12,"September 6th, 1784",He says he will go out with the Indians again so we will have a good supply of fresh fish from now on and we can salt some down for the winter.
ch1,"October 6th, 1783","Grannie is the only one of us born in Scotland, and she came here as a babe in her mother’s arms, but she still has a burr to her voice."
ch3,"December 1st, 1783","And there 
were
 presents!"
ch3,"December 1st, 1783",He banks it every night and covers the coals with ashes.
ch8,"May 2nd, 1784","Only one small spray of blossoms, but that spray is large enough that the spindly stem it is on is bent almost to the ground."
ch12,"September 6th, 1784","The Stantons and the Hooples came too, and I was glad to see Annie and Flossie, though not as glad as I was to see Hannah."
ch3,"December 1st, 1783",Janet says her mother has promised us all a quilting bee in the spring as soon as they are ready to put it together.
ch2,"November 1st, 1783",That is the only word for it.
ch8,"May 2nd, 1784","Jamie and the Ross boys, of course, are doing their best to add to it."
ch1,"October 6th, 1783","“John told me.”
I had never seen a big waterfall before and was quite anxious to reach it."
ch13,"October 3rd, 1784",We are a sturdy folk.
ch11,"August 2nd, 1784",We have sacrificed one of the blankets we were issued to hang in the doorway for now.
ch13,"October 3rd, 1784",It is so beautiful!
ch1,"October 6th, 1783",It’s hard to believe she is Father’s mother; she is so tiny and wiry and Father is so tall.
ch10,"July 2nd, 1784","After much conniving, Uncle Andrew and Uncle Allan managed to get land near ours."
ch12,"September 6th, 1784",If there had not been so much to do today I warrant she would have been spinning away already.
ch1,"October 6th, 1783","They still hurt, though, and I’m bruised all over from being jounced around so in the wagon when I couldn’t walk any more."
ch9,"June 1st, 1784",I reached out to her but before I could say anything she gave herself a shake and straightened up.
ch3,"December 1st, 1783",I teased Hannah about it when we were eating our lunch but she blushed and got quite annoyed with me.
ch1,"October 6th, 1783",“Why can we not just keep our wagon and make our way north by the road?” Mother pleaded when he broke the news to her.
ch5,"February 1st, 1784","Laddie is curled up as close to him as he can get, and the smell of hot wet dog is pretty strong."
ch5,"February 1st, 1784",I’m sure the weather was never this dreadful back home.
ch10,"July 2nd, 1784","I asked him if he didn’t miss Albany at all and he just said, “Not a bit.” I don’t really believe him, but I guess he sure wouldn’t want to go back after having fought on the British side."
ch1,"October 6th, 1783",People we used to call friends.
ch12,"September 6th, 1784","Soon we will have a proper road joining us to the Rosses and then, I hope, we’ll get a road all the way into Johnstown."
ch1,"October 6th, 1783","Father knew what to do, however."
ch4,"January 1st, 1784",When I visited her today she was flushed and feverish and hardly even knew I was there.
ch7,"April 6th, 1784","There we will transfer into more 
bateaux
 and set off farther upriver."
ch1,"October 6th, 1783","Finally, in the early afternoon, John signalled a halt."
ch1,"October 6th, 1783",It is all very frightening and confusing.
ch5,"February 1st, 1784","“Canada is our country now,” he said finally, “We belong here."
ch1,"October 6th, 1783",Father didn’t answer.
ch1,"October 6th, 1783","Tam is a quiet little mouse of a thing, but very sweet."
ch7,"April 6th, 1784",Mr. Mitchell is having a terrible time trying to keep order in school.
ch1,"October 6th, 1783",We have to stop to rest very often.
ch1,"October 6th, 1783",I hope I don’t drown!
ch3,"December 1st, 1783",I miss baby Margaret and keep remembering all of her sweet little ways.
ch3,"December 1st, 1783","Back in Albany the English would bring in a huge log — a yule log, they call it — and they kept it burning for the twelve days of Christmas."
ch5,"February 1st, 1784",Then Mr. Walker took out his pocketknife and began to pry at the tooth with it.
ch1,"October 6th, 1783",But he never thought rebellion was the answer.
ch3,"December 1st, 1783",It is my birthday today.
ch5,"February 1st, 1784","It was sleety and rainy all last night, and this morning the snow was covered with a layer of ice."
ch9,"June 1st, 1784",Johnstown is no more than a collection of tents strewn along the riverside.
ch13,"October 3rd, 1784",What a lot has happened since then.
ch3,"December 1st, 1783",There was so much smoke it made us choke.
ch8,"May 2nd, 1784",The sound of the river is in my ears as I write and I can see the moonlight shining off its waters.
ch2,"November 1st, 1783","I certainly hope I am wrong this time, though."
ch5,"February 1st, 1784",I am very very tired of being cold.
ch13,"October 3rd, 1784",What riches!
ch7,"April 6th, 1784",I think I will just lie here in the dark and remember every moment of the day and night.
ch1,"October 6th, 1783",Jamie has just come over to nudge me and get my attention.
ch2,"November 1st, 1783",When she saw Angus I thought she would fall down in a dead faint.
ch1,"October 6th, 1783",No one to tell me what is going to happen.
ch13,"October 3rd, 1784","It was Mr. Murchison, our preacher, and as it was Sunday, he held services with us in our house."
ch5,"February 1st, 1784",Poor Father.
ch1,"October 6th, 1783","He’s been letting us feed him by hand today, and I guess he’s finally decided we’re friends."
ch2,"November 1st, 1783",She hasn’t stopped smiling since.
ch10,"July 2nd, 1784","“We must have good shelter and at least some food of our own,” he says."
ch12,"September 6th, 1784",Now if I could only go back to school I would be happy.
ch1,"October 6th, 1783",As if I weren’t wet enough already.
