chapter_id,date,sentence
ch10,"July 2nd, 1784",Father says that some officers have been registering their children as officers so that they may receive a larger grant.
ch1,"October 6th, 1783","Grannie has always been grumpy, but now she really glowers."
ch10,"July 2nd, 1784",We will start clearing land for wheat and corn and flax next year.
ch1,"October 6th, 1783","Not all girls went to school, but Father insisted that I should and I was glad of it."
ch3,"December 1st, 1783",I certainly would never be friends with Lizzie Crane again.
ch10,"July 2nd, 1784","Jamie whistled and I called, but to no avail for the longest time."
ch5,"February 1st, 1784","“And be quick about it.”
Jamie and I scurried up the ladder, but then lay quiet as mice and watched what went on below."
ch13,"October 3rd, 1784","“You see, Mary …” he said finally, then he stopped and drew a very big breath."
ch13,"October 3rd, 1784",I would like to meet their wives and children.
ch8,"May 2nd, 1784","Captain Jacob Maurer is in charge and he has been busy all winter, so we have been told, building 
bateaux
 and procuring other boats from wherever he can find them."
ch3,"December 1st, 1783","It was a pretty, soft yellow colour."
ch5,"February 1st, 1784",I just counted up.
ch2,"November 1st, 1783",It was very comforting.
ch4,"January 1st, 1784","Warmth and comfort for the whole year to come, the first-foot brings."
ch2,"November 1st, 1783",The neighbours have been very helpful.
ch2,"November 1st, 1783",Father taught Jamie and me the French word for thank you.
ch12,"September 6th, 1784","They and some of the other men will help us clear more acreage, and girdle the trees too big to chop down, by cutting a strip of bark out all around them, so they will die over the winter."
ch13,"October 3rd, 1784","When we were torn apart it must near have torn her apart, too.”
“Do you suppose your father and brothers know she helped you escape?”
“I doubt it,” he answered."
ch1,"October 6th, 1783","“We’ll do just fine.”
I leaned into his arms and let myself sink into the strength and the warm good smell of him."
ch7,"April 6th, 1784",And yes!
ch13,"October 3rd, 1784",I was much impressed.
ch1,"October 6th, 1783",Smashing!
ch3,"December 1st, 1783","Mother did not have raisins or currants for a cake, but she made Lumpy Dick and we had that with maple syrup."
ch10,"July 2nd, 1784","“Your berries, Jamie!” I shouted."
ch5,"February 1st, 1784","“We can go home, that is what we can do,” Mother answered."
ch1,"October 6th, 1783",Now she grizzles and cries most of the time.
ch1,"October 6th, 1783","We don’t want filthy Tories in this town!” Although the word they used was not “filthy.” Grannie turned crimson red and
By the light from the campfire
My hands are shaking so that I can hardly write and I’ve made so many blots I can hardly read what I have written."
ch8,"May 2nd, 1784",It is really quite pleasant after the dirt and confusion of the camp at Lachine.
ch3,"December 1st, 1783",Hannah says her mother and father have told her the same.
ch1,"October 6th, 1783",We are making our way through heavy woods and the track is rough and narrow.
ch1,"October 6th, 1783",Bess lolluped along behind us and bawled every step of the way with indignation.
ch3,"December 1st, 1783",Hannah was here at the crack of dawn to fetch a shovelful of coals.
ch12,"September 6th, 1784",I looked up and there were two Indians!
ch5,"February 1st, 1784","We can never go back.”
Mother stared at him for one long moment, then she let out a cry and ran into their room."
ch2,"November 1st, 1783",They brought over johnnycake and bread and oatmeal for porridge.
ch5,"February 1st, 1784","“Back where we belong.”
“Where we 
belong?”
 Father burst out."
ch3,"December 1st, 1783",I recognized the squares that came from baby Margaret’s blanket.
ch3,"December 1st, 1783","Father looked disapproving, but only said that sometimes strapping is necessary."
ch1,"October 6th, 1783",There are other animals about that are not so harmless.
ch2,"November 1st, 1783",Hannah was sitting on the other side of me and I taught her the words.
ch7,"April 6th, 1784",No one chose to speak of the war.
ch3,"December 1st, 1783","All in all, it was a feast!"
ch4,"January 1st, 1784","She is much recovered, and we spent a cheerful hour just talking."
ch2,"November 1st, 1783",This river is most certainly the biggest I have ever seen.
ch10,"July 2nd, 1784",It seems that some people are very greedy.
ch14,"November 1st, 1784","We will have to husband our supplies very carefully to get through this winter, but I am certain we will make it."
ch10,"July 2nd, 1784",She even rested her head on his shoulder.
ch10,"July 2nd, 1784","I don’t care how much work it is going to be, I just want us to be happy again!"
ch1,"October 6th, 1783",They have distributed tarpaulins for shelter and we have made ourselves quite comfortable.
ch12,"September 6th, 1784",At least no one but me sees my legs.
ch3,"December 1st, 1783",It was so much fun.
ch1,"October 6th, 1783","I am toughening up, I think, and do not get so tired."
ch3,"December 1st, 1783","And so lonely without William, Angus and Margaret."
ch1,"October 6th, 1783","When I told him Angus was off to fight with the British army he thought that a great lark, and went about for days with a stick over his shoulder, pretending to be a soldier."
ch1,"October 6th, 1783",I was much more enthusiastic about saying grace tonight!
ch1,"October 6th, 1783",Father has just returned with very welcome news.
ch1,"October 6th, 1783","He did find a boat, but it is too small to take our wagon!"
ch1,"October 6th, 1783",He will die of the shame of this.
ch1,"October 6th, 1783",Her lilac bush is still alive.
ch1,"October 6th, 1783",The weather was sunny today and any other time I would have enjoyed it enormously.
ch6,"March 3rd, 1784",I had to because the penalty was that I would have to give him a kiss if I couldn’t.
ch12,"September 6th, 1784",Much nicer than heavy old boots.
ch6,"March 3rd, 1784","Oh, what if she is allowed to quilt and I am not?"
ch1,"October 6th, 1783",How I have missed him.
ch3,"December 1st, 1783",There are two other girls the same age as us.
ch12,"September 6th, 1784",Some of it splashed onto my leg and burned it badly.
ch10,"July 2nd, 1784",Harder work than I’ve ever done in my life.
ch1,"October 6th, 1783",He was on it in a split second and wolfed it down.
ch1,"October 6th, 1783",They pulled Father out of the house and dragged him down the path.
ch1,"October 6th, 1783",We’d tied Bess onto the back and she was bellowing because we hadn’t milked her.
ch10,"July 2nd, 1784","After seeing how quickly that fire spread when we were on our way here, even when the ground was still wet, I can certainly agree."
ch10,"July 2nd, 1784",I was given the job of picking them out.
ch4,"January 1st, 1784",I think she worries that I might take the fever next.
ch2,"November 1st, 1783",The Rosses all came over to make Angus’s acquaintance.
ch2,"November 1st, 1783",Father encourages us on.
ch10,"July 2nd, 1784",I would not be surprised at all if he is doing a bit of clearing at his place.
ch2,"November 1st, 1783",Grannie is demanding a spinning wheel but Father says that will have to wait until we are settled permanently.
ch1,"October 6th, 1783",The track from here on looks very rough and narrow and not well-travelled.
ch12,"September 6th, 1784",Father is making Mother a new quilting frame and Grannie says it is high time that I started making quilts for my marriage.
ch6,"March 3rd, 1784","That dim-witted Danny Snyder made me a wager that I couldn’t, but I did."
ch1,"October 6th, 1783",Now Father is building a fire and Mother is hanging clothes and blankets up on bushes to dry out.
ch13,"October 3rd, 1784",It sits halfway up a small hill and the creek runs down behind it over a small waterfall.
ch4,"January 1st, 1784","There stood Uncle Allan Ross, holding a loaf of bread and a pail full of burning coals to add to our fire."
ch1,"October 6th, 1783",“Get out of here!” she screamed at the men.
ch8,"May 2nd, 1784",Mr. Mitchell has given up trying to hold classes.
ch1,"October 6th, 1783",Now Jamie is trying to get Laddie to fetch a stick.
ch1,"October 6th, 1783","We were just getting ready to leave, after a quick breakfast, when those same men turned up again."
ch1,"October 6th, 1783",There is a sandy beach below me and Jamie is in his glory.
ch2,"November 1st, 1783",She took one look at the pair of them and told them she was going to get them out of there by hook or by crook.
ch1,"October 6th, 1783",Father shot two partridges and they are roasting on a spit over the fire.
ch2,"November 1st, 1783","Grannie has insisted on carrying her lilac bush, even though I offered, and it is looking very bedraggled."
ch1,"October 6th, 1783",Jamie is besotted with the dog.
ch1,"October 6th, 1783","I think she’s right, as I pulled George away from the railing of the boat several times and no sooner had we come ashore than I found Hugh trying to braid Laddie’s tail."
ch2,"November 1st, 1783",This cabin is so small!
ch2,"November 1st, 1783",My loft is freezing.
ch3,"December 1st, 1783","The Livingstones have two young boys as well, and a baby."
ch1,"October 6th, 1783","“Surely there will be space on that boat for one small dog,” he said."
ch3,"December 1st, 1783","At first it didn’t seem to help at all, but gradually they got the fire under control before it spread to the other houses."
ch6,"March 3rd, 1784",Would you believe it?
ch1,"October 6th, 1783",We knew most of them.
ch3,"December 1st, 1783",Candles are much too precious to waste.
ch1,"October 6th, 1783",I think he realized for the first time today that we’ve really left our home and we might never see it again.
ch13,"October 3rd, 1784",I’m glad of that because I do love to cuddle her.
ch3,"December 1st, 1783",It smelled so bad!
ch1,"October 6th, 1783","I stopped writing yesterday because just as I was going to say “and put her hands over Jamie’s ears,” I smelled burning."
ch2,"November 1st, 1783","It was filthy, Angus said."
ch4,"January 1st, 1784",They are certain she is going.
ch3,"December 1st, 1783",No presents here.
ch1,"October 6th, 1783","I am so mixed up and confused and just plain desperate and my head aches 
so
 badly."
ch1,"October 6th, 1783","When she told me this, Hannah began to cry."
ch3,"December 1st, 1783",I didn’t know how I was going to go back and face Janet.
ch3,"December 1st, 1783",Mr. Mitchell gave me another bottle of ink yesterday.
ch1,"October 6th, 1783",I cannot stand it!
ch1,"October 6th, 1783","Surely the Lord will forgive him, but I don’t think Grannie will."
ch10,"July 2nd, 1784",Then Mother gave herself a kind of shake and pursed her lips.
ch3,"December 1st, 1783",The Rickles had an enormous tree and we children all went over on Christmas Eve to watch them light the candles.
ch1,"October 6th, 1783","She tried her best to dissuade him, but off he would go."
ch1,"October 6th, 1783","There Father hopes we will meet up with Angus, but he doesn’t seem to know what we will do after that."
ch12,"September 6th, 1784",My leg is much better and I am able to hobble around now.
ch2,"November 1st, 1783",Grannie was not trying to soothe or rock her.
ch1,"October 6th, 1783","It seems that he and his people have been driven from their lands, too, because they fought on the British side, just the way Angus and the other Loyalists did."
ch12,"September 6th, 1784","Here is what he brought:
– more tools for Father, including a good saw (It will be most useful for cutting down the girdled trees next spring, not to mention making a door!)"
ch3,"December 1st, 1783",It seems so unfair that her life should have been so short.
ch12,"September 6th, 1784","With Mr. Mitchell off in Cataraqui, I don’t see where they could find anyone else."
ch9,"June 1st, 1784","Mother is busy organizing the food and supplies that we have been given, but every once in a while she just stops and gazes out at the forest all around us with a despairing look."
ch3,"December 1st, 1783",Of course we all piled out to see what was going on.
ch1,"October 6th, 1783","Too much is going on for her to bear, I think."
ch3,"December 1st, 1783",Some of the settlers have learned from the Indians how to make moccasins — perhaps we will as well.
ch1,"October 6th, 1783",Most everything we own is drenched.
ch4,"January 1st, 1784",We begin to have a little hope.
ch7,"April 6th, 1784",His battalion will be disbanded in June at Cataraqui and then he will be free to join us at Johnstown.
ch2,"November 1st, 1783","Father and Angus are still talking, in fact, but I must go to sleep."
ch1,"October 6th, 1783",I’ve never seen him so angry.
ch1,"October 6th, 1783","Whenever I complain out loud about anything, Grannie is quick to jump on me."
ch1,"October 6th, 1783",He whines from morning until night until sometimes it is all I can do not to slap him.
ch6,"March 3rd, 1784","They can barely manage one bucket apiece, and not even that if they’re very full."
ch2,"November 1st, 1783",I know.
ch1,"October 6th, 1783",Mother is calling me.
ch1,"October 6th, 1783","It would take us weeks to reach Sorel, maybe months, and we would not be able to make it before the winter snows set in.”
“But we can’t just leave everything here!” Mother cried."
ch3,"December 1st, 1783","The nights are 
cold
 here."
ch1,"October 6th, 1783","We knelt side by side, watching Father and the Indian."
ch1,"October 6th, 1783",Jamie has given up and run to retrieve the stick himself.
ch1,"October 6th, 1783","Even if we are given land, he has no idea where it would be, or what it would be like."
ch3,"December 1st, 1783",Mr. Murchison preaches very long sermons.
ch13,"October 3rd, 1784",It is quite neatly done if I do say so myself.
ch3,"December 1st, 1783","She is still very despondent, though, and Grannie is twice as bossy to make up for it."
ch3,"December 1st, 1783","No one has ever been able to best me at reading, spelling or ciphering, but Hannah is just as good as I am and, I must admit it even though it galls me to do so, she can out-spell me!"
ch6,"March 3rd, 1784","It had been boiling all day and we watched it slowly change from a pale, watery sap to a rich, dark golden colour."
ch5,"February 1st, 1784","Well, you’ve never heard such howling."
ch7,"April 6th, 1784",The first we have heard from him since the winter.
ch1,"October 6th, 1783","The British had promised to restore their lands to them after the war’s end, but instead they gave them to the Americans."
ch13,"October 3rd, 1784","Grannie did not go, but the rest of us did, Laddie too, of course."
ch1,"October 6th, 1783",Molly seems to take after her mother.
ch8,"May 2nd, 1784",Tomorrow!
ch6,"March 3rd, 1784",We made syrup and sugar as well and there will be enough for all of us.
ch3,"December 1st, 1783","Hannah and I went together the first day, of course."
ch2,"November 1st, 1783","Angus gave him a concerned look, then continued with the story, but in a more subdued tone of voice."
ch10,"July 2nd, 1784","Without really thinking about what I was doing, I threw my berry pail and all its contents onto the trail."
ch1,"October 6th, 1783",Mother and Grannie packed bags and bags of food and provisions.
ch5,"February 1st, 1784",Grannie sends soups and broths over to her with me every time I visit.
ch13,"October 3rd, 1784","The times ahead will be just as hard, I am certain of it, but I look around me and see a home and the beginnings of gardens and fields in what was, just a few short months ago, nothing but forest."
ch2,"November 1st, 1783","Then, one day, Mrs. Morrison didn’t bring their bedding back."
ch2,"November 1st, 1783",She is by far the nicest person I have ever known.
ch2,"November 1st, 1783","He and Mr. Ross — Uncle Andrew, he has told us to call him, and Mrs. Ross will be Aunt Norah — have cut it all up."
ch1,"October 6th, 1783","In fact, it’s very peaceful to walk along the track and listen to the birds singing and twittering in the trees high above us."
ch1,"October 6th, 1783",This is where we must part company with John and his band.
ch1,"October 6th, 1783","We are thankful, though, that there has not been more rain, as otherwise we would be in ruts and mud right up to the wagon’s axles, and the streams we have to cross now and then would be flooding."
ch1,"October 6th, 1783",Canada must certainly be a long way away.
ch5,"February 1st, 1784",What a scare!
ch3,"December 1st, 1783",Hannah and I tore over to see what was happening.
ch14,"November 1st, 1784","I would have turned and scampered back up immediately, but he caught me by the arm before I could do so."
ch9,"June 1st, 1784","The first time we went through rapids I was quite frightened, certain that all the boats were going to be lost."
ch1,"October 6th, 1783",I’m very glad we didn’t burn our house when we left.
ch11,"August 2nd, 1784","It looks tiny and pathetic, but it also looks like it’s there to stay."
ch1,"October 6th, 1783","“Get out!”
Then she put her arms around Father and he just kind of slumped against her."
ch1,"October 6th, 1783",“I left dozens of jars in our wagon.
ch8,"May 2nd, 1784",Next week.
ch5,"February 1st, 1784","We have nothing left in that new 
United States of America
, Fiona."
ch12,"September 6th, 1784",They didn’t seem to mind the weevils.
ch1,"October 6th, 1783",I wonder that Father knows where to go.
ch3,"December 1st, 1783",I smell snow in the air again.
ch1,"October 6th, 1783",She is still Grannie.
ch2,"November 1st, 1783",The soldier who was with him.
ch5,"February 1st, 1784",Poor Father!
ch9,"June 1st, 1784","The other Loyalist men help as well, and Father is always right in there with them."
ch6,"March 3rd, 1784",We are going for certain.
ch7,"April 6th, 1784","“Do you not wish ever to see your own home again?” Mother asked, her voice not much more than a whisper."
ch1,"October 6th, 1783",This was their schoolhouse as well as ours.
ch2,"November 1st, 1783",I am rather relieved about that.
ch2,"November 1st, 1783",She thinks Angus very well-favoured.
ch1,"October 6th, 1783",Mr. Ross is very fat and bluff and hearty and has hair as curly as Hannah’s.
ch1,"October 6th, 1783",Finally Mother reached out to take her back.
ch14,"November 1st, 1784",Father is making a cradle for the new baby and is carving the headboard into the most intricate and delicate design of roses and leaves all twisted and twining together.
ch1,"October 6th, 1783","“Things could be worse,” she says."
ch13,"October 3rd, 1784",There are so many of them!
ch10,"July 2nd, 1784",Finally!
ch2,"November 1st, 1783",Father’s eyes were all red at supper too.
ch4,"January 1st, 1784",I do hope she will be able to come back soon.
ch11,"August 2nd, 1784",He must have shot and killed many men during the war.
ch2,"November 1st, 1783",We share it with about four other families.
ch1,"October 6th, 1783",This has to be one of the saddest days we’ve had since we had to flee from our home.
ch1,"October 6th, 1783",They came for Father this morning.
ch1,"October 6th, 1783","“You look like drowned rats,” Grannie said with a sniff."
ch1,"October 6th, 1783",Sunday again.
ch5,"February 1st, 1784","“But Mother,” I argued, “there’s a fair blizzard blowing out there.” Truth to tell, I was afraid to leave."
ch12,"September 6th, 1784",It was such fun to see the people we had come to know at Machiche last winter.
ch10,"July 2nd, 1784","Weevily or not, we will have to use it."
ch10,"July 2nd, 1784","I’m sitting on the very spot where we will build, right now as I write this, and tomorrow we will start to clear the land."
ch1,"October 6th, 1783",Grannie is the only one who doesn’t seem to have changed a whit.
ch1,"October 6th, 1783",He has made friends with several other children already and they are all barefoot and wet and covered with sand.
ch1,"October 6th, 1783","Grannie did not want to travel today because it is the Lord’s Day, but Father said we had to keep going."
ch10,"July 2nd, 1784","Cold salt pork and johnnycake for supper, but at least we are 
here
."
ch12,"September 6th, 1784","It was so hard to say goodbye to Hannah today, but now that we have a road joining our houses, I am certain we will see more of each other."
ch10,"July 2nd, 1784",He has been swimming in the creek.
ch1,"October 6th, 1783",When we stopped for the day he and Father went fishing together and Father brought us back three lovely big shad for dinner.
ch12,"September 6th, 1784","We had set up logs and stumps to sit on in the clearing outside the cabin, and a vat of soft soap beside tubs of water which Hannah and I and the other girls had hauled up from the creek."
ch6,"March 3rd, 1784",We all just munched and munched on it — even the adults.
ch13,"October 3rd, 1784","“There’s nothing to be done about it,” he answered."
ch12,"September 6th, 1784","We had been assured that they were friendly, however, and willing to share their land with us, so we were not frightened when these two appeared."
ch3,"December 1st, 1783",I think I had better not tease her again.
ch13,"October 3rd, 1784",And to know that you will never see them again.
ch6,"March 3rd, 1784","Hannah was even more disappointed than I, she had been looking forward to going out so much."
ch11,"August 2nd, 1784",Before we ate we all joined hands around the table and gave thanks to God for all we have.
ch2,"November 1st, 1783","Mr. Denny is a dour, unfriendly man."
ch12,"September 6th, 1784","Dear Canada: With Nothing But Our Courage
September 1784
What a surprise today."
ch8,"May 2nd, 1784",My stockings have been darned and mended until they are stiff.
ch1,"October 6th, 1783",We packed the wagon all night with everything that we could fit into it.
ch10,"July 2nd, 1784","Now Mother has forbidden us to go berry picking anywhere except right near the cabin, so I suppose that will mean no more blueberries for us, as they only grow in the cleared, rocky spots down near the river."
ch1,"October 6th, 1783","There is no roof or shelter of any kind, so we are praying that it does not rain."
ch2,"November 1st, 1783",There was much to be thankful for.
ch3,"December 1st, 1783",How could I be a heathen when I go to church services every Sunday?
ch6,"March 3rd, 1784",This time I’m going to quilt!
ch3,"December 1st, 1783",I’m not that fond of salt pork — and getting less and less fond of it — but I do love smoked ham.
ch1,"October 6th, 1783","We’re escaping to British Canada, Father says."
ch10,"July 2nd, 1784","My hands are so calloused and rough that it hurts me to help her wash up after, though."
ch10,"July 2nd, 1784",This settling of lots was a very complicated affair involving a lot of noise and shouting.
ch10,"July 2nd, 1784",I think he thinks he is her mother now.
ch1,"October 6th, 1783",Hannah is as sick as I am; so are all her family.
ch13,"October 3rd, 1784","“But everyone here hates the rebels, and with good cause.”
“Why did —?” I began, but I bit the words back as soon as they were out of my mouth."
ch11,"August 2nd, 1784",Those dratted stumps do come in handy for some things.
ch1,"October 6th, 1783",I could hear this roaring noise that was getting closer and closer.
ch9,"June 1st, 1784",Sometimes wormwood is used instead.
ch4,"January 1st, 1784","The two boys were so rambunctious, though, that Aunt Norah turned them out of doors to find wood for kindling."
ch2,"November 1st, 1783","By morning they are cold again, though."
ch2,"November 1st, 1783","Mother and Grannie have not said anything, but they have worried looks on their faces when they tend to her."
ch12,"September 6th, 1784",Then they set to clearing out more bush and trees.
ch1,"October 6th, 1783",Now I can write more of what has been happening these past days.
ch1,"October 6th, 1783",As if the air had been let out of him.
ch9,"June 1st, 1784","“Generous indeed,” she burst out."
ch2,"November 1st, 1783",I happened to be watching her and was just about to reach out and pull her back when splash — over she went!
ch5,"February 1st, 1784",Mr. Mitchell practically dragged me into the schoolroom.
ch7,"April 6th, 1784",He is an excellent carpenter and much in demand here.
ch5,"February 1st, 1784","“Then up to the loft,” Mother said."
ch1,"October 6th, 1783","The lake looks to me to be very wide here, but Father says this is still only the narrow part."
ch1,"October 6th, 1783","“Here, lass, this will take the pain away,” she said and gave my forehead a rub."
ch1,"October 6th, 1783","It is so awful I cannot bear it, but I am so full of grief and anger and just plain disbelief that if I do not let it out I will die!"
ch9,"June 1st, 1784","It is still frightening, but so far we have managed without mishap."
ch1,"October 6th, 1783","They are big, but very gentle."
ch1,"October 6th, 1783","It is a very small piece and she has it in a little pot, wrapped in burlap and soaking wet."
ch9,"June 1st, 1784","It tastes 
terrible!"
ch11,"August 2nd, 1784","Angus and Duncan are now starting to build shanties of their own on their own properties, but until they are done they will continue to live in their tents."
ch6,"March 3rd, 1784","That is a nuisance, but I am feeling so light and happy that I can put up with it."
ch2,"November 1st, 1783",He was imprisoned with Angus and it was his mother who got them out.
ch10,"July 2nd, 1784","“Isn’t it getting late, Mary?” Jamie suddenly asked me."
ch12,"September 6th, 1784",Uncle Allan had all sorts of news to tell us.
ch1,"October 6th, 1783","Without that paper to show that we are travelling by order of our local Committee of Safety, Father says, we would have been in a lot of trouble."
ch1,"October 6th, 1783","When we broke through, what a sight there was to greet us!"
