chapter_id,date,sentence
ch3,"December 1st, 1783","We have long tables set up as desks, with benches to sit on."
ch5,"February 1st, 1784",It was up to Father to pick him up and bring him into the warmth of our cabin.
ch2,"November 1st, 1783",When I came down from the loft this morning I knew at once something dreadful had happened.
ch6,"March 3rd, 1784","It feels splendid, even though it is still freezing, and the ice on the river is beginning to show soft spots."
ch10,"July 2nd, 1784","Father would not allow Jamie to use one, much to his disgust, but set him to collecting the branches as we chopped, and piling them up."
ch1,"October 6th, 1783",It was much quieter when they were sick.
ch1,"October 6th, 1783","“I wish John had stayed with us a little longer,” I said to Father this morning, but he just smiled and gave me a hug."
ch2,"November 1st, 1783",With no wagon.
ch13,"October 3rd, 1784","I have not said so, though, as I do not wish to be teased."
ch9,"June 1st, 1784","Angus is here, and so is Duncan!"
ch13,"October 3rd, 1784",They also brought spruce and showed us how to make tea out of it.
ch13,"October 3rd, 1784","It is not much bigger than the coop Father built for our chickens and it only has a hole in the roof for the smoke to escape, instead of a proper chimney, but Angus is very proud of it."
ch7,"April 6th, 1784",A letter from Angus!
ch1,"October 6th, 1783",It is so good to have a friend again!
ch2,"November 1st, 1783",Grannie has made a poultice for her chest but it doesn’t seem to be helping any.
ch2,"November 1st, 1783","Angus said he was hoping so much that he would meet up with us here, but could hardly believe that it would happen."
ch1,"October 6th, 1783","Later
We’re camped for the night now."
ch3,"December 1st, 1783","Hannah saw, of course, because we always walk together, but I didn’t mind that."
ch13,"October 3rd, 1784",It was nice to see him again.
ch1,"October 6th, 1783","Now that we are both feeling better, Hannah and I are beginning to enjoy the sailing."
ch1,"October 6th, 1783","The lake stretched ahead for as far as I could see and the mountains rose up high on both sides of us, right down to the shore on the western side."
ch14,"November 1st, 1784",I think he is chasing rabbits in his sleep.
ch1,"October 6th, 1783",I remember when Jamie was a baby Mother sang to him all the time.
ch2,"November 1st, 1783","The slopes were covered with trees, scarred here and there with steep, bare rocks."
ch1,"October 6th, 1783",As it was he howled and raised a terrible commotion until we finally made it to the other side and onto dry land.
ch10,"July 2nd, 1784","There will be two small windows, Father says, one on either side of the door."
ch1,"October 6th, 1783","Still, he prayed for the safety of those of us about to embark on our “perilous journey.” I was glad of that."
ch3,"December 1st, 1783",I am feeling so twitchy.
ch9,"June 1st, 1784",Mother is smiling again and even Grannie is in a good mood.
ch7,"April 6th, 1784","I was really, truly happy!"
ch1,"October 6th, 1783","Finally, he stood up and left."
ch1,"October 6th, 1783","We could not see the river from where we were, but the noise of it now was so great that we could hardly hear each other speak."
ch1,"October 6th, 1783",I could barely make out what he was saying.
ch3,"December 1st, 1783",I wonder if I will ever be happy here?
ch1,"October 6th, 1783",The mountains now loom off to the east of us a good distance away.
ch1,"October 6th, 1783","Father is worried that we might get lost, striking out on our own."
ch2,"November 1st, 1783","Mother and Father have the feather tick that we brought with us, but Grannie and Jamie and I make do with blankets that the soldiers have given us, spread over balsam fir boughs."
ch2,"November 1st, 1783","They mostly speak French, so we cannot talk to them, but they are kind."
ch13,"October 3rd, 1784",Mother is making pies at a great rate and is salting down the rest.
ch10,"July 2nd, 1784","At least, I watched the sky lighten."
ch8,"May 2nd, 1784","The 
bateau
 in which we are travelling is like the one we sailed Lake Champlain in, but flat-bottomed to make it easier to drag through the rapids."
ch13,"October 3rd, 1784",Duncan came by with a brace of ducks this afternoon.
ch3,"December 1st, 1783","Looking at her in the firelight, I suddenly realized that she must have been very pretty when she was young."
ch14,"November 1st, 1784","There was just a knock at the door and Angus and Duncan have come in, shaking snow off their caps and jackets."
ch1,"October 6th, 1783",Father was right.
ch11,"August 2nd, 1784",It is not something that I really want to think about.
ch8,"May 2nd, 1784",Finally!
ch2,"November 1st, 1783","Lisa and Obediah came over to where I am sitting now by our fire, in dry clothes with a blanket wrapped around me, drinking catnip tea that Grannie brewed for me."
ch1,"October 6th, 1783",Thank goodness Laddie did not see it.
ch3,"December 1st, 1783",I remember Mother dyed it that colour with goldenrod blossoms.
ch13,"October 3rd, 1784","Dear Canada: With Nothing But Our Courage
October 1784
We were most surprised to see a man on horseback ride up the path to our house today."
ch5,"February 1st, 1784","Without stopping to think, I grabbed up a handful of snow and threw it back at him as hard as I could."
ch12,"September 6th, 1784",I wonder if it is more than just missing his family.
ch1,"October 6th, 1783","They talked for a long time, in English and in the Indian’s own language."
ch2,"November 1st, 1783",She is quite small and the water was over her head.
ch13,"October 3rd, 1784",I did not know what to do.
ch1,"October 6th, 1783",I wish Mother could be as brave.
ch2,"November 1st, 1783",Grannie has her own blanket but Jamie and I have to share.
ch1,"October 6th, 1783","“Besides,” he’d said, “if I don’t fight for the British I’ll have to fight for the rebels, and that I will never do.”
It was after that that our friends and neighbours began to shun us, but we never imagined things would come to this."
ch1,"October 6th, 1783",Mother rushed forward to support him and snatched up the paper.
ch1,"October 6th, 1783",It feels lonely without John.
ch1,"October 6th, 1783",That means they will have to travel during the winter — I cannot imagine how hard that will be.
ch8,"May 2nd, 1784",It is very beautiful.
ch1,"October 6th, 1783","And then …
This is the part I cannot write."
ch13,"October 3rd, 1784",I just wrote down the date and then realized it is exactly one year since I started this journal.
ch13,"October 3rd, 1784",His face got all still and he looked away from me.
ch1,"October 6th, 1783",She definitely does not like the boat.
ch10,"July 2nd, 1784","Father, Angus and Duncan will begin building the cabin tomorrow."
ch1,"October 6th, 1783",They just dragged him!
ch1,"October 6th, 1783",They are such a nice family and it is so wonderful to have a friend.
ch4,"January 1st, 1784","I sat with her all afternoon and tried to get her to drink the teas Aunt Norah had made for her, but she could not get them down."
ch11,"August 2nd, 1784","It is much, and we are very fortunate to have been able to get here safely."
ch3,"December 1st, 1783","I did not tell anyone at school, but I did tell Hannah."
ch10,"July 2nd, 1784",There was a tremendous amount of blood for such a small cut and he thought he was dying.
ch1,"October 6th, 1783","The lake itself does not look so big from here, but Father says he has heard that it gets much wider farther north."
ch12,"September 6th, 1784",They spear the fish with long spears.
ch3,"December 1st, 1783","Grannie has brought her bedraggled lilac bush into the house for the winter and it sits in a corner, well wrapped up in burlap."
ch2,"November 1st, 1783",It must be horrible to be their slaves.
ch12,"September 6th, 1784",They obviously wanted to trade and this time we were able to do so.
ch1,"October 6th, 1783",I suppose at five years old none of this means anything to him.
ch1,"October 6th, 1783","Jamie and I walk most of the time so that old Blue doesn’t have such a heavy load to pull, but we do get tired."
ch12,"September 6th, 1784","When Uncle Allan said he had supplies for us, he didn’t tell the half of it."
ch1,"October 6th, 1783",I would be very happy to be home churning butter right now and I wouldn’t complain a bit.
ch3,"December 1st, 1783",It was so beautiful I could hardly breathe.
ch11,"August 2nd, 1784",My own brother.
ch5,"February 1st, 1784","“Besides, Andrew, the Regiment will be staying together."
ch1,"October 6th, 1783","The dog followed along, although he still won’t come near us."
ch10,"July 2nd, 1784",I mourn the loss of blueberry pies.
ch3,"December 1st, 1783",We have been provided with a few slates and we take turns using them.
ch8,"May 2nd, 1784",All of us are families of men in Sir John Johnson’s Regiment and we will settle together.
ch3,"December 1st, 1783",Now we are getting ready for our own celebration.
ch10,"July 2nd, 1784","I could see that Father was chafing at the inactivity when there is so much to do, but in this Grannie will have her way."
ch2,"November 1st, 1783",It was Angus!
ch10,"July 2nd, 1784",Angus says they learned how to do this over the winter when they were working at Cataraqui with the army.
ch2,"November 1st, 1783","I used to hate that and get really cross when he did it, but I didn’t today."
ch13,"October 3rd, 1784",Grannie and I picked herbs today.
ch6,"March 3rd, 1784",The weather has turned sunny and all the snow is dripping and melting.
ch1,"October 6th, 1783","Later still
The meal was delicious."
ch10,"July 2nd, 1784",But Laddie did not appear and Jamie would not go without him.
ch1,"October 6th, 1783","It’s hard to remember that Father and I used to talk 
every
 night after our evening supper."
ch9,"June 1st, 1784",He didn’t mention Duncan.
ch1,"October 6th, 1783",I soon found out.
ch7,"April 6th, 1784","We are to be taken in boats up the St. Lawrence, past Montréal, to a town called Lachine."
ch12,"September 6th, 1784","They will all come here in a week or so, then Father and the boys will go to the Rosses’ place, and then on to the other neighbours who join in after that."
ch3,"December 1st, 1783",Everything is all abustle because Christmas is coming.
ch14,"November 1st, 1784","The wind is howling outside, but all is safe and peaceful in this little house."
ch1,"October 6th, 1783",It is Sunday today.
ch9,"June 1st, 1784",I will have to stop writing.
ch13,"October 3rd, 1784","I do not know why that works, but it does."
ch1,"October 6th, 1783","And it seems we might have a dog, too."
ch9,"June 1st, 1784",Now I’ll describe how it is done.
ch7,"April 6th, 1784","Mother got very quiet when she read his words about Margaret, but she is so happy at the thought of seeing Angus again."
ch10,"July 2nd, 1784","“We can do it, Fiona,” he said."
ch10,"July 2nd, 1784","“Yes,” she said."
ch13,"October 3rd, 1784",Now I am knitting a pair of socks.
ch1,"October 6th, 1783","The leaves on the hill on the other side are still brilliant, but it is getting quite cold."
ch5,"February 1st, 1784","Hannah is almost back to her old self again, but she is very thin and tires easily."
ch2,"November 1st, 1783",The Rosses are camped right next to us and we shared our supper tonight.
ch11,"August 2nd, 1784","That won’t be for a while, though, I don’t think."
ch5,"February 1st, 1784",Was that not enough?
ch1,"October 6th, 1783","Chimney Point
We have made it to Chimney Point!"
ch6,"March 3rd, 1784","It is settled now, though."
ch10,"July 2nd, 1784","There will be no cellar or foundation for this cabin, but Angus and Duncan dug a small excavation which will be reached through a trap door in the cabin floor, by means of a ladder, and we will use that as a root cellar for the time being."
ch3,"December 1st, 1783",The whole business was messy but the hams hanging up in the fireplace chimney to smoke made it all worthwhile.
ch10,"July 2nd, 1784",It was hard work.
ch1,"October 6th, 1783",Very confusing!
ch5,"February 1st, 1784",“Do you think they would be given back to us?
ch13,"October 3rd, 1784",I can understand that — it is exactly how I feel.
ch4,"January 1st, 1784",Hannah might die!
ch13,"October 3rd, 1784",I do not even feel like the same girl.
ch4,"January 1st, 1784",Mother leaves the room whenever Father talks of these plans.
ch1,"October 6th, 1783",Grannie is much mollified but it hasn’t made us feel any better.
ch1,"October 6th, 1783",It was not much more than a whisper.
ch8,"May 2nd, 1784",We leave tomorrow.
ch2,"November 1st, 1783",I think Father is very disappointed.
ch1,"October 6th, 1783",He just nodded.
ch2,"November 1st, 1783","I’m not quite certain what “intact” means, but I imagine it means he’s still got his money."
ch9,"June 1st, 1784",One of the boats almost tipped today.
ch2,"November 1st, 1783",It’s not like the bread we used to bake at home.
ch1,"October 6th, 1783",Mr. Ross let me pet them.
ch1,"October 6th, 1783",I think we will need all the prayers we can get.
ch12,"September 6th, 1784",I could not have borne it if I had burned her as well.
ch13,"October 3rd, 1784",Shortly after that he called Jamie back and we returned to Angus’s cabin.
ch1,"October 6th, 1783","He gave a huge leap and the next thing I knew we were out the gate and down the road, Blue trotting faster than he’s ever trotted before and Jamie and me rattling around on top of the wagon like two broken teacups on their saucers."
ch12,"September 6th, 1784","I was digging away at the garden, fighting those dratted roots and saying words under my breath that I wouldn’t want Grannie to hear, when Laddie began to bark furiously."
ch2,"November 1st, 1783","It is called Machiche, and we will winter there."
ch12,"September 6th, 1784","When we were finished eating, Mr. Stanton brought out a fiddle and the dancing began."
ch1,"October 6th, 1783","We should reach the southern tip of the lake tomorrow, and John told Father that Chimney Point was just another day or two’s journey up the eastern shore of the lake."
ch1,"October 6th, 1783",The trees are all red and yellow and orange and just glorious.
ch13,"October 3rd, 1784","It has been coming around Angus’s shanty for the last few nights, so finally he and Duncan laid in wait for it and when it turned up last night they shot it."
ch10,"July 2nd, 1784",I was surprised to see how expert she was.
ch10,"July 2nd, 1784",Father says he will make them high enough so that there will be a loft for Jamie and me to sleep in.
ch13,"October 3rd, 1784",We will have bear roast for dinner today and plenty of meat for the winter.
ch1,"October 6th, 1783",They took to each other right away and soon were playing some sort of game with sticks and stones.
ch10,"July 2nd, 1784","I will probably have the smell of wet dog in my nose for the rest of my life, too."
ch1,"October 6th, 1783",I might just sneak a piece of johnnycake to him after everyone has gone to bed.
ch1,"October 6th, 1783",What did we see in the light of the dying fire but three men untying Bess and old Blue!
ch2,"November 1st, 1783",Isn’t that strange?
ch9,"June 1st, 1784","We will have to depend on Government supplies for the winter, Father says."
ch1,"October 6th, 1783",He looked sick.
ch4,"January 1st, 1784","Hannah is not, however, although her mother has the same medicines."
ch1,"October 6th, 1783",I’m curled up by the fire now.
ch7,"April 6th, 1784",I was happy again.
ch1,"October 6th, 1783",It would have been like when we used to go on outings to visit neighbours or to picnic by the river.
ch10,"July 2nd, 1784","He works as willingly as Angus, but he does not seem to be as happy."
ch14,"November 1st, 1784",I have not been able to stop thinking about what he told me.
ch1,"October 6th, 1783",Children are running wild and it is noisy beyond belief.
ch8,"May 2nd, 1784","Mother makes Laddie sleep outside, though, and Jamie is not happy about that."
ch1,"October 6th, 1783",Even Mother and Grannie get out when we come to hills.
ch13,"October 3rd, 1784",I wish I could talk with them.
ch9,"June 1st, 1784",He is going to Cataraqui where there is already a school built.
ch9,"June 1st, 1784",We have just finished going through them and are camped for our noon meal.
ch1,"October 6th, 1783","Now, in desperation, John and his family are going to join their chief, Joseph Brant, at a place called Fort Niagara."
ch8,"May 2nd, 1784",What a journey this is turning out to be!
ch12,"September 6th, 1784","Fortunately I will have several years before 
that
 happens, but all girls should have at least two or three quilts done before then."
ch10,"July 2nd, 1784","“We cannot depend entirely on the Government for all our supplies.”
Then Jamie gave us all a scare by deciding that he, too, should be able to chop wood."
ch1,"October 6th, 1783",I expect we will be eating a lot of that.
ch3,"December 1st, 1783","Of course, I would have sacrificed it if it were needed, but I’m mightily relieved that it wasn’t."
ch1,"October 6th, 1783",Even Grannie is keeping out of her way.
ch10,"July 2nd, 1784","Angus managed to get a lot right next to ours, and Duncan was finally able to swap for a lot nearby as well."
ch10,"July 2nd, 1784",She does not like it one bit and Laddie keeps sniffing at it and looking up at me with a decidedly anxious look.
ch1,"October 6th, 1783",She is peeping at me from behind Lisa’s skirts right now as I am writing this.
ch12,"September 6th, 1784",He is living with them until he gets his own cabin built.
ch1,"October 6th, 1783","“You worry too much, little Mary,” he said."
ch4,"January 1st, 1784","Our preacher, Mr. Murchison, came over to sit with Hannah and Aunt Norah today."
ch2,"November 1st, 1783",We have been eating that since we arrived here.
ch1,"October 6th, 1783",How quickly we are leaving behind all we’ve ever known and loved!
ch13,"October 3rd, 1784",Mother boiled up some dried blueberries and we soaked it in the water from them and dyed it the prettiest shade of pale blue.
ch11,"August 2nd, 1784",The leaves haven’t drooped a bit.
ch10,"July 2nd, 1784",We are too tired even to talk.
ch1,"October 6th, 1783","Grannie, of course, was bustling around in her usual way and already setting to, getting things ready for the evening meal."
ch14,"November 1st, 1784",Angus has made himself a fine hat out of a raccoon skin.
ch3,"December 1st, 1783",She’s quite fierce about it.
ch3,"December 1st, 1783","Jamie, George and Hugh are the youngest."
ch1,"October 6th, 1783",For all I knew we were surrounded!
ch1,"October 6th, 1783",They were delicious.
ch1,"October 6th, 1783","I’m minding Margaret, who has the hiccups."
ch3,"December 1st, 1783",I am very fortunate in having parents who have told me that I can keep on going to school for as long as I want.
ch2,"November 1st, 1783",I’m not sure I want to.
ch1,"October 6th, 1783","Almost
 happy."
ch5,"February 1st, 1784","Mr. Mitchell never saw Danny throw his snowball, just the one that I threw."
ch3,"December 1st, 1783","Grannie ran out with one of hers, but by the time she got there the fire was out."
ch5,"February 1st, 1784",This was not the Father we knew.
ch9,"June 1st, 1784",Our long journey is finally over.
ch1,"October 6th, 1783",I can see some boats out on the water and they look very small and are tossing around in a most alarming way.
ch3,"December 1st, 1783",Sometimes when my mind was wandering I even laid a place for him at the table before I realized what I was doing.
ch3,"December 1st, 1783","Still, I like her so much I suppose I can put up with it."
ch12,"September 6th, 1784",Mother gave them a sackful of our flour.
ch1,"October 6th, 1783","Even though the sailors make up a good stew for us each night, or else fry up fish that they have caught in the lake, I have not been able to force the slightest morsel down."
ch1,"October 6th, 1783",They were going to steal them!
ch8,"May 2nd, 1784",We go next week!
ch9,"June 1st, 1784","When his sniffing grew a bit too rough, she just arched her back, ruffled up all her fur, spat at him like a little fury, and scratched his nose."
ch12,"September 6th, 1784",A cage with several chickens and a rooster just for us!
ch6,"March 3rd, 1784","It is still chilly of course, so we kept her well bundled up, but it was such a joy to see her outside."
ch1,"October 6th, 1783",I am very hungry.
ch10,"July 2nd, 1784","Angus and Duncan have a small soldier’s tent each, we have the two larger ones we were given at Johnstown."
ch14,"November 1st, 1784","Dear Canada: With Nothing But Our Courage
November 1784
The skies are grey and gloomy and I can smell snow in the air again."
ch8,"May 2nd, 1784","I just shut my eyes and bury my nose in the deep purple blossoms and inhale great wafts of their smell, and for a moment or two I can almost believe I am home and all of this has just been one long bad dream."
ch8,"May 2nd, 1784",I know I will not sleep a wink tonight.
ch12,"September 6th, 1784",I have not yet mastered the art of turning a heel.
ch1,"October 6th, 1783",Now he sits at the kitchen table and stares out the window.
ch1,"October 6th, 1783","Father says he doubts that we would ever have made it this far without his help, and that he is immensely grateful."
ch1,"October 6th, 1783",Then the track plunges right back down again and Father leaps back into the wagon and stands on the brakes.
ch2,"November 1st, 1783","It sat in the middle of a flat plain, all alone, with a cloud covering its top and mist swirling down its sides."
ch13,"October 3rd, 1784",Pigeon pie for supper!
ch14,"November 1st, 1784",He has promised Jamie one and Jamie is wild with anticipation.
ch11,"August 2nd, 1784",I don’t think it very wise for Angus to try to shoot a bear and I said so.
ch13,"October 3rd, 1784",I knew it.
ch12,"September 6th, 1784","Just look at how much they’ve done for us.”
There’s also a huge vat of ashes to be made into lye for soap and potash and to use in the privy."
ch14,"November 1st, 1784",Grannie and my nose were right.
ch3,"December 1st, 1783",Father is digging a hole next to the house and that will have to do.
ch12,"September 6th, 1784","I think the thought has crossed Father’s mind, too, as he looked very pensive when Uncle Allan mentioned it."
ch2,"November 1st, 1783",He and Angus just looked at each other and didn’t say a word.
ch1,"October 6th, 1783","He wouldn’t ride in the wagon at all today, but walked almost the whole way."
ch10,"July 2nd, 1784",Father has helped me pick out a spot for my apple seeds and I planted them carefully.
ch11,"August 2nd, 1784",“Would that not be dangerous?” I asked him.
ch13,"October 3rd, 1784",I could not help it.
ch1,"October 6th, 1783",The dog was barking at them and charging at them and nipping at their heels.
ch10,"July 2nd, 1784",Right away we ran into trouble.
ch11,"August 2nd, 1784","It is nowhere near as roomy or as comfortable as our house back home, of course, but I cannot begin to describe how overjoyed I feel."
ch2,"November 1st, 1783","I didn’t even stop to think, but jumped right in after her."
ch12,"September 6th, 1784",It was Uncle Allan Ross!
ch2,"November 1st, 1783","Sir John Johnson has purchased land from the Mississauga Indians all along the river, and that is where Governor Haldimand of Québec is planning to settle you."
ch8,"May 2nd, 1784","For shelter we have boat sails and tarpaulins slung over branches, but as long as it doesn’t rain they are sufficient."
ch13,"October 3rd, 1784",I reached out and took hold of his hand.
ch1,"October 6th, 1783",We each made a bundle of our clothes.
ch3,"December 1st, 1783",I remember I did that for so long after William died — I kept expecting him to walk through the door.
ch1,"October 6th, 1783","I would like to walk along that beach, too, but I must mind Margaret, who is sleeping with her thumb stuck firmly in her mouth."
ch10,"July 2nd, 1784",He looked so anxious!
ch1,"October 6th, 1783",She didn’t wave.
ch2,"November 1st, 1783","Angus is just Angus — my brother — I’ve never thought of what he 
looks
 like."
ch7,"April 6th, 1784","Do you see, my journal?"
ch1,"October 6th, 1783",I think she is as pleased as we are to be camped here so comfortably.
ch2,"November 1st, 1783",Hannah says she thinks she looks like me.
ch1,"October 6th, 1783","Grannie waters it every day and it drips down on us, but I don’t mind."
ch1,"October 6th, 1783","But how will they get our wagon and Bess and Blue on a boat, I wonder?"
ch3,"December 1st, 1783",But I wonder if a first-foot will knock on our door at midnight?
ch2,"November 1st, 1783",Angus was in an enemy prison camp and he escaped.
ch1,"October 6th, 1783","He spoke slowly and haltingly, but the Indian seemed to understand him."
ch1,"October 6th, 1783",John and Father talked together for hours last night after the rest of us went to bed.
ch5,"February 1st, 1784",He had tried to slide off the roof of a shed and fell.
ch3,"December 1st, 1783","I cried all the way to school, but managed to stop before I got there so that no one would see."
ch11,"August 2nd, 1784",Somehow I had never thought of that.
ch12,"September 6th, 1784",Father is very excited about it all.
ch1,"October 6th, 1783","I’m not, though."
ch1,"October 6th, 1783",Last night I heard a cry and I couldn’t help but imagine what had happened to some poor small creature.
ch10,"July 2nd, 1784","He and the boys are putting in the rafters that will be the ceiling of the main floor, and the floor of the loft."
ch1,"October 6th, 1783",A girl who looks to be just about my age has come up to where we are camped and is standing staring at me.
ch13,"October 3rd, 1784","My father and my two older brothers on one side, and I on the other."
ch3,"December 1st, 1783",That was truly disgusting.
ch3,"December 1st, 1783",Perhaps I should not get so cross about it.
ch9,"June 1st, 1784",Hop tea for regulating the blood.
