book_name,chapter_id,entry_id,date,sentence
AinUTL,4,ch4_e10,le 27 août 1666,"We pass as much time together as possible, sitting outside when the weather is fine."
AinUTL,4,ch4_e10,le 27 août 1666,The girls talk ceaselessly of the men they will marry.
AinUTL,4,ch4_e10,le 27 août 1666,"I have not come to know any of them very well, but they are good girls."
AinUTL,4,ch4_e10,le 27 août 1666,"None of the Maries are as plump as when we left La Rochelle, but all are in excellent spirits."
AinUTL,4,ch4_e10,le 27 août 1666,I cannot help but think of poor Catherine and how she would be looking forward to meeting with her Armand.
AinUTL,4,ch4_e10,le 27 août 1666,I must give him the sad news.
AinUTL,4,ch4_e10,le 27 août 1666,"I do hope that he will not be heartbroken, though I fear he will."
AinUTL,4,ch4_e11,le 28 août 1666,It rained hard early this morning.
AinUTL,4,ch4_e11,le 28 août 1666,We set out buckets and basins and the captain has let us use some of the water to wash out our clothing.
AinUTL,4,ch4_e11,le 28 août 1666,"Until now, any laundry has been done in salt water."
AinUTL,4,ch4_e11,le 28 août 1666,That makes the cloth very rough and unpleasant against the skin.
AinUTL,4,ch4_e11,le 28 août 1666,We hung our shifts and stockings to dry in the sunshine.
AinUTL,4,ch4_e11,le 28 août 1666,It made the ship look amusing.
AinUTL,4,ch4_e11,le 28 août 1666,Then we females all sat together in the sunshine and did some mending.
AinUTL,4,ch4_e11,le 28 août 1666,"All those weeks ago, it would have seemed shocking to display one’s underclothing in such a manner."
AinUTL,4,ch4_e11,le 28 août 1666,"Now, after living so closely together, it is meaningless."
AinUTL,4,ch4_e11,le 28 août 1666,"After all, it is only linen."
AinUTL,4,ch4_e11,le 28 août 1666,An idea came to me as we worked.
AinUTL,4,ch4_e11,le 28 août 1666,"I have not only my chest of garments, but Catherine’s as well."
AinUTL,4,ch4_e11,le 28 août 1666,The gowns are too fine for either Kateri or me.
AinUTL,4,ch4_e11,le 28 août 1666,"I could sell them, I suppose, but it hurts to think of that."
AinUTL,4,ch4_e11,le 28 août 1666,The shifts would do nicely for Kateri.
AinUTL,4,ch4_e11,le 28 août 1666,I know Catherine would not mind.
AinUTL,4,ch4_e11,le 28 août 1666,"Marie, the one with the mole near her mouth, and Marie, the one with the freckles, helped me to take up the hems and shorten the sleeves."
AinUTL,4,ch4_e11,le 28 août 1666,I felt tears burning in my eyes.
AinUTL,4,ch4_e11,le 28 août 1666,Catherine was tall.
AinUTL,4,ch4_e11,le 28 août 1666,Monsieur Aubry was not pleased.
AinUTL,4,ch4_e11,le 28 août 1666,He said that his daughter would take no charity.
AinUTL,4,ch4_e11,le 28 août 1666,"He grew quiet when I explained that my gift was an act of friendship, not charity."
AinUTL,4,ch4_e11,le 28 août 1666,I will write exactly what I said to him.
AinUTL,4,ch4_e11,le 28 août 1666,"“Is it charity for you to help me find my relative, Madame Moitié?"
AinUTL,4,ch4_e11,le 28 août 1666,Only a kindness.
AinUTL,4,ch4_e11,le 28 août 1666,"Your daughter is my friend,” I said, and I could not keep the exasperation from my voice."
AinUTL,4,ch4_e11,le 28 août 1666,He bowed to me then and made his apology.
AinUTL,4,ch4_e11,le 28 août 1666,I do not understand men at all.
AinUTL,4,ch4_e12,le 29 août 1666,During the night we sailed well into what Séraphin says is the St. Lawrence River.
AinUTL,4,ch4_e12,le 29 août 1666,I have never seen such a wide river.
AinUTL,4,ch4_e12,le 29 août 1666,"In fact, it looks precisely like the gulf."
AinUTL,4,ch4_e12,le 29 août 1666,The mouth is nearly fifty leagues wide.
AinUTL,4,ch4_e12,le 29 août 1666,There are whales here.
AinUTL,4,ch4_e12,le 29 août 1666,Some came close to the ship.
AinUTL,4,ch4_e12,le 29 août 1666,They are as white as snow and seem to smile.
AinUTL,4,ch4_e12,le 29 août 1666,The sailors fired muskets at them.
AinUTL,4,ch4_e12,le 29 août 1666,"Séraphin says the whales can be eaten, but the balls missed their targets."
AinUTL,4,ch4_e12,le 29 août 1666,The whales dived into the water and disappeared.
AinUTL,4,ch4_e12,le 29 août 1666,"I would like fresh food as much as anyone else would, but secretly I rejoiced that the whales were not harmed."
AinUTL,4,ch4_e13,le 30 août 1666,Today we can see a shoreline.
AinUTL,4,ch4_e13,le 30 août 1666,It is nothing but rocks and trees.
AinUTL,4,ch4_e13,le 30 août 1666,"I knew that New France is largely a wilderness and that there are only a few towns, but I was not prepared for what lies before me."
AinUTL,4,ch4_e13,le 30 août 1666,How can anyone make a home in such a place?
AinUTL,4,ch4_e13,le 30 août 1666,Kateri is more excited than ever.
AinUTL,4,ch4_e13,le 30 août 1666,I am trying to see the countryside through her eyes and the eyes of her father.
AinUTL,4,ch4_e13,le 30 août 1666,Each night I go to my bed more distressed.
AinUTL,4,ch4_e13,le 30 août 1666,I have no idea what lies in my future.
AinUTL,4,ch4_e14,le 31 août 1666,"Monsieur Aubry is friendlier now, even to les filles à marier ."
AinUTL,4,ch4_e14,le 31 août 1666,"The girls flirt outrageously with him, especially Marie with the freckles."
AinUTL,4,ch4_e14,le 31 août 1666,"He is an eligible man after all, a rather handsome widower and a person of some substance with his business."
AinUTL,4,ch4_e14,le 31 août 1666,"It is comical, really, to see how they practise upon him."
AinUTL,4,ch4_e14,le 31 août 1666,He is good-natured about it.
AinUTL,4,ch4_e14,le 31 août 1666,"“You may flutter your eyelashes all you wish, mademoiselles, but I have no need for a wife,” he said to them today."
AinUTL,4,ch4_e14,le 31 août 1666,This gave Monsieur Deschamps a shock.
AinUTL,4,ch4_e14,le 31 août 1666,I could see it in the way he lifted his eyebrows and twirled the ends of his moustaches furiously.
AinUTL,4,ch4_e14,le 31 août 1666,"“Are you above the law, monsieur?” he asked."
AinUTL,4,ch4_e14,le 31 août 1666,"“Our Intendant, Monsieur Talon, has decreed that all men must be married or lose their licences to trade for furs."
AinUTL,4,ch4_e14,le 31 août 1666,"You do trade, I have heard.” Monsieur Aubry said nothing."
AinUTL,4,ch4_e14,le 31 août 1666,"I could have sworn that sparks flew between them, but perhaps it was only lightning."
AinUTL,4,ch4_e14,le 31 août 1666,I think it will storm.
AinUTL,5,ch5_e1,le 3 septembre 1666,"There was thunder in the night, and I could hear the sound of heavy rain pelting upon the deck."
AinUTL,5,ch5_e1,le 3 septembre 1666,"The morning saw no end to this, and so I was unable to spend my accustomed time outside."
AinUTL,5,ch5_e1,le 3 septembre 1666,"Besides, the weather has turned very cool, as they say it does so quickly in New France."
AinUTL,5,ch5_e1,le 3 septembre 1666,Some of the girls sat together and mended stockings.
AinUTL,5,ch5_e1,le 3 septembre 1666,Two dressed each other’s hair with ribbons.
AinUTL,5,ch5_e1,le 3 septembre 1666,I chose to return to my little cabin.
AinUTL,5,ch5_e1,le 3 septembre 1666,Sometimes their chattering makes my head ache.
AinUTL,5,ch5_e1,le 3 septembre 1666,I heard a knock at the door and I asked who was there.
AinUTL,5,ch5_e1,le 3 septembre 1666,It was Kateri.
AinUTL,5,ch5_e1,le 3 septembre 1666,She had something in a basket.
AinUTL,5,ch5_e1,le 3 septembre 1666,It was balls of wool with which she is weaving garters for her father.
AinUTL,5,ch5_e1,le 3 septembre 1666,She does this most cleverly with only her fingers.
AinUTL,5,ch5_e1,le 3 septembre 1666,"All the Mohawk girls learn to do it, she told me."
AinUTL,5,ch5_e1,le 3 septembre 1666,Minette thought that batting about balls of wool was nearly as much fun as catching rats.
AinUTL,5,ch5_e1,le 3 septembre 1666,The second makes me shiver.
AinUTL,5,ch5_e1,le 3 septembre 1666,I had my lucet .
AinUTL,5,ch5_e1,le 3 septembre 1666,Kateri wove her garter and I worked at making cord.
AinUTL,5,ch5_e1,le 3 septembre 1666,We spent the afternoon most pleasantly and quietly.
AinUTL,5,ch5_e1,le 3 septembre 1666,One does not need to talk all the while.
AinUTL,5,ch5_e1,le 3 septembre 1666,"Sometimes silence, especially the sort of silence that can comfortably grow between friends, is precious."
AinUTL,5,ch5_e1,le 3 septembre 1666,I wonder where Catherine would have been more content.
AinUTL,5,ch5_e1,le 3 septembre 1666,La pauvre Catherine.
AinUTL,5,ch5_e1,le 3 septembre 1666,I will say an extra decade of the rosary tonight for the repose of her soul.
AinUTL,5,ch5_e1,le 3 septembre 1666,"I wonder at something Kateri said, that all Mohawk girls learn the finger weaving."
AinUTL,5,ch5_e1,le 3 septembre 1666,Does she think of herself as Mohawk then?
AinUTL,5,ch5_e1,le 3 septembre 1666,It would be impolite to ask.
AinUTL,5,ch5_e2,le 6 septembre 1666,"Monsieur Deschamps pressed me again, this time through Madame Laurent as I took the air on deck with Kateri."
AinUTL,5,ch5_e2,le 6 septembre 1666,"She was not unkind, but still, her words did unsettle me."
AinUTL,5,ch5_e2,le 6 septembre 1666,"“Your sister was a fille à marier , Hélène."
AinUTL,5,ch5_e2,le 6 septembre 1666,The King paid for her passage on this ship and for this you owe him a debt.
AinUTL,5,ch5_e2,le 6 septembre 1666,Will you not consider taking your sister’s place?
AinUTL,5,ch5_e2,le 6 septembre 1666,"The King needs his young women to marry and bear children so that New France will be peopled.” I scarcely knew how to answer except to mumble that yes, I would consider it."
AinUTL,5,ch5_e2,le 6 septembre 1666,That seemed to satisfy her.
AinUTL,5,ch5_e2,le 6 septembre 1666,Madame Laurent bid me bonjour and walked away.
AinUTL,5,ch5_e2,le 6 septembre 1666,I have no one to ask for advice.
AinUTL,5,ch5_e3,le 8 septembre 1666,"As he does each week, Père Denis heard the confessions of all the girls this morning."
AinUTL,5,ch5_e3,le 8 septembre 1666,"Then they attended mass, their souls pure and clean."
AinUTL,5,ch5_e3,le 8 septembre 1666,"I did neither, for I feel in my very soul that God abandoned me when Catherine died."
AinUTL,5,ch5_e3,le 8 septembre 1666,Strange looks were cast my way but no one said a word.
AinUTL,5,ch5_e3,le 8 septembre 1666,They continue to leave me to myself.
AinUTL,5,ch5_e4,le 9 septembre 1666,All this time there has been only the ship and we who are on her.
AinUTL,5,ch5_e4,le 9 septembre 1666,"There have been trees, rocks and birds, but today we saw people."
AinUTL,5,ch5_e4,le 9 septembre 1666,Our ship was sailing against the current with a strong breeze behind her.
AinUTL,5,ch5_e4,le 9 septembre 1666,"Suddenly, three canoes came into sight, moving as quickly as though there were no current at all."
AinUTL,5,ch5_e4,le 9 septembre 1666,"In them were Indians, who were more unusual than any men I have ever set my eyes upon."
AinUTL,5,ch5_e4,le 9 septembre 1666,There were ten men or so in the three vessels that Séraphin said were war canoes.
AinUTL,5,ch5_e4,le 9 septembre 1666,"Les sauvages , he called the men."
AinUTL,5,ch5_e4,le 9 septembre 1666,I will admit that my heart gave a thump when I heard the words war canoes.
AinUTL,5,ch5_e4,le 9 septembre 1666,Sometimes in recent days I have heard the men talking when they think we cannot hear them.
AinUTL,5,ch5_e4,le 9 septembre 1666,"They speak of attacks and kidnappings, the taking of prisoners and such."
AinUTL,5,ch5_e4,le 9 septembre 1666,My mouth grew dry to think that the Indians in those canoes might attack us.
AinUTL,5,ch5_e4,le 9 septembre 1666,"Seeing my nervousness, Kateri said to me, “You need not fear them."
AinUTL,5,ch5_e4,le 9 septembre 1666,They are only Micmac hoping to trade.” It was true.
AinUTL,5,ch5_e4,le 9 septembre 1666,The canoes came quite close to the ship.
AinUTL,5,ch5_e4,le 9 septembre 1666,The men in them laughed and called out in their own tongue.
AinUTL,5,ch5_e4,le 9 septembre 1666,They seemed welcoming enough in spite of the terrible war clubs with which they were armed.
AinUTL,5,ch5_e4,le 9 septembre 1666,"They wore barely any clothing, only a length of cloth over their loins that Kateri said was a breechcloth."
AinUTL,5,ch5_e4,le 9 septembre 1666,She confided that her papa often wears one.
AinUTL,5,ch5_e4,le 9 septembre 1666,I will try not to think about that.
AinUTL,5,ch5_e4,le 9 septembre 1666,"No one was able to understand what the Indians said, but their intent was clear."
AinUTL,5,ch5_e4,le 9 septembre 1666,One held up a haunch of meat.
AinUTL,5,ch5_e4,le 9 septembre 1666,Two others each waved a brace of ducks over his head.
AinUTL,5,ch5_e4,le 9 septembre 1666,"The meat was passed up, and a sailor reached down and passed a dark green bottle to them."
AinUTL,5,ch5_e4,le 9 septembre 1666,I have no idea why I looked at Monsieur Aubry’s face at that moment.
AinUTL,5,ch5_e4,le 9 septembre 1666,I would have thought he should be happy that we were to have fresh meat for the cook pots.
AinUTL,5,ch5_e4,le 9 septembre 1666,Instead he scowled and his face was angry.
AinUTL,5,ch5_e4,le 9 septembre 1666,I heard the stomping of his feet as he went below.
AinUTL,5,ch5_e4,le 9 septembre 1666,"He would not touch a bit of that meat, and neither would Kateri."
AinUTL,5,ch5_e4,le 9 septembre 1666,"“They traded brandy for the meat,” she told me later."
AinUTL,5,ch5_e4,le 9 septembre 1666,"“It is against the law here, but still some do it."
AinUTL,5,ch5_e4,le 9 septembre 1666,"Papa hates to see it happen.” I myself ate nothing tonight, but not because of the brandy."
AinUTL,5,ch5_e4,le 9 septembre 1666,I do not feel well at all.
AinUTL,5,ch5_e5,le 13 septembre 1666,"I have wakened, and if I do not write quickly I shall fall asleep again."
AinUTL,5,ch5_e5,le 13 septembre 1666,"I have been ill. Madame Laurent tells me that three days passed before the fever broke and that last night Père Denis nearly blessed me with holy oil, since they thought it was possible that I would die."
AinUTL,5,ch5_e5,le 13 septembre 1666,It seems that when he implored me to make my last confession I turned my face away.
AinUTL,5,ch5_e5,le 13 septembre 1666,Madame Laurent says that she is certain it was only the fever talking.
AinUTL,5,ch5_e5,le 13 septembre 1666,Kateri came to visit me.
AinUTL,5,ch5_e5,le 13 septembre 1666,She says that the other girls speak of my refusal of the sacrament as a sin.
AinUTL,5,ch5_e5,le 13 septembre 1666,They cross themselves endlessly.
AinUTL,5,ch5_e5,le 13 septembre 1666,“Papa did the same when Maman died.
AinUTL,5,ch5_e5,le 13 septembre 1666,"He blamed le bon Dieu for a long while,” she told me."
AinUTL,5,ch5_e5,le 13 septembre 1666,“My Mohawk grandmother and grandfather say that all things pass.” I was very sleepy and weak.
AinUTL,5,ch5_e5,le 13 septembre 1666,But I know that I heard her speak of her grandparents.
AinUTL,5,ch5_e5,le 13 septembre 1666,"Now here is something new, but I am far too weary to think about it."
AinUTL,5,ch5_e5,le 13 septembre 1666,I must put down the quill before I drop it and add yet another stain to this coverlet.
AinUTL,5,ch5_e6,le 14 septembre 1666,I am weary beyond words as I write this.
AinUTL,5,ch5_e6,le 14 septembre 1666,"I felt strong enough to come out into the sunshine for a while today, and I could see a town in the distance."
AinUTL,5,ch5_e6,le 14 septembre 1666,It is the city of Québec.
AinUTL,5,ch5_e6,le 14 septembre 1666,I do not know what I expected.
AinUTL,5,ch5_e6,le 14 septembre 1666,Papa always believed that one must not expect too much and then one will not be disappointed.
AinUTL,5,ch5_e6,le 14 septembre 1666,"I see the point he tried to make to me, but I cannot help it."
AinUTL,5,ch5_e6,le 14 septembre 1666,This town could have turned out to be a single hovel with a pig standing next to it and I would have been overjoyed to view a place where people live.
AinUTL,5,ch5_e6,le 14 septembre 1666,"I expected a good deal from New France, and this place, standing alone in such a wilderness, has moved me deeply."
AinUTL,5,ch5_e6,le 14 septembre 1666,As the ship drew closer I could see that the site chosen for Québec is magnificent and imposing.
AinUTL,5,ch5_e6,le 14 septembre 1666,"There are tall cliffs, and above the trees and the river rises a large hill."
AinUTL,5,ch5_e6,le 14 septembre 1666,I picked Minette up so that she could see it.
AinUTL,5,ch5_e6,le 14 septembre 1666,“It is called Cap Diamant.” It was Monsieur Aubry.
AinUTL,5,ch5_e6,le 14 septembre 1666,He had come up beside me to where I stood at the ship’s rail.
AinUTL,5,ch5_e6,le 14 septembre 1666,"Monsieur Aubry, I have learned, is able to walk very quietly so that he is there before you even notice him."
AinUTL,5,ch5_e6,le 14 septembre 1666,"The other men on the ship wear shoes of stout leather, but he now wears what are called moccasins, which are slippers of moose skin made in the Indian style."
AinUTL,5,ch5_e6,le 14 septembre 1666,He did not look at me as he talked.
AinUTL,5,ch5_e6,le 14 septembre 1666,Kateri joined us.
AinUTL,5,ch5_e6,le 14 septembre 1666,"He put his arm around his daughter, but he spoke almost as though neither of us was there."
AinUTL,5,ch5_e6,le 14 septembre 1666,"It had been an Indian village once, when the explorer Cartier first saw it, he went on."
AinUTL,5,ch5_e6,le 14 septembre 1666,Stadacona.
AinUTL,5,ch5_e6,le 14 septembre 1666,"Then Samuel de Champlain, long dead, built a trading post."
AinUTL,5,ch5_e6,le 14 septembre 1666,The trading post became this town of Québec.
AinUTL,5,ch5_e6,le 14 septembre 1666,He stopped speaking for a moment and glanced at me.
AinUTL,5,ch5_e6,le 14 septembre 1666,"“The fur trade drives it all, mademoiselle."
AinUTL,5,ch5_e6,le 14 septembre 1666,"Commerce and marriage, war and peace are all determined by the fur trade."
AinUTL,5,ch5_e6,le 14 septembre 1666,See the canoes?” He gestured to the many distant vessels that were all making their way to Québec.
AinUTL,5,ch5_e6,le 14 septembre 1666,The canoes were very low in the water.
AinUTL,5,ch5_e6,le 14 septembre 1666,"At that time, it meant little to me and Monsieur Aubry could see that."
AinUTL,5,ch5_e6,le 14 septembre 1666,"“Furs, mademoiselle."
AinUTL,5,ch5_e6,le 14 septembre 1666,They are filled with hundreds of furs.
AinUTL,5,ch5_e6,le 14 septembre 1666,"The town will be busy indeed, and those who trade here will be tired tonight.” When he said tired, I realized how tired I was."
AinUTL,5,ch5_e6,le 14 septembre 1666,I excused myself and went down to my cabin to rest and to think.
AinUTL,5,ch5_e6,le 14 septembre 1666,"The fur trade drives it all, he said."
AinUTL,5,ch5_e6,le 14 septembre 1666,How will this trading drive my life?
AinUTL,5,ch5_e7,le 15 septembre 1666,We have anchored in the river some distance from what Séraphin calls the Lower Town.
AinUTL,5,ch5_e7,le 15 septembre 1666,"The sun shines brightly, there are no clouds in the sky and the air is remarkably sweet and crisp."
AinUTL,5,ch5_e7,le 15 septembre 1666,Canoes filled with Indians or coureurs de bois — which is what they call the men who go out to trade with the Indians here — carry large bales of furs past us.
AinUTL,5,ch5_e7,le 15 septembre 1666,Many of the men in the canoes do not even glance at the ship.
AinUTL,5,ch5_e7,le 15 septembre 1666,"They stare straight ahead at their goal, which seems to be the town itself."
AinUTL,5,ch5_e7,le 15 septembre 1666,I cannot help but do the same thing.
AinUTL,5,ch5_e7,le 15 septembre 1666,We are to go ashore soon for supplies and an outing.
AinUTL,5,ch5_e8,le 16 septembre 1666,I have made my decision.
AinUTL,5,ch5_e8,le 16 septembre 1666,"The seriousness of what I have done keeps me from sleep, so yet again I write."
AinUTL,5,ch5_e8,le 16 septembre 1666,It soothes my mind.
AinUTL,5,ch5_e8,le 16 septembre 1666,I will take Catherine’s place as a fille à marier .
AinUTL,5,ch5_e8,le 16 septembre 1666,"When I told Kateri this, her eyes grew wide and she excused herself."
AinUTL,5,ch5_e8,le 16 septembre 1666,"Of course, I knew that she was running off to tell her father."
AinUTL,5,ch5_e8,le 16 septembre 1666,I was surprised that he took only a few minutes to find me out on the deck.
AinUTL,5,ch5_e8,le 16 septembre 1666,“You are certain?” he asked in concern.
AinUTL,5,ch5_e8,le 16 septembre 1666,"“I mean to say, there is nothing wrong at all with agreeing to become a fille à marier , mademoiselle."
AinUTL,5,ch5_e8,le 16 septembre 1666,Many good marriages have come out of it.
AinUTL,5,ch5_e8,le 16 septembre 1666,The wrong lies in your being pressed.” I assured him that the choice was mine.
AinUTL,5,ch5_e8,le 16 septembre 1666,"I said that my future was too uncertain and at least in this way, if I had no other choice, with a dowry I would be viewed as a possible wife."
AinUTL,5,ch5_e8,le 16 septembre 1666,"Without one, there would be no hope."
AinUTL,5,ch5_e8,le 16 septembre 1666,"I would not marry in haste, and I did intend to put it off as long as possible."
AinUTL,5,ch5_e8,le 16 septembre 1666,"I added that that should not be a problem, since I was not exactly the sort of girl men looked at twice."
AinUTL,5,ch5_e8,le 16 septembre 1666,Monsieur Aubry laughed aloud.
AinUTL,5,ch5_e8,le 16 septembre 1666,"It is fortunate that it does not make me angry, since he persists in doing this."
AinUTL,5,ch5_e8,le 16 septembre 1666,"He wiped his eyes and said, “Merci, mademoiselle."
AinUTL,5,ch5_e8,le 16 septembre 1666,I can count on you for bringing cheer into my day.
AinUTL,5,ch5_e8,le 16 septembre 1666,"You are correct, of course."
AinUTL,5,ch5_e8,le 16 septembre 1666,"You are not the sort of girl a man looks at twice.” I felt a strange hollow pang in my belly that he should agree, but then he added, “Many times, perhaps, but never just twice.” He bowed and went below."
AinUTL,5,ch5_e8,le 16 septembre 1666,"Now that I think on it, I am not certain exactly what he meant."
AinUTL,5,ch5_e8,le 16 septembre 1666,"I do enjoy making him laugh, though."
AinUTL,5,ch5_e8,le 16 septembre 1666,"It is difficult being alone, so difficult without Catherine, but the sound of his laughter helps a bit."
AinUTL,5,ch5_e9,le 17 septembre 1666,I spoke with Madame Laurent and Monsieur Deschamps.
AinUTL,5,ch5_e9,le 17 septembre 1666,I am now a fille à marier .
AinUTL,5,ch5_e9,le 17 septembre 1666,"I did not feel one bit different as I dressed this morning, putting on a clean chemise and my Sunday gown of deep green wool."
AinUTL,5,ch5_e9,le 17 septembre 1666,"The sleeves are long and the sun was shining, so I did not bother with a cloak."
AinUTL,5,ch5_e9,le 17 septembre 1666,The Maries were already on the deck when I came out.
AinUTL,5,ch5_e9,le 17 septembre 1666,"My, how splendid they looked in their finest clothing and their hair prettily dressed."
AinUTL,5,ch5_e9,le 17 septembre 1666,I suppose that when one is looking for a husband it is important to look appealing at all times.
AinUTL,5,ch5_e9,le 17 septembre 1666,Even Marie with the missing front tooth was particularly lovely.
AinUTL,5,ch5_e9,le 17 septembre 1666,"She smiled so warmly and laughed so much, that a person barely noticed the space in her smile."
AinUTL,5,ch5_e9,le 17 septembre 1666,"The Maries could not compete with Monsieur Deschamps, though, who wore fashionably full breeches and shoes with ribbons."
AinUTL,5,ch5_e9,le 17 septembre 1666,Two of the ship’s boats were lowered to the water and we were helped down into them.
AinUTL,5,ch5_e9,le 17 septembre 1666,Monsieur Deschamps rode with the captain and the girls in one boat.
AinUTL,5,ch5_e9,le 17 septembre 1666,"I went into the other with Madame Laurent, Kateri and her father."
AinUTL,5,ch5_e9,le 17 septembre 1666,Séraphin was with us as well.
AinUTL,5,ch5_e9,le 17 septembre 1666,In both boats were several merchants who intend to go no further than Québec.
AinUTL,5,ch5_e9,le 17 septembre 1666,All were armed.
AinUTL,5,ch5_e9,le 17 septembre 1666,"One had a blunderbuss and the others had muskets, as, I saw, did Monsieur Aubry."
AinUTL,5,ch5_e9,le 17 septembre 1666,"At the last moment, Minette, who had somehow escaped from my cabin, leaped down into my lap and settled herself there."
AinUTL,5,ch5_e9,le 17 septembre 1666,"If I was to have an adventure, then she would as well."
AinUTL,5,ch5_e9,le 17 septembre 1666,Séraphin handed me a piece of rope and I tied it onto her collar.
AinUTL,5,ch5_e9,le 17 septembre 1666,He always seems to have a piece of rope about him.
AinUTL,5,ch5_e9,le 17 septembre 1666,"“Is this not exciting,” cried Séraphin."
AinUTL,5,ch5_e9,le 17 septembre 1666,Monsieur Aubry smiled.
AinUTL,5,ch5_e9,le 17 septembre 1666,"He did not want to show it, I think, but he was as eager as any of us."
AinUTL,5,ch5_e9,le 17 septembre 1666,I called to Séraphin that I agreed.
AinUTL,5,ch5_e9,le 17 septembre 1666,I could not help myself.
AinUTL,5,ch5_e9,le 17 septembre 1666,"After all this while on the ship, the thought of setting my feet onto dry land was wonderful."
AinUTL,5,ch5_e9,le 17 septembre 1666,"At that moment, Madame Laurent leaned over and pinched me on the arm."
AinUTL,5,ch5_e9,le 17 septembre 1666,She whispered something about my behaviour being unbecoming to a fille à marier .
AinUTL,5,ch5_e9,le 17 septembre 1666,"I was so startled that I could not say a word, only sat there rubbing my arm."
AinUTL,5,ch5_e9,le 17 septembre 1666,"She had seemed so kind until now, but some people do change when their dignity is threatened."
AinUTL,5,ch5_e9,le 17 septembre 1666,Then my temper rose.
AinUTL,5,ch5_e9,le 17 septembre 1666,"I have not written of this, for it is not really something one wishes to set down on paper for the entire world to see, but I have a hot temper."
AinUTL,5,ch5_e9,le 17 septembre 1666,Papa used to say I am fiery just as Maman was when she was a young girl.
AinUTL,5,ch5_e9,le 17 septembre 1666,Did she fight the same battles with her temper as I do?
AinUTL,5,ch5_e9,le 17 septembre 1666,My temper won.
AinUTL,5,ch5_e9,le 17 septembre 1666,I could not control myself.
AinUTL,5,ch5_e9,le 17 septembre 1666,I stuck my tongue out at Madame Laurent.
