book_name,chapter_id,entry_id,date,sentence
AinUTL,13,ch13_e1,le 2 mai 1667,We began to walk towards it when a voice called out behind us.
AinUTL,13,ch13_e1,le 2 mai 1667,"There at the river, just reaching the shore, were five canoes."
AinUTL,13,ch13_e1,le 2 mai 1667,"We watched them land, and then men and women began to get out."
AinUTL,13,ch13_e1,le 2 mai 1667,"“Bonjour , monsieur,” a tall man called as he walked towards us."
AinUTL,13,ch13_e1,le 2 mai 1667,“What a time we have had of it.
AinUTL,13,ch13_e1,le 2 mai 1667,These women must get into the warmth of a building.
AinUTL,13,ch13_e1,le 2 mai 1667,"It is a happy day for the men of Montréal, monsieur, for more filles à marier have arrived.” There they were, tired, frightened and excited all at the same time."
AinUTL,13,ch13_e1,le 2 mai 1667,"They had been in Québec since the late fall, it seemed, but were here at last."
AinUTL,13,ch13_e1,le 2 mai 1667,I could see Madame Laurent fussing about.
AinUTL,13,ch13_e1,le 2 mai 1667,"Soldiers ran from the palisade cheering, “Vive le Roi!"
AinUTL,13,ch13_e1,le 2 mai 1667,Vive les filles à marier!” How it stirred the memories in my heart.
AinUTL,13,ch13_e1,le 2 mai 1667,"The Mohawks left us, going to their own encampment beside the palisade, and we walked back into the town."
AinUTL,13,ch13_e1,le 2 mai 1667,"To my relief, Jean no longer seemed so cross, although he should have been, I suppose."
AinUTL,13,ch13_e1,le 2 mai 1667,"He walked ahead of us with Séraphin, the two victorious hunters carrying the squirrels they had shot, talking to the tall man."
AinUTL,13,ch13_e1,le 2 mai 1667,Madame Laurent fussed and chattered as she led the girls through the gate.
AinUTL,13,ch13_e1,le 2 mai 1667,"“I know you will perish from curiosity if I do not tell you what was said, and I cannot have that,” Kateri whispered, dropping back a little."
AinUTL,13,ch13_e1,le 2 mai 1667,"She said the warriors suspected who I was, since Jean had described me to them many times."
AinUTL,13,ch13_e1,le 2 mai 1667,"She paused, mischief dancing in her eyes."
AinUTL,13,ch13_e1,le 2 mai 1667,"“They wished him luck.” When at last we returned to Tante Barbe’s house, it was she who now was extremely cross."
AinUTL,13,ch13_e1,le 2 mai 1667,"“Hélène and Kateri, you foolish girls, you have disobeyed me, and I cannot think of what to do with you."
AinUTL,13,ch13_e1,le 2 mai 1667,"Nothing perhaps, since I am so relieved to see you all in one piece."
AinUTL,13,ch13_e1,le 2 mai 1667,Confession?
AinUTL,13,ch13_e1,le 2 mai 1667,"A long and horrible penance?” Perhaps she should send to France for two hair shirts, she cried."
AinUTL,13,ch13_e1,le 2 mai 1667,Only the sight of those fat squirrels calmed her a little.
AinUTL,13,ch13_e1,le 2 mai 1667,What a potage she would make with them!
AinUTL,13,ch13_e1,le 2 mai 1667,Séraphin would be a wonderful provider for some lucky girl.
AinUTL,13,ch13_e1,le 2 mai 1667,"On she went, until she paused for breath and shook her head."
AinUTL,13,ch13_e1,le 2 mai 1667,"You need a husband, Hélène."
AinUTL,13,ch13_e1,le 2 mai 1667,"Does she not, Monsieur Aubry?” I admit I was not listening at all."
AinUTL,13,ch13_e1,le 2 mai 1667,"All I could do was stare at Minette, who sat close to the fire, asleep."
AinUTL,13,ch13_e1,le 2 mai 1667,I mumbled something about how I would have to believe that cats would be cats.
AinUTL,13,ch13_e1,le 2 mai 1667,It was not until later I realized that Jean had not answered Tante Barbe’s question.
AinUTL,13,ch13_e2,le 3 mai 1667,"Jean says that the Iroquois plan to sue for peace at Québec, and a treaty will surely be signed."
AinUTL,13,ch13_e2,le 3 mai 1667,Tante Barbe and I prayed together this morning at mass to give thanks.
AinUTL,13,ch13_e3,le 4 mai 1667,"I have already crushed the end of my quill and, after cutting it to a sharp point, dropped it twice."
AinUTL,13,ch13_e3,le 4 mai 1667,"This page is all blotted, so I have tried to calm myself before I begin again."
AinUTL,13,ch13_e3,le 4 mai 1667,Jean and Kateri came as always.
AinUTL,13,ch13_e3,le 4 mai 1667,"We sat quietly talking as Minette and the kittens played, Kateri having brought Kanon’tinekens along."
AinUTL,13,ch13_e3,le 4 mai 1667,"Kateri and Séraphin had started a game of cards, when someone opened the door and walked in."
AinUTL,13,ch13_e3,le 4 mai 1667,It was the tall man who had arrived with les filles à marier and Madame Laurent.
AinUTL,13,ch13_e3,le 4 mai 1667,He said breathlessly that he had been told this was the home of Mademoiselle St. Onge.
AinUTL,13,ch13_e3,le 4 mai 1667,I said that it was.
AinUTL,13,ch13_e3,le 4 mai 1667,"He handed me a packet, a letter from France."
AinUTL,13,ch13_e3,le 4 mai 1667,"“Madame,” he went on, waggling his eyebrows and flirting openly with Tante Barbe, “they say you have the finest spruce beer in all of the town."
AinUTL,13,ch13_e3,le 4 mai 1667,"I would appreciate a cup.” “Ha!” sniffed Tante Barbe, but she could not keep from smiling."
AinUTL,13,ch13_e3,le 4 mai 1667,"Once he sat drinking on the other side of the room, and Tante Barbe had returned to her chair, I broke the seal on the letter and began to read it aloud."
AinUTL,13,ch13_e3,le 4 mai 1667,It was from Cousin Pierre.
AinUTL,13,ch13_e3,le 4 mai 1667,"He was most distressed to have learned of Catherine’s death, and ashamed of how he had permitted Madeleine to treat us."
AinUTL,13,ch13_e3,le 4 mai 1667,"Anne had made an excellent marriage to the Vicompte de Patisse, who had a charming brother, Jerome."
AinUTL,13,ch13_e3,le 4 mai 1667,"As my guardian, Cousin Pierre had taken the liberty of beginning negotiations with this Jerome, and was willing to provide me with a good dowry so the family alliance would be strengthened further."
AinUTL,13,ch13_e3,le 4 mai 1667,I must return to France immediately.
AinUTL,13,ch13_e3,le 4 mai 1667,The tall man overheard me telling Tante Barbe this news.
AinUTL,13,ch13_e3,le 4 mai 1667,"He said he would be travelling back to Québec in a few weeks, and would be happy to take me if I could be ready."
AinUTL,13,ch13_e3,le 4 mai 1667,"“One of the priests and Madame Laurent will be with us, so it will be quite proper,” he added."
AinUTL,13,ch13_e3,le 4 mai 1667,I thanked him.
AinUTL,13,ch13_e3,le 4 mai 1667,"Then I looked at Jean, who was watching me in grave silence."
AinUTL,13,ch13_e3,le 4 mai 1667,"“I must go upstairs,” I said to him."
AinUTL,13,ch13_e3,le 4 mai 1667,He stood.
AinUTL,13,ch13_e3,le 4 mai 1667,"“I understand, Hélène,” he said softly and regretfully."
AinUTL,13,ch13_e3,le 4 mai 1667,"No, he did not, I told him."
AinUTL,13,ch13_e3,le 4 mai 1667,Would he please stay?
AinUTL,13,ch13_e3,le 4 mai 1667,It would not take me long to write an answer to my cousin.
AinUTL,13,ch13_e3,le 4 mai 1667,"I would tell him I was sorry to ruin his arrangements, but that I had accepted a proposal of marriage from a fine man."
AinUTL,13,ch13_e3,le 4 mai 1667,"By the time the letter reached France, I would be wed."
AinUTL,13,ch13_e3,le 4 mai 1667,The expression on Jean’s face said what words did not.
AinUTL,13,ch13_e3,le 4 mai 1667,Séraphin and Kateri were so happy for us.
AinUTL,13,ch13_e3,le 4 mai 1667,Tante Barbe kissed me again and again.
AinUTL,13,ch13_e3,le 4 mai 1667,The rest of the evening was filled with excitement as Jean and I made our plans.
AinUTL,13,ch13_e3,le 4 mai 1667,And the tall man who would carry my letter back to Cousin Pierre?
AinUTL,13,ch13_e3,le 4 mai 1667,Tante Barbe gave him another cup of beer at no charge.
AinUTL,13,ch13_e4,le 5 mai 1667,A fierce thunderstorm woke me just after dawn.
AinUTL,13,ch13_e4,le 5 mai 1667,"I opened the shutters of my room to see if any snow remained, and there it was."
AinUTL,13,ch13_e4,le 5 mai 1667,A rainbow.
AinUTL,13,ch13_e4,le 5 mai 1667,"How it, and the thoughts of last evening, made me smile."
AinUTL,13,ch13_e4,le 5 mai 1667,"The house is stirring and, in a moment, I will get up and dress."
AinUTL,13,ch13_e4,le 5 mai 1667,"I have taken off the mourning ring, and carefully put it away in my chest."
AinUTL,13,ch13_e4,le 5 mai 1667,"Rest in peace, Papa and Catherine, I whispered as I did it."
AinUTL,13,ch13_e4,le 5 mai 1667,I know they would have approved.
AinUTL,13,ch13_e4,le 5 mai 1667,"Papa said once that a dragonfly is the perfect symbol of life, and indeed, of one’s search for knowledge and understanding."
AinUTL,13,ch13_e4,le 5 mai 1667,"When it is a nymph, it spends months in the darkness, deep under the water of a pond."
AinUTL,13,ch13_e4,le 5 mai 1667,Then one day it climbs a cattail stem and emerges into the air.
AinUTL,13,ch13_e4,le 5 mai 1667,Its back splits open.
AinUTL,13,ch13_e4,le 5 mai 1667,"It is a great struggle, as life always is, but it prevails."
AinUTL,13,ch13_e4,le 5 mai 1667,Then it spreads its wings and soars into the sunshine of a new world.
AinUTL,13,ch13_e4,le 5 mai 1667,Today I believe that the door to a new world has opened for me.
AinUTL,2,ch2_e1,le 3 juin 1666,Catherine and I have talked and talked.
AinUTL,2,ch2_e1,le 3 juin 1666,"She does not normally ask my opinion, but there is no one to ask but me anymore, and hers is a hard choice to make."
AinUTL,2,ch2_e1,le 3 juin 1666,What Monsieur Deschamps proposed could be the means to our salvation.
AinUTL,2,ch2_e1,le 3 juin 1666,"The King will provide a dowry, just as though Catherine were his own daughter."
AinUTL,2,ch2_e1,le 3 juin 1666,She will be under His Majesty’s protection.
AinUTL,2,ch2_e1,le 3 juin 1666,"I will be too, for Catherine will not agree to this unless I am permitted to come along."
AinUTL,2,ch2_e1,le 3 juin 1666,I had a grand idea.
AinUTL,2,ch2_e1,le 3 juin 1666,I will be her housekeeper when she is married and we will be together.
AinUTL,2,ch2_e2,le 5 juin 1666,Monsieur Deschamps returned today.
AinUTL,2,ch2_e2,le 5 juin 1666,An agreement has been reached.
AinUTL,2,ch2_e2,le 5 juin 1666,"I may accompany her, but since I am so young Catherine insisted it will not be as a fille à marier , even though some girls even younger than I have married there."
AinUTL,2,ch2_e2,le 5 juin 1666,I cannot imagine marrying at eleven or twelve years of age.
AinUTL,2,ch2_e2,le 5 juin 1666,Monsieur Deschamps seemed to think it would be perfectly correct.
AinUTL,2,ch2_e2,le 5 juin 1666,"“Come now, mademoiselle,” he said."
AinUTL,2,ch2_e2,le 5 juin 1666,“Would you not like to be the wife of a Montréal merchant?” I could not help myself.
AinUTL,2,ch2_e2,le 5 juin 1666,I burst out that I was but thirteen years old.
AinUTL,2,ch2_e2,le 5 juin 1666,"“Ridiculous,” Catherine said to Monsieur Deschamps."
AinUTL,2,ch2_e2,le 5 juin 1666,“My sister will not marry until she is a woman.
AinUTL,2,ch2_e2,le 5 juin 1666,And she will not wed some stranger she meets in a faraway town in New France who only wishes to have anyone for his wife.
AinUTL,2,ch2_e2,le 5 juin 1666,"It will be someone she knows and respects, as I will marry Armand."
AinUTL,2,ch2_e2,le 5 juin 1666,"This dowry will be sufficient in his eyes, monsieur.” Monsieur Deschamps and Cousin Pierre looked at each other in a way I disliked."
AinUTL,2,ch2_e2,le 5 juin 1666,They said nothing.
AinUTL,2,ch2_e2,le 5 juin 1666,I can only pray that Catherine knows Armand as well as she believes that she does.
AinUTL,2,ch2_e3,le 6 juin 1666,We leave on Friday.
AinUTL,2,ch2_e3,le 6 juin 1666,The mass this Sunday morning was the last I shall ever attend at our church in Reignac.
AinUTL,2,ch2_e3,le 6 juin 1666,I prayed that both Catherine and I will have the strength to make the journey and leave our dear home behind.
AinUTL,2,ch2_e3,le 6 juin 1666,"Monsieur Deschamps has travelled on ahead to the ship, but Madame Laurent has remained here at Le Cadeau so that she might act as our chaperone on the journey."
AinUTL,2,ch2_e3,le 6 juin 1666,"She is a pleasant woman, pink-cheeked and jolly, and I think it will be a pleasure to travel with her."
AinUTL,2,ch2_e3,le 6 juin 1666,It will be a journey of three days or so from here.
AinUTL,2,ch2_e3,le 6 juin 1666,We are to go by Cousin Pierre’s coach to La Rochelle and then sail to New France.
AinUTL,2,ch2_e3,le 6 juin 1666,"There will not be room for us to take much, only a few chests."
AinUTL,2,ch2_e3,le 6 juin 1666,"Mine will be the small one, since Catherine has so many lovely things as a bride."
AinUTL,2,ch2_e3,le 6 juin 1666,Cousin Pierre has shown us a kindness in the form of a gift of money.
AinUTL,2,ch2_e3,le 6 juin 1666,Fifty livres .
AinUTL,2,ch2_e3,le 6 juin 1666,"It is generous, I suppose, and I pray it will be enough."
AinUTL,2,ch2_e3,le 6 juin 1666,As a fille à marier Catherine has one hundred livres.
AinUTL,2,ch2_e3,le 6 juin 1666,"Some of that is for clothing, and sixty for the ship’s passage."
AinUTL,2,ch2_e3,le 6 juin 1666,Monsieur Deschamps received ten livres from that as a fee for enlisting her.
AinUTL,2,ch2_e3,le 6 juin 1666,I understand his eagerness now.
AinUTL,2,ch2_e3,le 6 juin 1666,Madame Laurent says that it may be possible to procure more private accommodations on the ship.
AinUTL,2,ch2_e3,le 6 juin 1666,Those with no money must share a common space.
AinUTL,2,ch2_e3,le 6 juin 1666,"Catherine wrinkles her nose to think of such a thing, but it could be most interesting."
AinUTL,2,ch2_e4,le 7 juin 1666,I have helped Louise carefully fold and pack Catherine’s trousseau.
AinUTL,2,ch2_e4,le 7 juin 1666,Cousine Madeleine and Anne watched us.
AinUTL,2,ch2_e4,le 7 juin 1666,Madeleine made a suggestion once or twice.
AinUTL,2,ch2_e4,le 7 juin 1666,"She does know a good deal about the care of fine clothing, as she has so much of it herself."
AinUTL,2,ch2_e4,le 7 juin 1666,"We tucked in small bags of herbs among the garments, for the lavender, peppermint, cloves and thyme will keep the cloth sweet smelling."
AinUTL,2,ch2_e4,le 7 juin 1666,"There is another chest with our bedding, sheets and quilts and such."
AinUTL,2,ch2_e4,le 7 juin 1666,"It has worn me out, and so I am writing this in bed."
AinUTL,2,ch2_e4,le 7 juin 1666,I packed my own things alone in my room.
AinUTL,2,ch2_e4,le 7 juin 1666,"Stockings, shifts, pockets, aprons, handkerchiefs, shoes, caps, a coiffe , a comb, a warm shawl, an everyday gown with its skirt and bodice, and a gown for church."
AinUTL,2,ch2_e4,le 7 juin 1666,"Cleaning sticks for my teeth, my rosary and my prayer book."
AinUTL,2,ch2_e4,le 7 juin 1666,"Some small skeins of brightly coloured linen thread, and my lucet for making cord."
AinUTL,2,ch2_e4,le 7 juin 1666,It is all crammed into my chest.
AinUTL,2,ch2_e4,le 7 juin 1666,"I bent down to pick up a ribbon that had dropped onto the carpet, and when I turned to my chest, there was Minette sitting inside it."
AinUTL,2,ch2_e4,le 7 juin 1666,It brought tears to my eyes.
AinUTL,2,ch2_e4,le 7 juin 1666,I picked her up and she purred in contentment.
AinUTL,2,ch2_e4,le 7 juin 1666,"“No, Minette,” I said sadly."
AinUTL,2,ch2_e4,le 7 juin 1666,“You cannot come.” I told her that she must stay here with Louise or go to the barn.
AinUTL,2,ch2_e4,le 7 juin 1666,"She must be a good, brave cat and keep away all the mice."
AinUTL,2,ch2_e4,le 7 juin 1666,"I had decided that I will take her collar and leash with me, as a memento, but she must stay home."
AinUTL,2,ch2_e4,le 7 juin 1666,Catherine said it was very silly of me to bring along something so unnecessary.
AinUTL,2,ch2_e4,le 7 juin 1666,Life is unfair.
AinUTL,2,ch2_e5,le 10 juin 1666,I think that I have never been more happy and sad and fearful all at the same time.
AinUTL,2,ch2_e5,le 10 juin 1666,"There will be no sleep for me this night, I fear, for tomorrow we are to begin the grand adventure."
AinUTL,2,ch2_e5,le 10 juin 1666,I may as well write.
AinUTL,2,ch2_e5,le 10 juin 1666,"Here I lie, all wrapped in feather quilts."
AinUTL,2,ch2_e5,le 10 juin 1666,"How odd it will be, after tonight, not to sleep in the same bed in which I have slept since I left the nursery."
AinUTL,2,ch2_e5,le 10 juin 1666,"The bed curtains have not yet been let down, and one candle burns on the small table next to me."
AinUTL,2,ch2_e5,le 10 juin 1666,"It is the last time I will spend a night here, and I must set down every detail so that when I am old I will recall it clearly."
AinUTL,2,ch2_e5,le 10 juin 1666,"As always, Louise scolded that I should not drip ink upon the coverlet, and asked if I had said my prayers."
AinUTL,2,ch2_e5,le 10 juin 1666,I can be forgetful.
AinUTL,2,ch2_e5,le 10 juin 1666,"But there was no anger in her voice, for she already missed us."
AinUTL,2,ch2_e5,le 10 juin 1666,"She is worried about us too, though she tries not to show it."
AinUTL,2,ch2_e5,le 10 juin 1666,I put down my quill and hugged her.
AinUTL,2,ch2_e5,le 10 juin 1666,"I assured her that I would take care, that my prayers had been said, and see how well I had braided my hair."
AinUTL,2,ch2_e5,le 10 juin 1666,I must do it for myself now and I must dress Catherine’s hair just as Louise has shown me.
AinUTL,2,ch2_e5,le 10 juin 1666,It would not do for a fille à marier to appear untidy.
AinUTL,2,ch2_e5,le 10 juin 1666,"At this, she sniffed and gave a sad sigh."
AinUTL,2,ch2_e5,le 10 juin 1666,"“ Bien ,” she said in approval."
AinUTL,2,ch2_e5,le 10 juin 1666,She told me to put out my candle and go to sleep.
AinUTL,2,ch2_e5,le 10 juin 1666,The journey to the ship and La Rochelle tomorrow would begin early.
AinUTL,2,ch2_e5,le 10 juin 1666,"I begged for more time, knowing she would not refuse me."
AinUTL,2,ch2_e5,le 10 juin 1666,"Picking up her own candle, she shook her head hopelessly, kissed my forehead and bid me sleep well."
AinUTL,2,ch2_e5,le 10 juin 1666,"At the door she asked, “You do not have Minette in bed with you again, do you?"
AinUTL,2,ch2_e5,le 10 juin 1666,"She sheds black hair over everything.” I told her that of course I did not have Minette in bed, speaking as innocently as I could."
AinUTL,2,ch2_e5,le 10 juin 1666,"Minette began her low, steady purring at the sound of my voice saying her name."
AinUTL,2,ch2_e5,le 10 juin 1666,"Louise did not hear her though, and even if she did, I knew she would say nothing this last night."
AinUTL,2,ch2_e5,le 10 juin 1666,"When Louise closed the door, Minette crawled out, shook herself and scattered black hairs upon the coverlet."
AinUTL,2,ch2_e5,le 10 juin 1666,"She began to wash, first one paw, then the other and then her face."
AinUTL,2,ch2_e5,le 10 juin 1666,"Ah, Minette, I said to myself, stroking her back."
AinUTL,2,ch2_e5,le 10 juin 1666,"She arched up, warm and soft under my hand."
AinUTL,2,ch2_e5,le 10 juin 1666,"I picked her up and hugged her, and she purred very loudly."
AinUTL,2,ch2_e5,le 10 juin 1666,"Tears came to my eyes, although I loathe to cry."
AinUTL,2,ch2_e6,le 11 juin 1666,"Catherine is asleep next to me here in our room at the inn, where we have stopped for the night."
AinUTL,2,ch2_e6,le 11 juin 1666,"I myself am exhausted, but far too excited to sleep."
AinUTL,2,ch2_e6,le 11 juin 1666,"Besides, I fear that if I do not record the day’s events, I may forget them by morning."
AinUTL,2,ch2_e6,le 11 juin 1666,This morning I dressed myself by candlelight.
AinUTL,2,ch2_e6,le 11 juin 1666,"First, a fresh linen shift, then warm stockings with buckled garters."
AinUTL,2,ch2_e6,le 11 juin 1666,Heavy shoes would keep my feet dry if it was damp.
AinUTL,2,ch2_e6,le 11 juin 1666,Then the hated corps .
AinUTL,2,ch2_e6,le 11 juin 1666,"It is no easy task to put on a corps unassisted, and, although I did not lace myself in as tightly as Louise always did, it would suffice."
AinUTL,2,ch2_e6,le 11 juin 1666,"Minette made it more difficult than usual, since she wound around my legs the entire time."
AinUTL,2,ch2_e6,le 11 juin 1666,I put on a bodice and skirt of plain grey wool.
AinUTL,2,ch2_e6,le 11 juin 1666,The gown suits me.
AinUTL,2,ch2_e6,le 11 juin 1666,"I do not care so much for fashion, and if I am warm and dry, nothing else matters."
AinUTL,2,ch2_e6,le 11 juin 1666,I would wear little jewellery.
AinUTL,2,ch2_e6,le 11 juin 1666,"I had at my neck the cross that Papa made for Maman before they were wed, and on my finger, the silver mourning ring I have worn since Papa died."
AinUTL,2,ch2_e6,le 11 juin 1666,The mirror showed me a thin girl with a serious expression.
AinUTL,2,ch2_e6,le 11 juin 1666,I made a horrible face at this girl as I combed and put up my hair.
AinUTL,2,ch2_e6,le 11 juin 1666,I picked up the candle and walked down the hallway to Catherine’s chamber to help her ready herself for the journey.
AinUTL,2,ch2_e6,le 11 juin 1666,"Minette followed me as far as the door, and then scampered off in search of her breakfast in the kitchen."
AinUTL,2,ch2_e6,le 11 juin 1666,"There was Catherine in her shift, her long blond hair hanging down her back."
AinUTL,2,ch2_e6,le 11 juin 1666,To me she was as lovely as a princess.
AinUTL,2,ch2_e6,le 11 juin 1666,"We do not look the least alike, for she is fair and I am dark."
AinUTL,2,ch2_e6,le 11 juin 1666,"Her eyes are a clear blue, but this morning they were red, and I know she had been weeping, as I had."
AinUTL,2,ch2_e6,le 11 juin 1666,She smiled bravely.
AinUTL,2,ch2_e6,le 11 juin 1666,"“Come lace me into my corps , Hélène.” She would wear the yellow travelling gown today."
AinUTL,2,ch2_e6,le 11 juin 1666,I asked if she was certain about this journey as I pulled the laces tightly to make her waist slender.
AinUTL,2,ch2_e6,le 11 juin 1666,I myself wonder if it is the right thing.
AinUTL,2,ch2_e6,le 11 juin 1666,"“There is nothing for me here, Hélène."
AinUTL,2,ch2_e6,le 11 juin 1666,I could have entered the convent and become a holy sister.
AinUTL,2,ch2_e6,le 11 juin 1666,"It is a good life, but not one I wish to live."
AinUTL,2,ch2_e6,le 11 juin 1666,"My path will be far different as a fille à marier ,” she said, just as I knew she would."
AinUTL,2,ch2_e6,le 11 juin 1666,I helped her on with her gown.
AinUTL,2,ch2_e6,le 11 juin 1666,"The bodice and skirt were both of fine, heavy wool."
AinUTL,2,ch2_e6,le 11 juin 1666,She must look a lady every moment if she is to please Armand.
AinUTL,2,ch2_e6,le 11 juin 1666,"I braided her hair and fastened it upon her head with long pins of tortoiseshell, letting little curls dangle here and there so that her amber earrings showed between."
AinUTL,2,ch2_e6,le 11 juin 1666,"Before we left her chamber Catherine set her hands upon my shoulders and said, “We will be happy in New France, Hélène."
AinUTL,2,ch2_e6,le 11 juin 1666,"I promise it.” I smiled, but did not answer."
AinUTL,2,ch2_e6,le 11 juin 1666,Catherine picked up her cloak and went down the stairs.
AinUTL,2,ch2_e6,le 11 juin 1666,I returned to my chamber one last time.
AinUTL,2,ch2_e6,le 11 juin 1666,"I will never see it again, I thought."
AinUTL,2,ch2_e6,le 11 juin 1666,"For a moment, I feared that my heart would break."
AinUTL,2,ch2_e6,le 11 juin 1666,"I closed my eyes, said a prayer for bravery and swirled my cloak over my shoulders."
AinUTL,2,ch2_e6,le 11 juin 1666,I had a travelling bag of embroidered fabric that once had been Maman’s.
AinUTL,2,ch2_e6,le 11 juin 1666,"In it I put my quills, this diary in which I write, a small stoppered bottle, and packets of ink powder."
AinUTL,2,ch2_e6,le 11 juin 1666,I had also taken Papa’s journal.
AinUTL,2,ch2_e6,le 11 juin 1666,It would be like taking part of him with me.
AinUTL,2,ch2_e6,le 11 juin 1666,"Clutching the bag, I went down to the entrance hall and out into the morning."
AinUTL,2,ch2_e6,le 11 juin 1666,Our coach waited on the cobbles with Madame Laurent inside.
AinUTL,2,ch2_e6,le 11 juin 1666,"The horses stamped and blew and one rolled his big brown eye back at me as if to say, “Get in, girl."
AinUTL,2,ch2_e6,le 11 juin 1666,"I want to run!” Louise, wrapped in her shawl, kissed us one last time before we climbed into the carriage."
AinUTL,2,ch2_e6,le 11 juin 1666,The few of our old servants who had come by to see us off wept and sniffled.
AinUTL,2,ch2_e6,le 11 juin 1666,"Cousin Pierre was there, but Cousine Madeleine and Anne were still in bed."
AinUTL,2,ch2_e6,le 11 juin 1666,"They needed their sleep, he said."
AinUTL,2,ch2_e6,le 11 juin 1666,"The coachman helped Catherine in first, and then me."
AinUTL,2,ch2_e6,le 11 juin 1666,He climbed up onto his seat.
AinUTL,2,ch2_e6,le 11 juin 1666,"There was a snap of the coachman’s whip, a jingle of harness, and the carriage began to move."
AinUTL,2,ch2_e6,le 11 juin 1666,Down the lane and out into the countryside it rolled.
AinUTL,2,ch2_e6,le 11 juin 1666,"Home, Louise and Minette were becoming smaller and smaller."
AinUTL,2,ch2_e6,le 11 juin 1666,"Minette, I thought to myself in misery."
AinUTL,2,ch2_e6,le 11 juin 1666,"“I did not kiss Minette farewell, Catherine,” I said aloud."
AinUTL,2,ch2_e6,le 11 juin 1666,At the sound of my voice Minette began to purr!
AinUTL,2,ch2_e6,le 11 juin 1666,"She crawled out from under the seat where she had been hiding, leaped onto my lap and rubbed against my face."
AinUTL,2,ch2_e6,le 11 juin 1666,“Minette!” I cried in a rather different tone.
AinUTL,2,ch2_e6,le 11 juin 1666,“Oh my fine Minette!
AinUTL,2,ch2_e6,le 11 juin 1666,"You are coming with us after all.” I dug in my bag, pulled out her collar and buckled it on."
AinUTL,2,ch2_e6,le 11 juin 1666,"“We cannot take a cat to New France,” said Madame Laurent."
AinUTL,2,ch2_e6,le 11 juin 1666,I will never forget the exasperation in her voice.
AinUTL,2,ch2_e6,le 11 juin 1666,She lifted her hand to rap on the roof and signal the coachman to stop.
AinUTL,2,ch2_e6,le 11 juin 1666,"I protested that if we were going, why might not a cat?"
AinUTL,2,ch2_e6,le 11 juin 1666,"I thought I knew my sister Catherine very, very well."
AinUTL,2,ch2_e6,le 11 juin 1666,"She opened her mouth to argue, to say some thing about dignity or appearances, but then she closed her lips and patted my hand."
AinUTL,2,ch2_e6,le 11 juin 1666,"“Why not indeed, Hélène?"
AinUTL,2,ch2_e6,le 11 juin 1666,"If we are going, why should Minette not come along?"
