book_name,chapter_id,entry_id,date,sentence
AinUTL,6,ch6_e3,le 3 octobre 1666,"Madame Laurent explained that some of the men do not wish to marry, but there is no choice."
AinUTL,6,ch6_e3,le 3 octobre 1666,"“Ignore them,” she said."
AinUTL,6,ch6_e3,le 3 octobre 1666,"“Most are willing enough.” Then with great authority she announced, “We will take the girls to la Soeur Bourgeoys’s house, Monsieur Deschamps."
AinUTL,6,ch6_e3,le 3 octobre 1666,"I wish to see them settled, for I will return to Québec in a few days.” She turned to us."
AinUTL,6,ch6_e3,le 3 octobre 1666,“You girls will be safe and comfortable with her.” My heart sank.
AinUTL,6,ch6_e3,le 3 octobre 1666,I had no wish to go to la Soeur Bourgeoys’s house.
AinUTL,6,ch6_e3,le 3 octobre 1666,"I must find the home of the Lecôtés, I told her."
AinUTL,6,ch6_e3,le 3 octobre 1666,"But when I said as much, Monsieur Deschamps was firm."
AinUTL,6,ch6_e3,le 3 octobre 1666,I would go with the other girls.
AinUTL,6,ch6_e3,le 3 octobre 1666,Monsieur Aubry said in a low voice.
AinUTL,6,ch6_e3,le 3 octobre 1666,"“Mademoiselle St. Onge may be a fille à marier , Monsieur Deschamps, but she has this last responsibility to her sister.” He dismissed Monsieur Deschamps as though he were an annoying gnat, and turned to me."
AinUTL,6,ch6_e3,le 3 octobre 1666,"“Do not concern yourself about your safety, mademoiselle."
AinUTL,6,ch6_e3,le 3 octobre 1666,I will take you to the Lecôtés.
AinUTL,6,ch6_e3,le 3 octobre 1666,Then I will escort you and your belongings to la Soeur Bourgeoys’s house before I take Kateri home to my shop.
AinUTL,6,ch6_e3,le 3 octobre 1666,"You may accompany us if you wish, Séraphin."
AinUTL,6,ch6_e3,le 3 octobre 1666,"I can provide you with a bed until you find a position.” “Merci, Monsieur Aubry,” said Séraphin in great relief."
AinUTL,6,ch6_e3,le 3 octobre 1666,Monsieur Aubry hired an ox cart.
AinUTL,6,ch6_e3,le 3 octobre 1666,The man who owned it helped him and Séraphin pile in our chests.
AinUTL,6,ch6_e3,le 3 octobre 1666,"Yes, he knew the location of the Lecôté house."
AinUTL,6,ch6_e3,le 3 octobre 1666,It was a fine building.
AinUTL,6,ch6_e3,le 3 octobre 1666,"Minette, who loves high places, jumped up and sat at the very top of the pile."
AinUTL,6,ch6_e3,le 3 octobre 1666,The Indians could not stop laughing and pointing.
AinUTL,6,ch6_e3,le 3 octobre 1666,Kateri squeezed my hand and I gave her a tiny smile.
AinUTL,6,ch6_e3,le 3 octobre 1666,We walked through the palisade and into the town as the man leading the ox chattered to Monsieur Aubry and Séraphin.
AinUTL,6,ch6_e3,le 3 octobre 1666,The farms and houses I saw that day might have been invisible.
AinUTL,6,ch6_e3,le 3 octobre 1666,"My mind was so busy with what I would say to Armand that when the cart stopped, I went on a few steps."
AinUTL,6,ch6_e3,le 3 octobre 1666,"It was a large house, large, at least, by the standards of the town."
AinUTL,6,ch6_e3,le 3 octobre 1666,The Lecôtés were wealthy.
AinUTL,6,ch6_e3,le 3 octobre 1666,"How happy Catherine would have been here, I thought."
AinUTL,6,ch6_e3,le 3 octobre 1666,How sad her beloved Armand would be.
AinUTL,6,ch6_e3,le 3 octobre 1666,Kateri took Minette in her arms so that she would not follow.
AinUTL,6,ch6_e3,le 3 octobre 1666,"I took a deep breath, smoothed my hair, and walked to the door."
AinUTL,6,ch6_e3,le 3 octobre 1666,I knocked once and waited.
AinUTL,6,ch6_e3,le 3 octobre 1666,Silence.
AinUTL,6,ch6_e3,le 3 octobre 1666,I had just raised my hand to knock again when a young woman opened the door.
AinUTL,6,ch6_e3,le 3 octobre 1666,"She smiled, looked past me at the cart and people who waited on the street and said, “Bonjour, mademoiselle."
AinUTL,6,ch6_e3,le 3 octobre 1666,How may I help you?” I asked to speak with Armand Lecôté.
AinUTL,6,ch6_e3,le 3 octobre 1666,"He was not here, nor was his father, I learned, and so I asked to speak to his mother."
AinUTL,6,ch6_e3,le 3 octobre 1666,"She was, unfortunately, not at home either, the woman said sweetly."
AinUTL,6,ch6_e3,le 3 octobre 1666,"When I explained that I must give a message to Armand Lecôté, she looked surprised."
AinUTL,6,ch6_e3,le 3 octobre 1666,"“You may leave the message with me, mademoiselle,” she said."
AinUTL,6,ch6_e3,le 3 octobre 1666,"“I, you see, am Armand’s wife.” When I then explained that I did not know of Armand’s marriage she seemed confused, but she quickly composed herself."
AinUTL,6,ch6_e3,le 3 octobre 1666,"How rude of Armand to neglect to write, she said, but then love addles a man’s brains sometimes, does it not?"
AinUTL,6,ch6_e3,le 3 octobre 1666,Would I care to wait inside and pay my respects to him?
AinUTL,6,ch6_e3,le 3 octobre 1666,I would not.
AinUTL,6,ch6_e3,le 3 octobre 1666,"She could tell Armand, though, that Catherine St. Onge was dead."
AinUTL,6,ch6_e3,le 3 octobre 1666,“Who was she?” asked Armand’s wife in confusion.
AinUTL,6,ch6_e3,le 3 octobre 1666,"When I turned away she called out, “I will say a prayer for her soul, mademoiselle.” I walked back to the cart with as much dignity as I could manage, but my face was pale and I could feel the tears wanting to start in my eyes."
AinUTL,6,ch6_e3,le 3 octobre 1666,I would not let myself weep.
AinUTL,6,ch6_e3,le 3 octobre 1666,I took Minette from Kateri and glanced at Monsieur Aubry.
AinUTL,6,ch6_e3,le 3 octobre 1666,"There was no pity in his face, and now that I think on it, instead there was admiration."
AinUTL,6,ch6_e3,le 3 octobre 1666,"“Again you do well, mademoiselle,” he said after a moment."
AinUTL,6,ch6_e3,le 3 octobre 1666,“You have spirit.” I did not feel as though I had much spirit.
AinUTL,6,ch6_e3,le 3 octobre 1666,"In fact, I felt limp all over, especially when I realized that now I must go to stay at la Soeur Bourgeoys’s."
AinUTL,6,ch6_e3,le 3 octobre 1666,“What of Madame Moitié?” Kateri asked.
AinUTL,6,ch6_e3,le 3 octobre 1666,"“Have you forgotten her, Hélène?"
AinUTL,6,ch6_e3,le 3 octobre 1666,"We can take her there first rather than to la Soeur Bourgeoys’s, can we not, Papa?” I was so distressed that I did not answer."
AinUTL,6,ch6_e3,le 3 octobre 1666,I just swallowed very hard and nodded.
AinUTL,6,ch6_e3,le 3 octobre 1666,How could Armand have married?
AinUTL,6,ch6_e3,le 3 octobre 1666,Why had there been no letter?
AinUTL,6,ch6_e3,le 3 octobre 1666,"We continued down what the man said was Rue Saint-Paul, which I scarcely saw, for now my eyes were filled with tears."
AinUTL,6,ch6_e3,le 3 octobre 1666,"I blinked and blinked to force them back, and I could barely see Minette, who happily walked ahead of me on her lead."
AinUTL,6,ch6_e3,le 3 octobre 1666,Kateri still held my other hand and now and again gave it a squeeze.
AinUTL,6,ch6_e3,le 3 octobre 1666,"We stopped at a house, the door of which was open to let in the breeze."
AinUTL,6,ch6_e3,le 3 octobre 1666,"Even from where I stood, I could hear the sound of laughter and smell food."
AinUTL,6,ch6_e3,le 3 octobre 1666,My stomach betrayed me and my mouth watered more than my eyes had.
AinUTL,6,ch6_e3,le 3 octobre 1666,The man and Séraphin stayed outside with the cart while we went in.
AinUTL,6,ch6_e3,le 3 octobre 1666,"I think of myself as a brave person, but beneath my skirts my legs were unsteady."
AinUTL,6,ch6_e3,le 3 octobre 1666,Perhaps ma tante would throw me out.
AinUTL,6,ch6_e3,le 3 octobre 1666,"Monsieur Aubry was speaking to an exceedingly short, plump woman."
AinUTL,6,ch6_e3,le 3 octobre 1666,"Her mouth dropped open in surprise, she wiped her hands on her apron, and she pushed her way through the crowd of men who stood between the two of us."
AinUTL,6,ch6_e3,le 3 octobre 1666,"She kissed me on both cheeks, embraced me, and then held me away from her so that she could take a long look."
AinUTL,6,ch6_e3,le 3 octobre 1666,“Hélène St. Onge.
AinUTL,6,ch6_e3,le 3 octobre 1666,I never expected to see any of my husband’s family here.
AinUTL,6,ch6_e3,le 3 octobre 1666,"Une fille à marier , is it?"
AinUTL,6,ch6_e3,le 3 octobre 1666,I wager there is quite a story for you to tell.
AinUTL,6,ch6_e3,le 3 octobre 1666,But for now you need hot soup in your belly and a quiet night’s sleep.
AinUTL,6,ch6_e3,le 3 octobre 1666,"And look, you have a little cat."
AinUTL,6,ch6_e3,le 3 octobre 1666,A little cat is always welcome here as long as she is a good mouser.
AinUTL,6,ch6_e3,le 3 octobre 1666,"Is she a good mouser, ma chère nièce ?” I vow she said all of that in an endless flood."
AinUTL,6,ch6_e3,le 3 octobre 1666,I thanked Monsieur Aubry while my belongings were carried in and up the narrow staircase to the second floor.
AinUTL,6,ch6_e3,le 3 octobre 1666,"“It is nothing, mademoiselle,” he said with a wide smile."
AinUTL,6,ch6_e3,le 3 octobre 1666,“Kateri and I will sleep well knowing you are safe here.
AinUTL,6,ch6_e3,le 3 octobre 1666,I will send word to Madame Laurent of your whereabouts.
AinUTL,6,ch6_e3,le 3 octobre 1666,"Bonne nuit , mademoiselle.” “Bonne nuit , Monsieur Aubry."
AinUTL,6,ch6_e3,le 3 octobre 1666,"Bonne nuit , Kateri, ” I answered."
AinUTL,6,ch6_e3,le 3 octobre 1666,"Standing in the doorway, I watched them walk back to the cart."
AinUTL,6,ch6_e3,le 3 octobre 1666,Monsieur Aubry was whistling.
AinUTL,6,ch6_e3,le 3 octobre 1666,"He seemed so much happier here, and so did Kateri, but then they had come home."
AinUTL,6,ch6_e3,le 3 octobre 1666,Tante Barbe was talking again.
AinUTL,6,ch6_e3,le 3 octobre 1666,She called to a serving girl to bring food to the second floor.
AinUTL,6,ch6_e3,le 3 octobre 1666,"She bustled me up to a small room, told me I must eat, wash my hands and face, change into my nightdress, say my prayers and climb under the quilts."
AinUTL,6,ch6_e3,le 3 octobre 1666,"I should sleep well, she said, since this bed had a new mattress stuffed with cattail fluff."
AinUTL,6,ch6_e3,le 3 octobre 1666,That is how I came to be here in this warm bed under the roof of ma Tante Barbe.
AinUTL,6,ch6_e4,le 4 octobre 1666,"This morning Tante Barbe refused to wake me early, saying that I had needed to rest."
AinUTL,6,ch6_e4,le 4 octobre 1666,I slept late.
AinUTL,6,ch6_e4,le 4 octobre 1666,The sun was well up in the sky when she brought up a tray of food for me.
AinUTL,6,ch6_e4,le 4 octobre 1666,"There was cheese and fresh bread, a boiled egg and, unbelievably, a pot of chocolate."
AinUTL,6,ch6_e4,le 4 octobre 1666,For Minette there was a bowl of milk and a piece of codfish.
AinUTL,6,ch6_e4,le 4 octobre 1666,I felt my throat tighten at such kindness.
AinUTL,6,ch6_e4,le 4 octobre 1666,Tante Barbe patted my hand.
AinUTL,6,ch6_e4,le 4 octobre 1666,"“It is all behind you now, ma chère ."
AinUTL,6,ch6_e4,le 4 octobre 1666,"Later, when you feel as though you can, you will tell me how it is that you have come here on your own.” Then she hurried off, calling orders to the girl who helps her."
AinUTL,6,ch6_e4,le 4 octobre 1666,"I admit that I feel guilty just lying here, but not so guilty that I could not have a second cup of chocolate."
AinUTL,6,ch6_e4,le 4 octobre 1666,ce même soir I have had the talk with Tante Barbe.
AinUTL,6,ch6_e4,le 4 octobre 1666,I wept and so did she.
AinUTL,6,ch6_e4,le 4 octobre 1666,"It is strange how dreadful it feels to cry, and yet how good it feels if you can share that unhappiness with someone else."
AinUTL,6,ch6_e4,le 4 octobre 1666,"“You are now a fille à marier , Hélène, and so it is your duty to the King to wed here."
AinUTL,6,ch6_e4,le 4 octobre 1666,"You need not marry just anyone, though."
AinUTL,6,ch6_e4,le 4 octobre 1666,"Besides, you are too young still."
AinUTL,6,ch6_e4,le 4 octobre 1666,Take your time.
AinUTL,6,ch6_e4,le 4 octobre 1666,Make a good choice.
AinUTL,6,ch6_e4,le 4 octobre 1666,"I see you have common sense, but a successful marriage is made of more than common sense."
AinUTL,6,ch6_e4,le 4 octobre 1666,"Until then, you will stay here with me."
AinUTL,6,ch6_e4,le 4 octobre 1666,"I can always use another pair of willing hands.” With a sniff she added, “I will arrange it with this Monsieur Deschamps."
AinUTL,6,ch6_e4,le 4 octobre 1666,"He may not like it, but he must understand that you are still a fille à marier no matter where you live.” I was learning that Tante Barbe loves to talk."
AinUTL,6,ch6_e4,le 4 octobre 1666,"She looked at me in a very serious way and asked, “You have lived all your life with only your father."
AinUTL,6,ch6_e4,le 4 octobre 1666,What household skills do you have?” I mumbled something about being able to cook and milk cows and how I could dust extremely well.
AinUTL,6,ch6_e4,le 4 octobre 1666,She laughed.
AinUTL,6,ch6_e4,le 4 octobre 1666,"“A wife needs to have many skills, Hélène."
AinUTL,6,ch6_e4,le 4 octobre 1666,I will help prepare you for the lucky man who will some day be your husband.
AinUTL,6,ch6_e4,le 4 octobre 1666,"Your papa made a good beginning, but this is New France.” Tomorrow we will begin."
AinUTL,6,ch6_e4,le 4 octobre 1666,"Since I left Le Cadeau , so many changes have taken place in my life."
AinUTL,6,ch6_e4,le 4 octobre 1666,Only here can I admit how difficult and sometimes hopeless it all has seemed.
AinUTL,6,ch6_e4,le 4 octobre 1666,"Now, though, I feel as though my world may stay the same for a little while."
AinUTL,6,ch6_e4,le 4 octobre 1666,At least I hope and pray that it will.
AinUTL,6,ch6_e5,le 5 octobre 1666,"I am tired, but content."
AinUTL,6,ch6_e5,le 5 octobre 1666,"I can see, though, that it will be a rare event for me to again write in this diary during the day."
AinUTL,6,ch6_e5,le 5 octobre 1666,The morning begins slowly here at Tante Barbe’s house.
AinUTL,6,ch6_e5,le 5 octobre 1666,It certainly does not take long to reach a furious pace.
AinUTL,6,ch6_e5,le 5 octobre 1666,I will write at night once I am in bed.
AinUTL,6,ch6_e5,le 5 octobre 1666,Tante Barbe does not care in the least if I write in bed.
AinUTL,6,ch6_e5,le 5 octobre 1666,She says that if I spill the ink I must wash the quilt myself.
AinUTL,6,ch6_e5,le 5 octobre 1666,It seems a fair proposal to me.
AinUTL,6,ch6_e5,le 5 octobre 1666,"There are only a few legal taverns in Montréal, Tante Barbe has told me."
AinUTL,6,ch6_e5,le 5 octobre 1666,"There are other places that sell strong drink such as brandy to the men, but her house is not one of them."
AinUTL,6,ch6_e5,le 5 octobre 1666,"“None of that for me,” she explained."
AinUTL,6,ch6_e5,le 5 octobre 1666,The fighting it causes!
AinUTL,6,ch6_e5,le 5 octobre 1666,"I have the two rooms upstairs that I let for ten sols a night, and I serve good food and weak beer."
AinUTL,6,ch6_e5,le 5 octobre 1666,"If the men bring their own wine or brandy to go with it, such is life.” I am to help with each part of the running of the house."
AinUTL,6,ch6_e5,le 5 octobre 1666,"No job is too lowly, Tante Barbe said."
AinUTL,6,ch6_e5,le 5 octobre 1666,"“You see, Hélène, each thing you learn to do properly here is something you will need to know when you have your own home."
AinUTL,6,ch6_e5,le 5 octobre 1666,"You will have an honest wage for what you do here, as well."
AinUTL,6,ch6_e5,le 5 octobre 1666,"Not so much as my other girl, Bernadette, since you live here and take your meals."
AinUTL,6,ch6_e5,le 5 octobre 1666,"You will begin at forty sols a week and when your skills grow, so will your wages.” I protested with embarrassment that she need not pay me."
AinUTL,6,ch6_e5,le 5 octobre 1666,She shook her head firmly.
AinUTL,6,ch6_e5,le 5 octobre 1666,"I was not an indentured servant or a slave, but her niece, and in a manner, her apprentice."
AinUTL,6,ch6_e5,le 5 octobre 1666,"“To be paid is only fair,” she said."
AinUTL,6,ch6_e5,le 5 octobre 1666,"“That is the first lesson you have learned today, Hélène."
AinUTL,6,ch6_e5,le 5 octobre 1666,Always be fair.” Apprentice.
AinUTL,6,ch6_e5,le 5 octobre 1666,I had never thought for a minute that I might become anyone’s apprentice.
AinUTL,6,ch6_e5,le 5 octobre 1666,How exciting.
AinUTL,6,ch6_e5,le 5 octobre 1666,The fact that I began my apprenticeship carrying a load of dirty linen from the rooms upstairs did not dull that excitement a bit.
AinUTL,6,ch6_e5,le 5 octobre 1666,Each of those two rooms has four beds in it and last night the house was full.
AinUTL,6,ch6_e5,le 5 octobre 1666,I carried the linens through the kitchen and out to the yard behind the inn.
AinUTL,6,ch6_e5,le 5 octobre 1666,"As I stepped through the open doorway, I noticed the musket that leaned against the frame."
AinUTL,6,ch6_e5,le 5 octobre 1666,"“It was my husband Jules’s, and now it is mine,” explained Tante Barbe."
AinUTL,6,ch6_e5,le 5 octobre 1666,"“Can you shoot, Hélène?"
AinUTL,6,ch6_e5,le 5 octobre 1666,"Then you will learn in time.” A girl stood in the yard, her hands on her hips."
AinUTL,6,ch6_e5,le 5 octobre 1666,"“This is my niece, Hélène, Bernadette,” Tante Barbe went on."
AinUTL,6,ch6_e5,le 5 octobre 1666,"“She lives here now, and she has a great desire to learn how to wash linens.” We added more wood to the fire on which a large pot of water was already boiling."
AinUTL,6,ch6_e5,le 5 octobre 1666,I was to place the sheets in the pot without burning myself.
AinUTL,6,ch6_e5,le 5 octobre 1666,This I did.
AinUTL,6,ch6_e5,le 5 octobre 1666,Then lye soap chips were added to the pot.
AinUTL,6,ch6_e5,le 5 octobre 1666,"There was a paddle with which I could stir, and shift, and move the linens."
AinUTL,6,ch6_e5,le 5 octobre 1666,"In time, all the dirt would come out."
AinUTL,6,ch6_e5,le 5 octobre 1666,"Then one by one I would lift the sheets from the pot, again without burning myself, and they would be rinsed."
AinUTL,6,ch6_e5,le 5 octobre 1666,Then we would hang them on a line.
AinUTL,6,ch6_e5,le 5 octobre 1666,The fresh air would dry them and the bright sunshine would bleach them.
AinUTL,6,ch6_e5,le 5 octobre 1666,For very bad stains the cloth might need to be soaked in sour milk for a week or so first.
AinUTL,6,ch6_e5,le 5 octobre 1666,"These linens were not so dirty, having been on the beds for only three weeks."
AinUTL,6,ch6_e5,le 5 octobre 1666,We paused for a moment and it gave me time to look around.
AinUTL,6,ch6_e5,le 5 octobre 1666,"Two cows stood near a small barn at the back of the yard, eating hay."
AinUTL,6,ch6_e5,le 5 octobre 1666,There was a large kitchen garden.
AinUTL,6,ch6_e5,le 5 octobre 1666,"The beans, carrots and herbs had been picked, but there were still squashes, cabbages and pumpkins."
AinUTL,6,ch6_e5,le 5 octobre 1666,"Chickens, and a cross-looking rooster with a very fine tail scratched in the dirt."
AinUTL,6,ch6_e5,le 5 octobre 1666,"Minette considered the chickens for a second, but she is a good cat."
AinUTL,6,ch6_e5,le 5 octobre 1666,She also hates being pecked.
AinUTL,6,ch6_e5,le 5 octobre 1666,"“There is another pot here for the rinsing,” Bernadette said."
AinUTL,6,ch6_e5,le 5 octobre 1666,"“The men took the cart and every bucket and jar that we have, and went to the river for water yesterday."
AinUTL,6,ch6_e5,le 5 octobre 1666,At least we need not worry about that.” I offered to help do it next time.
AinUTL,6,ch6_e5,le 5 octobre 1666,Tante Barbe and Bernadette glanced at each other.
AinUTL,6,ch6_e5,le 5 octobre 1666,"“No you will not, Hélène,” ma tante said firmly."
AinUTL,6,ch6_e5,le 5 octobre 1666,"“You may walk about town to the shops, or to church, in safety during the day, but you will never, never go to the river alone."
AinUTL,6,ch6_e5,le 5 octobre 1666,Has no one told you that we are at war here?
AinUTL,6,ch6_e5,le 5 octobre 1666,It is far safer since the soldiers arrived last year.
AinUTL,6,ch6_e5,le 5 octobre 1666,"Still, no woman may go outside the palisade unless she is with an armed man, or unless she is armed herself.” I feel very safe here in my room."
AinUTL,6,ch6_e5,le 5 octobre 1666,There is a rumble of low talk and laughter from downstairs.
AinUTL,6,ch6_e5,le 5 octobre 1666,"The men who have come to eat, or to simply sit and have some spruce beer and smoke their clay pipes, are all armed."
AinUTL,6,ch6_e5,le 5 octobre 1666,"There are soldiers downstairs too, soldiers who would know how to defend this place."
AinUTL,6,ch6_e5,le 5 octobre 1666,I had forgotten the war with the Iroquois.
AinUTL,6,ch6_e5,le 5 octobre 1666,Now I cannot stop thinking about it.
AinUTL,6,ch6_e5,le 5 octobre 1666,"When I think of learning to shoot it makes me feel very strange inside, but I suppose it is simply just another skill that a woman here must have."
AinUTL,6,ch6_e6,le 8 octobre 1666,Séraphin has come to the house!
AinUTL,6,ch6_e6,le 8 octobre 1666,"Tante Barbe took him on as an engagé , saying that she needs the help of a strong young man."
AinUTL,6,ch6_e6,le 8 octobre 1666,"“I thought to go west,” Séraphin told me in the kitchen."
AinUTL,6,ch6_e6,le 8 octobre 1666,"“There is a party of coureurs de bois leaving next week to trade with the Indians, but perhaps this is wiser.” Another visitor came as well while I was chopping cabbage, and I went to the common room to receive him."
AinUTL,6,ch6_e6,le 8 octobre 1666,He introduced himself.
AinUTL,6,ch6_e6,le 8 octobre 1666,It was Armand Lecôté.
AinUTL,6,ch6_e6,le 8 octobre 1666,I could not speak to him at first.
AinUTL,6,ch6_e6,le 8 octobre 1666,"I just stood there while he babbled, making excuse after excuse for himself."
AinUTL,6,ch6_e6,le 8 octobre 1666,"Finally he said, “You hate me."
AinUTL,6,ch6_e6,le 8 octobre 1666,"I see that, and perhaps I deserve your disdain."
AinUTL,6,ch6_e6,le 8 octobre 1666,"I could not be certain that your sister had her dowry, and then the opportunity came for me to marry my dear Berthe."
AinUTL,6,ch6_e6,le 8 octobre 1666,"Surely you understand how a good dowry enhances a woman’s prospects here, particularly amongst such as we Lecôtés.” I understood that, yes, I said."
AinUTL,6,ch6_e6,le 8 octobre 1666,I also understood that courtesy in the form of a letter to Catherine had no meaning at all.
AinUTL,6,ch6_e6,le 8 octobre 1666,Was that another tradition important to the Lecôtés?
AinUTL,6,ch6_e6,le 8 octobre 1666,Then I went back to the kitchen where Tante Barbe had set Séraphin to work carrying in wood.
AinUTL,6,ch6_e6,le 8 octobre 1666,"I took no pleasure at all in my outburst, for I had seen that it meant little to Armand."
AinUTL,6,ch6_e7,le 10 octobre 1666,"Today was Sunday, and so we went to mass."
AinUTL,6,ch6_e7,le 10 octobre 1666,"It was crowded, for this parish of Notre Dame is the only one in Montréal."
AinUTL,6,ch6_e7,le 10 octobre 1666,The prayers and hymns were the same as those I have always heard in the church at home in Reignac.
AinUTL,6,ch6_e7,le 10 octobre 1666,The behaviour of the people was not.
AinUTL,6,ch6_e7,le 10 octobre 1666,One old woman had brought a little white kid into the church.
AinUTL,6,ch6_e7,le 10 octobre 1666,For some reason she had it wrapped in a blanket.
AinUTL,6,ch6_e7,le 10 octobre 1666,It bleated during the singing.
AinUTL,6,ch6_e7,le 10 octobre 1666,I believe it was too warm.
AinUTL,6,ch6_e7,le 10 octobre 1666,"There was whispering, and laughter, and people wandered in and out."
AinUTL,6,ch6_e7,le 10 octobre 1666,"By the time the priest began to give his sermon, it was so noisy that he had to nearly shout to be heard."
AinUTL,6,ch6_e7,le 10 octobre 1666,The people behind us were not listening anyway.
AinUTL,6,ch6_e7,le 10 octobre 1666,I turned around once and saw that some were drinking what smelled like wine.
AinUTL,6,ch6_e7,le 10 octobre 1666,One man raised his cup to me!
AinUTL,6,ch6_e7,le 10 octobre 1666,It made prayer rather difficult.
AinUTL,6,ch6_e7,le 10 octobre 1666,"On the way back to the house Tante Barbe said, “Montréal can be a rough place for a young woman, Hélène."
AinUTL,6,ch6_e7,le 10 octobre 1666,"There are many good people here, though."
AinUTL,6,ch6_e7,le 10 octobre 1666,It is hard to be poor.
AinUTL,6,ch6_e7,le 10 octobre 1666,"You have to be rough and strong to survive, and if their manners are not those of the court, then such is life.” She is correct, I suppose, but it will take me a while to become accustomed to Sundays."
AinUTL,6,ch6_e7,le 10 octobre 1666,"Still, the old woman’s kid was a dear thing, although it stank horribly."
AinUTL,6,ch6_e8,le 11 octobre 1666,It never ends.
AinUTL,6,ch6_e8,le 11 octobre 1666,"If it is not one task then it is another, and some of them are very strange."
AinUTL,6,ch6_e8,le 11 octobre 1666,"Like all good Catholics, we abstain from meat on the days we must, and do not serve it to our clients."
AinUTL,6,ch6_e8,le 11 octobre 1666,"Instead there might be fish soup or pie, salt eels or cod."
AinUTL,6,ch6_e8,le 11 octobre 1666,"Today I learned of another creature that some people eat, since it swims like a fish."
AinUTL,6,ch6_e8,le 11 octobre 1666,Muskrat.
AinUTL,6,ch6_e8,le 11 octobre 1666,"They look a bit like rats, with their yellow teeth and long hairless tails, and so at first I had doubts."
AinUTL,6,ch6_e8,le 11 octobre 1666,A coureur de bois had brought six muskrats to the house.
AinUTL,6,ch6_e8,le 11 octobre 1666,He made an agreement with Tante Barbe.
AinUTL,6,ch6_e8,le 11 octobre 1666,He would trade the muskrats for a bed for the night and his dinner.
AinUTL,6,ch6_e8,le 11 octobre 1666,"Tante Barbe sometimes does such things, since there is a shortage of coins here in New France."
AinUTL,6,ch6_e8,le 11 octobre 1666,"“Coins, Hélène — a sol , an écu , even a single denier — cash in one’s hand is best."
AinUTL,6,ch6_e8,le 11 octobre 1666,"I admit that I am not above accepting even the Spanish coins that the officials despise.” Under her breath she added, “The foolish men.” Then she went on cheerily, “For today, the muskrats will suffice.” Here is where the work began."
AinUTL,6,ch6_e8,le 11 octobre 1666,The coureur showed me how to skin the muskrats.
AinUTL,6,ch6_e8,le 11 octobre 1666,"We would have the meat, and he would keep the furs for trading, since Tante Barbe did not care to scrape and tan them."
