book_name,chapter_id,entry_id,date,sentence
NbutC,3,ch3_e3,"December 5th, 1783",No wonder Mother is so sad.
NbutC,3,ch3_e4,"December 6th, 1783",Mr. Mitchell gave me another bottle of ink yesterday.
NbutC,3,ch3_e4,"December 6th, 1783","I was despairing because I was running out, but when I screwed up the courage to ask him for some to take home, and told him what it was for, he gave me a whole bottle!"
NbutC,3,ch3_e4,"December 6th, 1783",He was very impressed that I am keeping a journal.
NbutC,3,ch3_e4,"December 6th, 1783","I thought for one horrible moment that he was going to ask to see it, but thanks be he didn’t."
NbutC,3,ch3_e4,"December 6th, 1783",Perhaps he is not as mean as I thought he was.
NbutC,3,ch3_e5,"December 7th, 1783",Hannah was here at the crack of dawn to fetch a shovelful of coals.
NbutC,3,ch3_e5,"December 7th, 1783",Somehow or other their fire went out last night.
NbutC,3,ch3_e5,"December 7th, 1783",Father is careful of ours.
NbutC,3,ch3_e5,"December 7th, 1783",He banks it every night and covers the coals with ashes.
NbutC,3,ch3_e5,"December 7th, 1783","Jamie is very proud because Father has given him the job of whittling a stick of wood into shavings every evening, to use to coax the fire back alight in the morning."
NbutC,3,ch3_e5,"December 7th, 1783",Father gave him his own knife to work with and it is Jamie’s dearest possession.
NbutC,3,ch3_e5,"December 7th, 1783","Next to Laddie, of course, who is snoring by the hearth as I write this."
NbutC,3,ch3_e6,"December 8th, 1783","We have had a message from Angus to say that he and Duncan arrived safely at Fort Cataraqui, and are busy with the rest of their battalion helping to build a sawmill."
NbutC,3,ch3_e6,"December 8th, 1783","We will probably not hear from them again until spring, but I think that message raised Mother’s spirits a little."
NbutC,3,ch3_e6,"December 8th, 1783","She is still very despondent, though, and Grannie is twice as bossy to make up for it."
NbutC,3,ch3_e6,"December 8th, 1783","It’s strange how I go along for several days feeling almost content, and then I wake up one morning feeling homesick and miserable."
NbutC,3,ch3_e6,"December 8th, 1783",I miss baby Margaret and keep remembering all of her sweet little ways.
NbutC,3,ch3_e6,"December 8th, 1783",It seems so unfair that her life should have been so short.
NbutC,3,ch3_e6,"December 8th, 1783",How I wish things could be as they were.
NbutC,3,ch3_e6,"December 8th, 1783",I wonder if I will ever be happy here?
NbutC,3,ch3_e7,"December 9th, 1783",The cabin of a family named Roberts caught fire today!
NbutC,3,ch3_e7,"December 9th, 1783",We had just settled down to our morning lessons at school when we heard a great clanging of a bell and people shouting.
NbutC,3,ch3_e7,"December 9th, 1783",Of course we all piled out to see what was going on.
NbutC,3,ch3_e7,"December 9th, 1783",A cloud of smoke was billowing up from the north end of the settlement.
NbutC,3,ch3_e7,"December 9th, 1783",Hannah and I tore over to see what was happening.
NbutC,3,ch3_e7,"December 9th, 1783",As we got close we saw flames leaping up out of the roof of the cabin.
NbutC,3,ch3_e7,"December 9th, 1783",There was so much smoke it made us choke.
NbutC,3,ch3_e7,"December 9th, 1783","It didn’t help, either, that there was a brisk wind blowing."
NbutC,3,ch3_e7,"December 9th, 1783","Men were running toward the fire with buckets of water, and women with quilts."
NbutC,3,ch3_e7,"December 9th, 1783",They soaked the quilts in water and threw them on the burning roof and on the rooves of the houses next to it.
NbutC,3,ch3_e7,"December 9th, 1783","At first it didn’t seem to help at all, but gradually they got the fire under control before it spread to the other houses."
NbutC,3,ch3_e7,"December 9th, 1783",Then it began to snow and that helped as well.
NbutC,3,ch3_e7,"December 9th, 1783",The cabin was saved but it will have to have a new roof.
NbutC,3,ch3_e7,"December 9th, 1783",Mrs. Livingstone’s quilt was burned clear through.
NbutC,3,ch3_e7,"December 9th, 1783","Grannie ran out with one of hers, but by the time she got there the fire was out."
NbutC,3,ch3_e7,"December 9th, 1783","I’m very glad, because it was the quilt from my bed."
NbutC,3,ch3_e7,"December 9th, 1783","Of course, I would have sacrificed it if it were needed, but I’m mightily relieved that it wasn’t."
NbutC,3,ch3_e7,"December 9th, 1783",The nights are cold here.
NbutC,3,ch3_e7,"December 9th, 1783",Father says the fire was probably caused by sparks from the wooden chimney.
NbutC,3,ch3_e7,"December 9th, 1783",That’s why he won’t burn pine wood in our fireplace.
NbutC,3,ch3_e7,"December 9th, 1783",It’s too gummy and causes the chimney to soot up.
NbutC,3,ch3_e7,"December 9th, 1783","Even so, I could see sparks coming out of the chimney when I went out to our privy to relieve myself before coming to bed."
NbutC,3,ch3_e7,"December 9th, 1783",I hope our roof doesn’t catch on fire!
NbutC,3,ch3_e7,"December 9th, 1783","I’m tucked up cosily in my quilt now, though, with the stub of a candle to give me light."
NbutC,3,ch3_e7,"December 9th, 1783",Mother has told me that I mustn’t keep it lit for too long.
NbutC,3,ch3_e7,"December 9th, 1783",Candles are much too precious to waste.
NbutC,3,ch3_e7,"December 9th, 1783",I suppose I should put it out now.
NbutC,3,ch3_e8,"December 10th, 1783",All the women are getting together to try and find scraps to give to Mrs. Livingstone so that she can make a new quilt.
NbutC,3,ch3_e8,"December 10th, 1783","Her daughter, Janet, asked me at school this morning if we could give them some."
NbutC,3,ch3_e8,"December 10th, 1783","I asked Mother when I went home at noontime, but she just shook her head."
NbutC,3,ch3_e8,"December 10th, 1783",“Our very clothes are scraps — what could we possibly give them?” she asked.
NbutC,3,ch3_e8,"December 10th, 1783",I felt embarrassed and dreadful all at the same time.
NbutC,3,ch3_e8,"December 10th, 1783",I didn’t know how I was going to go back and face Janet.
NbutC,3,ch3_e8,"December 10th, 1783","Then, just as I was leaving, Mother thrust something into my hand."
NbutC,3,ch3_e8,"December 10th, 1783","“Give Janet this,” she said, and ran back into her room before I could answer her."
NbutC,3,ch3_e8,"December 10th, 1783",When I looked at what she had given me I saw that it was baby Margaret’s old blanket.
NbutC,3,ch3_e8,"December 10th, 1783","I cried all the way to school, but managed to stop before I got there so that no one would see."
NbutC,3,ch3_e8,"December 10th, 1783","Hannah saw, of course, because we always walk together, but I didn’t mind that."
NbutC,3,ch3_e8,"December 10th, 1783",Hannah and I have no secrets from each other.
NbutC,3,ch3_e9,"December 11th, 1783","Janet says she and her mother and her older sister, Betsy, have started piecing together the patchwork for a quilt top already and they are very grateful for all the material."
NbutC,3,ch3_e9,"December 11th, 1783",Janet says her mother has promised us all a quilting bee in the spring as soon as they are ready to put it together.
NbutC,3,ch3_e9,"December 11th, 1783",I must practise my stitches this winter and maybe I’ll be allowed to do some of the quilting.
NbutC,3,ch3_e9,"December 11th, 1783","I am quite a neat stitcher, even if Grannie does nag at me all the time."
NbutC,3,ch3_e9,"December 11th, 1783","Actually, it’s probably because Grannie does nag at me all the time that I have become so good."
NbutC,3,ch3_e9,"December 11th, 1783",Perhaps I should not get so cross about it.
NbutC,3,ch3_e9,"December 11th, 1783",I smell snow in the air again.
NbutC,3,ch3_e10,"December 12th, 1783",My nose was right.
NbutC,3,ch3_e10,"December 12th, 1783",It snowed all night and is still snowing.
NbutC,3,ch3_e10,"December 12th, 1783",My feet froze on the way to school today.
NbutC,3,ch3_e10,"December 12th, 1783",I envy the people who have good Indian moccasins to wear.
NbutC,3,ch3_e11,"December 13th, 1783",Still snowing!
NbutC,3,ch3_e12,"December 14th, 1783",Snow has stopped and I would dearly love to go out and play in it but it’s Sunday.
NbutC,3,ch3_e12,"December 14th, 1783",Church services this morning and church services again this evening.
NbutC,3,ch3_e12,"December 14th, 1783",Mr. Murchison preaches very long sermons.
NbutC,3,ch3_e12,"December 14th, 1783",In between times we are supposed to sit quietly and not even play.
NbutC,3,ch3_e12,"December 14th, 1783",Grannie does not let us do anything on Sunday!
NbutC,3,ch3_e12,"December 14th, 1783",I am writing this up in my bed where she can’t see me.
NbutC,3,ch3_e12,"December 14th, 1783","I suppose that is very bad of me, but I just have to do something."
NbutC,3,ch3_e12,"December 14th, 1783",I am feeling so twitchy.
NbutC,3,ch3_e12,"December 14th, 1783",My legs just want to run!
NbutC,3,ch3_e13,"December 15th, 1783","Today we had a snowball fight at school, girls against the boys."
NbutC,3,ch3_e13,"December 15th, 1783",It was so much fun.
NbutC,3,ch3_e13,"December 15th, 1783",The boys are bigger but I think the girls were cannier.
NbutC,3,ch3_e13,"December 15th, 1783",Alex Calder hit Hannah squarely with a huge snowball.
NbutC,3,ch3_e13,"December 15th, 1783",I told her that proves he’s sweet on her.
NbutC,3,ch3_e13,"December 15th, 1783",So she hit me with a snowball and got snow all down the back of my neck.
NbutC,3,ch3_e13,"December 15th, 1783","She says that all boys are dolts and she wouldn’t want to have anything to do with any of them, much less Alex Calder."
NbutC,3,ch3_e13,"December 15th, 1783","I don’t think I believe her, but that’s one subject I think I had better not pursue."
NbutC,3,ch3_e13,"December 15th, 1783",She’s quite fierce about it.
NbutC,3,ch3_e13,"December 15th, 1783",That’s why I don’t believe her.
NbutC,3,ch3_e13,"December 15th, 1783","My one and only dress and my coat were soaking wet when I got home, of course, and Grannie was angry."
NbutC,3,ch3_e13,"December 15th, 1783",She says I am a little heathen.
NbutC,3,ch3_e13,"December 15th, 1783",How could I be a heathen when I go to church services every Sunday?
NbutC,3,ch3_e13,"December 15th, 1783","Anyway, my clothes are all draped over the bench and table, steaming away in the heat from the fire."
NbutC,3,ch3_e13,"December 15th, 1783","The whole cabin smells of hot, wet wool."
NbutC,3,ch3_e13,"December 15th, 1783","I am sitting as close to the hearth as I can, in my nightdress and well bundled up in my quilt."
NbutC,3,ch3_e13,"December 15th, 1783","I feel quite warm and comfortable, actually."
NbutC,3,ch3_e13,"December 15th, 1783",I must stop writing now and practise my stitching.
NbutC,3,ch3_e13,"December 15th, 1783","I think the girls won the snow fight, but the boys will never admit it."
NbutC,3,ch3_e14,"December 16th, 1783",It is my birthday today.
NbutC,3,ch3_e14,"December 16th, 1783",I am thirteen years old.
NbutC,3,ch3_e14,"December 16th, 1783",If we were still in Albany I would be celebrating with Lizzie Crane and my other friends from school.
NbutC,3,ch3_e14,"December 16th, 1783",There would probably have been presents.
NbutC,3,ch3_e14,"December 16th, 1783",No presents here.
NbutC,3,ch3_e14,"December 16th, 1783",I don’t think Mother has even remembered it.
NbutC,3,ch3_e14,"December 16th, 1783","I did not tell anyone at school, but I did tell Hannah."
NbutC,3,ch3_e14,"December 16th, 1783",She gave me a hug.
NbutC,3,ch3_e14,"December 16th, 1783",That is a good enough present for now.
NbutC,3,ch3_e14,"December 16th, 1783",Later Father came in with four squirrels and Mother is making a stew for supper.
NbutC,3,ch3_e14,"December 16th, 1783","“For our Mary’s special birthday dinner,” he announced."
NbutC,3,ch3_e14,"December 16th, 1783",So I guess they didn’t forget after all.
NbutC,3,ch3_e14,"December 16th, 1783",The stew is bubbling away and beginning to smell very good.
NbutC,3,ch3_e14,"December 16th, 1783",Later still The stew was delicious.
NbutC,3,ch3_e14,"December 16th, 1783",So much better than mouldy old salt pork.
NbutC,3,ch3_e14,"December 16th, 1783",And there were presents!
NbutC,3,ch3_e14,"December 16th, 1783",After dinner Father presented me with a doll that he had whittled himself.
NbutC,3,ch3_e14,"December 16th, 1783","I am much too old for dolls, but I did not tell him that."
NbutC,3,ch3_e14,"December 16th, 1783",Jamie gave me an apple that Mrs. Leake had given him last week.
NbutC,3,ch3_e14,"December 16th, 1783","He had hidden it away for me all this time, the scamp."
NbutC,3,ch3_e14,"December 16th, 1783","He worried that it was a little dried up and shrivelled, but I assured him that it was perfect."
NbutC,3,ch3_e14,"December 16th, 1783",I cut it neatly into five pieces after supper and we all shared.
NbutC,3,ch3_e14,"December 16th, 1783",I have saved the seeds to plant when we are finally settled somewhere.
NbutC,3,ch3_e14,"December 16th, 1783","We had apple trees back in Albany, but I suppose now we will have to start over."
NbutC,3,ch3_e14,"December 16th, 1783","Mother did not have raisins or currants for a cake, but she made Lumpy Dick and we had that with maple syrup."
NbutC,3,ch3_e14,"December 16th, 1783","All in all, it was a feast!"
NbutC,3,ch3_e14,"December 16th, 1783","And just now, as I was about to climb the ladder up to my bed here in the loft, Grannie stopped me."
NbutC,3,ch3_e14,"December 16th, 1783","“Here, child,” she said, and gave me a small square of embroidered linen."
NbutC,3,ch3_e14,"December 16th, 1783",It was one of her fine handkerchiefs that she had embroidered herself for her marriage chest.
NbutC,3,ch3_e14,"December 16th, 1783","It bore her initials, M.M."
NbutC,3,ch3_e14,"December 16th, 1783",for Mairi MacDonald — the same name as mine although mine is written in the English spelling and hers in the Scottish.
NbutC,3,ch3_e14,"December 16th, 1783",For once she was smiling and her face looked all soft.
NbutC,3,ch3_e14,"December 16th, 1783","Looking at her in the firelight, I suddenly realized that she must have been very pretty when she was young."
NbutC,3,ch3_e14,"December 16th, 1783","It has turned out to be a lovely birthday, after all."
NbutC,3,ch3_e15,"December 19th, 1783",Father says that news has come that the English have now completely evacuated New York City and the last of the Loyalists have left America.
NbutC,3,ch3_e15,"December 19th, 1783",General Washington and Governor Clinton made a triumphant entry into the city on horseback.
NbutC,3,ch3_e15,"December 19th, 1783","I truly do not believe we will be going back home, no matter how much my mother wishes to."
NbutC,3,ch3_e15,"December 19th, 1783","I don’t want to, either."
NbutC,3,ch3_e15,"December 19th, 1783",Why would we want to live amongst those people again after the way they treated us?
NbutC,3,ch3_e15,"December 19th, 1783",I certainly would never be friends with Lizzie Crane again.
NbutC,3,ch3_e15,"December 19th, 1783",Hannah is a much better friend.
NbutC,3,ch3_e15,"December 19th, 1783",I do hope that when we settle we will be somewhere not too far away from each other.
NbutC,3,ch3_e16,"December 20th, 1783",Everything is all abustle because Christmas is coming.
NbutC,3,ch3_e16,"December 20th, 1783","The Scots don’t celebrate the way the others do, but it is exciting nonetheless."
NbutC,3,ch3_e16,"December 20th, 1783","Back in Albany the English would bring in a huge log — a yule log, they call it — and they kept it burning for the twelve days of Christmas."
NbutC,3,ch3_e16,"December 20th, 1783",The Irish lit candles and placed them in the windows to welcome Mary and Joseph.
NbutC,3,ch3_e16,"December 20th, 1783","The German families had the best custom of all, I think."
NbutC,3,ch3_e16,"December 20th, 1783","They used to bring in a live fir tree and set it up in a corner, and decorate it with candles!"
NbutC,3,ch3_e16,"December 20th, 1783",The Rickles had an enormous tree and we children all went over on Christmas Eve to watch them light the candles.
NbutC,3,ch3_e16,"December 20th, 1783",It was so beautiful I could hardly breathe.
NbutC,3,ch3_e16,"December 20th, 1783","They could not leave them alight for long because of the danger of fire, but it was bonny while it lasted."
NbutC,3,ch3_e16,"December 20th, 1783",Scots go to church on Christmas Day and have our festivities on New Year’s Eve when we celebrate Hogmanay; but we’ll be celebrating Christmas as well this year because Mrs. Livingstone is going to invite us to her house for a grand Christmas dinner.
NbutC,3,ch3_e16,"December 20th, 1783",Father had a terrible time persuading Grannie to go.
NbutC,3,ch3_e16,"December 20th, 1783",She’s very set in the old ways and dead against making any kind of celebration out of Christmas itself.
NbutC,3,ch3_e16,"December 20th, 1783","“A papist custom,” she snorted when the invitation came."
NbutC,3,ch3_e16,"December 20th, 1783",“You’ll not find me taking part in it.” Nevertheless he persevered.
NbutC,3,ch3_e16,"December 20th, 1783",Father is just as stubborn in his own way as she is in hers.
NbutC,3,ch3_e16,"December 20th, 1783","“It’s a new country with new ways, Mother,” he said, and would not let up on her, but even so I was amazed that he managed to convince her."
NbutC,3,ch3_e16,"December 20th, 1783",Could Grannie possibly be mellowing?
NbutC,3,ch3_e16,"December 20th, 1783",One thing Grannie will never give up is her determination to go into the New Year without a speck of dust or dirt anywhere.
NbutC,3,ch3_e16,"December 20th, 1783",She and Mother are cleaning every corner of the house and it is worth a body’s life to get in their way.
NbutC,3,ch3_e17,"December 25th, 1783",What a day!
NbutC,3,ch3_e17,"December 25th, 1783",I am sitting here in my bed just full of the smells and tastes and memories of it.
NbutC,3,ch3_e17,"December 25th, 1783","There was sadness, too, though."
NbutC,3,ch3_e17,"December 25th, 1783",Mrs. Livingstone gave us the most wonderful Christmas dinner.
NbutC,3,ch3_e17,"December 25th, 1783",They have been here for almost three years and are so well settled in they even have a small flock of chickens and a few geese.
NbutC,3,ch3_e17,"December 25th, 1783",Mrs. Livingstone had fattened one of the geese up especially and roasted it for the Christmas dinner — I can’t begin to describe how delicious it tasted.
NbutC,3,ch3_e17,"December 25th, 1783","When Mr. Livingstone opened the door to greet us, the smell of that goose absolutely overwhelmed me."
NbutC,3,ch3_e17,"December 25th, 1783","I just stood in the doorway and sniffed until Grannie gave me a push and said, “What ails you, child?"
NbutC,3,ch3_e17,"December 25th, 1783",Get in before you let all the warmth out.” Mrs. Livingstone had even managed to save raisins to make a plum pudding.
NbutC,3,ch3_e17,"December 25th, 1783",It was a feast!
NbutC,3,ch3_e17,"December 25th, 1783","Their house is a little bigger than our cabin but still, it was packed with all of us."
NbutC,3,ch3_e17,"December 25th, 1783","The Livingstones have two young boys as well, and a baby."
NbutC,3,ch3_e17,"December 25th, 1783","The two boys took Jamie in hand the minute we were inside, and were soon playing a game of knuckle bones with him."
NbutC,3,ch3_e17,"December 25th, 1783",The baby was fast asleep in a cradle beside the hearth and never cried once the whole time we were there.
NbutC,3,ch3_e17,"December 25th, 1783","She is a sweet, rosy-cheeked little thing."
NbutC,3,ch3_e17,"December 25th, 1783","It made my heart ache to look at her, it just brought back so many thoughts of baby Margaret."
NbutC,3,ch3_e17,"December 25th, 1783",I can’t imagine how Mother must have felt.
NbutC,3,ch3_e17,"December 25th, 1783",I didn’t even dare to look at her.
NbutC,3,ch3_e17,"December 25th, 1783","I think Mrs. Livingstone knew, however, as she gave Mother a very warm hug."
NbutC,3,ch3_e17,"December 25th, 1783",Mrs. Livingstone calls the baby her “first little born Canadian.” That made me stop and think.
NbutC,3,ch3_e17,"December 25th, 1783",What are we now?
NbutC,3,ch3_e17,"December 25th, 1783","We’re certainly not American any more, and we’re not really Scottish any more either."
NbutC,3,ch3_e17,"December 25th, 1783",I suppose we’re Canadians too.
NbutC,3,ch3_e17,"December 25th, 1783",How very odd.
NbutC,3,ch3_e17,"December 25th, 1783","After the dinner Janet and her sister, Betsy, showed me the quilt they were piecing together."
NbutC,3,ch3_e17,"December 25th, 1783",I recognized the squares that came from baby Margaret’s blanket.
NbutC,3,ch3_e17,"December 25th, 1783","It was a pretty, soft yellow colour."
NbutC,3,ch3_e17,"December 25th, 1783",I remember Mother dyed it that colour with goldenrod blossoms.
NbutC,3,ch3_e17,"December 25th, 1783",Mrs. Livingstone came over to us just then and reached out a hand to touch one of the squares.
NbutC,3,ch3_e17,"December 25th, 1783","“So soft,” she said."
NbutC,3,ch3_e17,"December 25th, 1783",“And so pretty.
NbutC,3,ch3_e17,"December 25th, 1783","I am grateful to your Mother, Mary, for letting me have that blanket."
NbutC,3,ch3_e17,"December 25th, 1783",Small enough return have I made for it.” And I realized then that she knew whose blanket it had been.
NbutC,3,ch3_e18,"December 27th, 1783",Now we are getting ready for our own celebration.
NbutC,3,ch3_e18,"December 27th, 1783",Mrs. Livingstone gave Grannie some honey so that Grannie can make the special oatcakes sweetened with honey that she bakes for us every New Year’s Eve.
NbutC,3,ch3_e18,"December 27th, 1783",We will take as many as we can over to the Livingstones’ to reciprocate for the fine Christmas dinner they gave us.
NbutC,3,ch3_e18,"December 27th, 1783","It is not much, but it is the best we can do."
NbutC,3,ch3_e18,"December 27th, 1783",Hannah has been over and we have been helping Grannie.
NbutC,3,ch3_e18,"December 27th, 1783","At least, we thought we were helping."
NbutC,3,ch3_e18,"December 27th, 1783","Grannie thought otherwise, and after she rapped my knuckles sharply with her spoon, just because I dipped a finger into the honey pot, she banished us out of the house."
NbutC,3,ch3_e18,"December 27th, 1783",I can hardly wait for New Year’s Eve.
NbutC,3,ch3_e18,"December 27th, 1783","There are quite a few Scottish families here, so Hannah and I and the other Scottish children will be going singing at the doors of every house, just as we used to do in Albany."
NbutC,3,ch3_e18,"December 27th, 1783",But I wonder if a first-foot will knock on our door at midnight?
NbutC,3,ch3_e18,"December 27th, 1783","Who will it be, here in this strange place?"
NbutC,4,ch4_e1,"January 1st, 1784","Get up, gude wife, and dinna sweer, An’ deal yer bread to them that’s here, For the time’ll come whan ye’ll be dead And then ye’ll need neither ale nor bread."
NbutC,4,ch4_e1,"January 1st, 1784","That’s what we sang when we went door to door, and my how we sang!"
NbutC,4,ch4_e1,"January 1st, 1784",And we reaped such rewards!
NbutC,4,ch4_e1,"January 1st, 1784",I had oatcakes and bannock and plum cakes enough to share with the whole family.
NbutC,4,ch4_e1,"January 1st, 1784",The first-foot did come!
NbutC,4,ch4_e1,"January 1st, 1784","Just exactly at midnight, by the old clock that Father managed to bring with us, there was a knock on the door."
NbutC,4,ch4_e1,"January 1st, 1784","There stood Uncle Allan Ross, holding a loaf of bread and a pail full of burning coals to add to our fire."
NbutC,4,ch4_e1,"January 1st, 1784","Warmth and comfort for the whole year to come, the first-foot brings."
NbutC,4,ch4_e1,"January 1st, 1784",I wonder if that will hold true for us?
NbutC,4,ch4_e1,"January 1st, 1784",Luckily Uncle Allan Ross does not have red hair.
NbutC,4,ch4_e1,"January 1st, 1784",Grannie firmly believes that it would bring very bad luck upon a house if the first-foot were a redhead.
NbutC,4,ch4_e1,"January 1st, 1784","Father scoffs at her, but she will not be convinced otherwise."
NbutC,4,ch4_e1,"January 1st, 1784","I looked around, suddenly realizing that Father was not here."
NbutC,4,ch4_e1,"January 1st, 1784",I supposed he was returning the favour and acting as first-foot for the Ross family.
NbutC,4,ch4_e1,"January 1st, 1784",(Hannah told me this morning that he had.)
NbutC,4,ch4_e1,"January 1st, 1784",So we begin a new year in a new land.
NbutC,4,ch4_e1,"January 1st, 1784",And I have a dreadful head cold and a very sore throat.
NbutC,4,ch4_e1,"January 1st, 1784",And a cough.
NbutC,4,ch4_e1,"January 1st, 1784",So does Hannah.
NbutC,4,ch4_e2,"January 3rd, 1784",Grannie has been filling me full of her remedies.
NbutC,4,ch4_e2,"January 3rd, 1784","She has been dosing me with a syrup made of spikenard, which is as sharp and bitter as its name, and I have drunk enough catnip and spearmint tea to sink a ship."
NbutC,4,ch4_e2,"January 3rd, 1784","The remedies must be working, though, as I am getting better."
NbutC,4,ch4_e2,"January 3rd, 1784","Hannah is not, however, although her mother has the same medicines."
NbutC,4,ch4_e3,"January 5th, 1784",Hannah is very ill.
NbutC,4,ch4_e3,"January 5th, 1784",I am frightened for her.
NbutC,4,ch4_e3,"January 5th, 1784",When I visited her today she was flushed and feverish and hardly even knew I was there.
NbutC,4,ch4_e3,"January 5th, 1784",Her breath is raspy and I can see the effort it costs her to breathe.
NbutC,4,ch4_e3,"January 5th, 1784",She can talk hardly at all and coughs without ceasing.
NbutC,4,ch4_e3,"January 5th, 1784","I sat with her all afternoon and tried to get her to drink the teas Aunt Norah had made for her, but she could not get them down."
NbutC,4,ch4_e3,"January 5th, 1784",Then she spit up the little she did manage to swallow.
NbutC,4,ch4_e4,"January 6th, 1784",Hannah might die!
NbutC,4,ch4_e4,"January 6th, 1784","No one has said so, but I can see it in their faces."
NbutC,4,ch4_e4,"January 6th, 1784",Father has allowed me to stay home from school so that I may sit with her and feed her.
