book_name,chapter_id,entry_id,date,sentence
PasWide,01,ch01_e124,November 20,It was “Good Night Stories with Mr. Radiobug.” So we gave the headphones to the twins.
PasWide,01,ch01_e124,November 20,It was comical to see them laughing at the same time when we didn’t even know what they were listening to.
PasWide,01,ch01_e124,November 20,When it was over Harry asked how the stories got into the box.
PasWide,01,ch01_e124,November 20,Hans explained about radio waves and that.
PasWide,01,ch01_e124,November 20,I don’t really understand it.
PasWide,01,ch01_e124,November 20,Mrs. Muller made tea and then Elizabeth and I shared one pair of headphones and Hans took the other.
PasWide,01,ch01_e124,November 20,He found some wonderful music.
PasWide,01,ch01_e124,November 20,It was horns and a banjo and drums and I couldn’t tell what else.
PasWide,01,ch01_e124,November 20,But you couldn’t listen to it without starting to move around.
PasWide,01,ch01_e124,November 20,So we were jigging around and Elizabeth started snapping her fingers and Mr. Muller took the headphones off Hans and listened and then switched off the radio.
PasWide,01,ch01_e124,November 20,In an angry way.
PasWide,01,ch01_e124,November 20,He said that it was jazz and that jazz is wicked music.
PasWide,01,ch01_e124,November 20,Probably because of Gerhard running away to join a jazz band.
PasWide,01,ch01_e124,November 20,On the way home Harry kept throwing his hands up in the air.
PasWide,01,ch01_e124,November 20,Dad asked him what he was doing and he said that he was trying to feel the radio waves.
PasWide,01,ch01_e124,November 20,"Everybody laughed but, truth to tell, I wonder about that too."
PasWide,01,ch01_e124,November 20,"If they are going right through me on their way from CKCK Regina to the Mullers’ radio, wouldn’t I feel them?"
PasWide,01,ch01_e124,November 20,I certainly hope we get a radio when our ship comes in.
PasWide,01,ch01_e125,November 21,"Question of the Day My question for Mr. Ambrose today was, can music be wicked?"
PasWide,01,ch01_e125,November 21,He said that was going to take a lot of reading and thinking.
PasWide,01,ch01_e126,November 22,"Chocolate Bomb Today one of the little boys, Thorvald Berg, who is in grade one, put his tin pail of cocoa on the stove at school to heat up and he forgot to take the lid off a bit."
PasWide,01,ch01_e126,November 22,In the middle of the grade six spelling drill it exploded.
PasWide,01,ch01_e126,November 22,It was just like a gunshot.
PasWide,01,ch01_e126,November 22,We all jumped out of our seats.
PasWide,01,ch01_e126,November 22,Then there was a mess to clean up.
PasWide,01,ch01_e126,November 22,Thorvald cried but Miss Hutchinson gave him some of her cocoa.
PasWide,01,ch01_e126,November 22,"Later she caught all the little ones banging down the lids of their pails, hoping they would explode too."
PasWide,01,ch01_e127,November 23,Travel on the Pink Bits I’ve got my diary at school.
PasWide,01,ch01_e127,November 23,This isn’t exactly allowed.
PasWide,01,ch01_e127,November 23,But Miss Hutchinson is busy with the little ones and the times tables so I don’t think she will notice.
PasWide,01,ch01_e127,November 23,We are supposed to be doing a grammar drill but I’m planning a round-the-world trip by looking at the big map.
PasWide,01,ch01_e127,November 23,All the countries of the British Empire are pink so I’m hopping from one pink country to another.
PasWide,01,ch01_e127,November 23,"Here I go: Canada, Newfoundland, United Kingdom (stop off to see Chivers and Auntie Lou and Uncle Alf and Auntie Millie and Baby Jack), Gibraltar, Malta, Cyprus, Anglo-Egyptian Sudan, Seychelles, India, Ceylon, Malaya, Borneo, Australia, Papua, Naura, Ellice Islands."
PasWide,01,ch01_e127,November 23,"Later, at home I was having such a good time on my journey that I didn’t notice Nyla Snoop-Face Tattle-Tale Muir."
PasWide,01,ch01_e127,November 23,"She stopped by my desk on her way to the water pail and said, “Could you help me with the grammar drill?"
PasWide,01,ch01_e127,November 23,"Oh, what a pretty notebook,” in a voice loud enough for Miss Hutchinson to hear."
PasWide,01,ch01_e127,November 23,So of course I got found out on the Ellice Islands and never got to Tristan da Cunha or back to Milorie.
PasWide,01,ch01_e127,November 23,Nyla is a pain in the you know where.
PasWide,01,ch01_e128,November 24,Talents Today Miss Hutchinson said that everybody is good at something.
PasWide,01,ch01_e128,November 24,I looked around and wondered if this were true.
PasWide,01,ch01_e128,November 24,Hans is good at driving a car.
PasWide,01,ch01_e128,November 24,Abel is good at making people laugh.
PasWide,01,ch01_e128,November 24,Elizabeth is good at drawing.
PasWide,01,ch01_e128,November 24,Gladys is good at reading.
PasWide,01,ch01_e128,November 24,Nyla is good at being poisonous.
PasWide,01,ch01_e128,November 24,George McLaren can stand up on the back of his horse.
PasWide,01,ch01_e128,November 24,But then I looked at Vera Battrum.
PasWide,01,ch01_e128,November 24,"She isn’t good at school, spelling, skipping, singing, running or sewing."
PasWide,01,ch01_e128,November 24,I don’t think Miss Hutchinson is right.
PasWide,01,ch01_e128,November 24,This could be a question for Mr. Ambrose.
PasWide,01,ch01_e129,November 25,A Second Opinion Mr. Ambrose says this isn’t really an encyclopedia question but in his opinion Miss Hutchinson is right.
PasWide,01,ch01_e129,November 25,But he doesn’t know Vera.
PasWide,01,ch01_e129,November 25,I know that Mother thinks that I’m not good at anything.
PasWide,01,ch01_e129,November 25,But I am.
PasWide,01,ch01_e129,November 25,I’m good at all of these: 1.
PasWide,01,ch01_e129,November 25,Thinking of questions.
PasWide,01,ch01_e129,November 25,(Mr. Ambrose says so.)
PasWide,01,ch01_e129,November 25,Having good bones.
PasWide,01,ch01_e129,November 25,(Lorayne says so.)
PasWide,01,ch01_e129,November 25,Making up stories to scare myself.
PasWide,01,ch01_e129,November 25,(I say so.)
PasWide,01,ch01_e130,November 26,Defeat I’m wrong.
PasWide,01,ch01_e130,November 26,Vera is good at something.
PasWide,01,ch01_e130,November 26,Today she brought some nuts to school.
PasWide,01,ch01_e130,November 26,She can crack them with her bare teeth.
PasWide,01,ch01_e131,December 4,Fairy Guest or How to Get Out of Serving Breakfast A new guest in the hotel.
PasWide,01,ch01_e131,December 4,He is a farm equipment salesman.
PasWide,01,ch01_e131,December 4,He has hair growing out of his ears.
PasWide,01,ch01_e131,December 4,I told Gladys that that meant he has fairy blood.
PasWide,01,ch01_e131,December 4,Now Gladys is mad keen to serve his breakfast because she wants to be there in case he does something magic.
PasWide,01,ch01_e132,December 6,No Cowboy Christmas This afternoon we didn’t have arithmetic drill.
PasWide,01,ch01_e132,December 6,Instead Miss Hutchinson said it was time to begin planning the Christmas concert.
PasWide,01,ch01_e132,December 6,Ralph asked if they could do Cowboy Christmas again.
PasWide,01,ch01_e132,December 6,Miss Hutchinson asked what was Cowboy Christmas.
PasWide,01,ch01_e132,December 6,Then everybody talked about last year when they did a skit where cowboys sit around a campfire singing Christmas carols.
PasWide,01,ch01_e132,December 6,They had a real fire lit on the ashpan but Ralph’s crepe paper chaps caught fire and Nels had to throw the pot of coffee over him to put it out.
PasWide,01,ch01_e132,December 6,"Ralph said it was keen and then he started singing, “Yippee-i-o, Ho ho ho,” and everybody joined in."
PasWide,01,ch01_e132,December 6,Then Miss Hutchinson had to bang her pointer on her desk.
PasWide,01,ch01_e132,December 6,"“No cowboys this year,” she said."
PasWide,01,ch01_e132,December 6,Then she told us that this year we’re going to do an acrostic act.
PasWide,01,ch01_e132,December 6,She’s going to write the letters of Santa Claus on big pieces of paper.
PasWide,01,ch01_e132,December 6,(Santa Claus is Canadian for Father Christmas.)
PasWide,01,ch01_e132,December 6,"The little ones will hold them up, one letter at a time, and each letter will have a poem about it."
PasWide,01,ch01_e132,December 6,"Like, “S is for snow, da dum, da dum, da dum.” And we have to make up the poems."
PasWide,01,ch01_e132,December 6,She assigned the letters.
PasWide,01,ch01_e132,December 6,I got one of the A ’ s. Nyla Muir and Klaus Berg got the other A ’ s. I thought right away of angel.
PasWide,01,ch01_e132,December 6,No sooner had I thought of it than Nyla put up her hand and said could she do angel because she loves angels.
PasWide,01,ch01_e132,December 6,Phooey.
PasWide,01,ch01_e132,December 6,The two S ’ s decided right away to do snow and Saskatchewan.
PasWide,01,ch01_e132,December 6,I didn’t have any other ideas for A so I went to the dictionary.
PasWide,01,ch01_e132,December 6,"The best word I found was apophthegm, which means a short saying, but it doesn’t have that much to do with Christmas."
PasWide,01,ch01_e132,December 6,"Besides, what would rhyme with it?"
PasWide,01,ch01_e132,December 6,Then Abel shot up his hand and said he had already finished his poem.
PasWide,01,ch01_e132,December 6,He had C. Miss Hutchinson read it out: C is for chilblains We get them on our feet.
PasWide,01,ch01_e132,December 6,If you sit on the stove You get them on your seat.
PasWide,01,ch01_e132,December 6,Of course Abel meant to be cheeky but he was sure surprised when Miss Hutchinson said that would be just fine.
PasWide,01,ch01_e132,December 6,We have until Friday to work on our poems.
PasWide,01,ch01_e132,December 6,We’re also supposed to think of songs or skits we would like to perform.
PasWide,01,ch01_e132,December 6,I hope my poem turns out attractive and not asinine and that Miss Hutchinson adores it and does not abhor it.
PasWide,01,ch01_e133,December 7,Ivy the Hearing Florence brought a little book to school with plays in it.
PasWide,01,ch01_e133,December 7,At recess she asked me if I would like to be in one with her.
PasWide,01,ch01_e133,December 7,There are five parts.
PasWide,01,ch01_e133,December 7,The best thing is that she didn’t ask Nyla.
PasWide,01,ch01_e133,December 7,"She asked Elizabeth, Vera and Nellie."
PasWide,01,ch01_e133,December 7,Or maybe it is just because Miss Hutchinson told us today that Nyla is going to be mistress of ceremonies at the concert and maybe she wouldn’t have time to also be in a play.
PasWide,01,ch01_e133,December 7,But I think Florence likes me better than Nyla.
PasWide,01,ch01_e133,December 7,It is probably wrong to feel so happy about this.
PasWide,01,ch01_e133,December 7,Saints wouldn’t.
PasWide,01,ch01_e133,December 7,But I do.
PasWide,01,ch01_e133,December 7,We read the play out loud at lunchtime.
PasWide,01,ch01_e133,December 7,"It is very funny, about the five senses and Christmas."
PasWide,01,ch01_e133,December 7,I get to be Hearing.
PasWide,01,ch01_e133,December 7,I’ll write down my piece here.
PasWide,01,ch01_e133,December 7,Maybe it will help me remember it.
PasWide,01,ch01_e133,December 7,Maybe the words will travel up my fingers to my brain.
PasWide,01,ch01_e133,December 7,When Christmas drew near I wanted to hear Everything everyone said.
PasWide,01,ch01_e133,December 7,But Grandma talked low And Mum whispered so It gave me a pain in the head.
PasWide,01,ch01_e133,December 7,"We decided to make giant ears, nose, mouth, hands and glasses."
PasWide,01,ch01_e133,December 7,I can imagine giant ears but I can’t think how to make them.
PasWide,01,ch01_e133,December 7,I wish there were some kind of magic stuff that you could mould into any shape.
PasWide,01,ch01_e133,December 7,Like mud but clean and dries hard.
PasWide,01,ch01_e133,December 7,And free.
PasWide,01,ch01_e133,December 7,No idea for A.
PasWide,01,ch01_e133,December 7,"At home it could be for the ass that Mary and Joseph ride on, but I’m not going to make that mistake again."
PasWide,01,ch01_e134,December 8,"Fast Ears I asked Mother about ears last night and this morning they were already made, sitting beside my bed when I woke up."
PasWide,01,ch01_e134,December 8,She must have made them after I went to bed.
PasWide,01,ch01_e134,December 8,"They are perfect, huge, made of white cloth and stuffed with kapok so that they stick right up."
PasWide,01,ch01_e134,December 8,They fasten to my head with a piece of elastic.
PasWide,01,ch01_e134,December 8,If I move my head just a little bit they wiggle in a very comic way.
PasWide,01,ch01_e134,December 8,I wore them to breakfast and Gladys laughed so much she inhaled her porridge.
PasWide,01,ch01_e134,December 8,Dad told Mother they were a feat of engineering but Mother just harrumphed and said she hoped I would take them off before I served breakfast to the boarders.
PasWide,01,ch01_e134,December 8,I don’t know why Mother doesn’t like it if you notice that she is being kind.
PasWide,01,ch01_e134,December 8,If I’m kind I like people to notice right away and thank me.
PasWide,01,ch01_e134,December 8,Still no idea for A. I tried the dictionary again.
PasWide,01,ch01_e134,December 8,I think I’ll annihilate Nyla.
PasWide,01,ch01_e134,December 8,Maybe I’ll ask Mr. Ambrose.
PasWide,01,ch01_e135,December 9,Why Prepositions Can be Useful Got it.
PasWide,01,ch01_e135,December 9,I did ask Mr. Ambrose and he said I should not limit myself to nouns.
PasWide,01,ch01_e135,December 9,A’s for above Where the bright star is glowing.
PasWide,01,ch01_e135,December 9,"Christmas is coming, The cattle are lowing."
PasWide,01,ch01_e135,December 9,I stole the last line from “Away in a Manger.” I hope that’s allowed.
PasWide,01,ch01_e135,December 9,"What’s lowing, anyway?"
PasWide,01,ch01_e136,December 10,Miss Hutchinson likes the “echo” of “Away in a Manger” in my poem.
PasWide,01,ch01_e136,December 10,So it wasn’t stealing but echoing.
PasWide,01,ch01_e137,December 11,Lowing is just mooing.
PasWide,01,ch01_e137,December 11,"There isn’t much else to discuss about lowing so instead Mr. Ambrose told me about Percival Lowell, an authority on Mars."
PasWide,01,ch01_e137,December 11,Christmas card and letter from Ethel today.
PasWide,01,ch01_e137,December 11,The noisy family moved out of number 107.
PasWide,01,ch01_e137,December 11,Now there is a family with a boy that Ethel is sweet on.
PasWide,01,ch01_e137,December 11,That was all she wrote about.
PasWide,01,ch01_e137,December 11,She didn’t mention Dot or anything else I told her about.
PasWide,01,ch01_e137,December 11,Chivers did send love and purrs.
PasWide,01,ch01_e138,December 13,Christmas Concert Crisis Nyla’s mother came to school today.
PasWide,01,ch01_e138,December 13,She is complaining because Miss Hutchinson told us not to wear our long underwear to the Christmas concert because it would not look good poking out from underneath our crepe-paper skirts.
PasWide,01,ch01_e138,December 13,"But Nyla’s mother thinks it is dangerous for Nyla to take off her long underwear in winter, even for one evening."
PasWide,01,ch01_e138,December 13,(Elizabeth and Florence and I wondered why Nyla even asked her mother.
PasWide,01,ch01_e138,December 13,We certainly didn’t.
PasWide,01,ch01_e138,December 13,If you go around asking your parents for permission then you deserve what you get.)
PasWide,01,ch01_e138,December 13,Maybe Nyla won’t be able to be in the concert and I can do angels after all.
PasWide,01,ch01_e139,December 14,Rats The underwear crisis is solved.
PasWide,01,ch01_e139,December 14,Miss Hutchinson is going to add one more layer of crepe paper to the bottom of the skirts and then Nyla can just roll up her long underwear.
PasWide,01,ch01_e139,December 14,"Still, she is going to look dumpy."
PasWide,01,ch01_e139,December 14,"Lumpy dumpy Nyla Muir She’s a pill and that’s for suir, She’s a disease And there’s no cuir."
PasWide,01,ch01_e139,December 14,Lumpy dumpy Nyla Muir.
PasWide,01,ch01_e139,December 14,Trying to think of my A poem seems to have made me think of rhymes all the time.
PasWide,01,ch01_e139,December 14,When Auntie Lou gave me this diary to record the most important things in my life she probably didn’t know how good it would be for insults.
PasWide,01,ch01_e140,December 15,Letter from the Relatives Today there was a letter from Auntie Millie.
PasWide,01,ch01_e140,December 15,Mother read it out loud.
PasWide,01,ch01_e140,December 15,Auntie Millie is expecting another baby!
PasWide,01,ch01_e140,December 15,Baby Jack and Auntie Millie are living with Auntie Millie’s parents in London but the pram-making business didn’t work out so Uncle Alf has gone to the south coast for another job.
PasWide,01,ch01_e140,December 15,Mother and Dad gave each other THE LOOK when Mother read out that bit.
PasWide,01,ch01_e140,December 15,Baby Jack is walking and Auntie Millie looks forward to going up to Oxford Street at Christmas to see all the decorations.
PasWide,01,ch01_e140,December 15,Later I asked William about THE LOOK.
PasWide,01,ch01_e140,December 15,He says he reckons that Uncle Alf has done a bunk and left Auntie Millie.
PasWide,01,ch01_e140,December 15,I don’t think that could be true.
PasWide,01,ch01_e140,December 15,He would never leave Baby Jack and the baby on the way.
PasWide,01,ch01_e141,December 17,Dress Rehearsal Today we didn’t do any work in school.
PasWide,01,ch01_e141,December 17,We just got ready for the concert.
PasWide,01,ch01_e141,December 17,We had a fine time.
PasWide,01,ch01_e141,December 17,The big boys stood on the desks and hung crepe-paper streamers from the roof.
PasWide,01,ch01_e141,December 17,Mrs. Battrum came with white sheets to make curtains across the stage.
PasWide,01,ch01_e141,December 17,A very talented artist used the Christmas stencils to make holly leaves and bells across the top of the blackboard.
PasWide,01,ch01_e141,December 17,(Talented artist = me.
PasWide,01,ch01_e141,December 17,Miss Hutchinson let me use the coloured chalks.
PasWide,01,ch01_e141,December 17,I wish we could use them every day for our work.
PasWide,01,ch01_e141,December 17,I think colours would really help with arithmetic drills.)
PasWide,01,ch01_e141,December 17,Then we pushed all the desks to the side and did a last rehearsal.
PasWide,01,ch01_e141,December 17,I forgot my A poem after the first line.
PasWide,01,ch01_e141,December 17,There were lots of other mistakes too.
PasWide,01,ch01_e141,December 17,"Miss Hutchinson said, “Bad dress rehearsal, good performance.” But I don’t know."
PasWide,01,ch01_e141,December 17,When I think about standing up in front of everybody my insides hollow out.
PasWide,01,ch01_e141,December 17,Toffee-Nose wore her mistress of ceremonies dress.
PasWide,01,ch01_e141,December 17,"It is made of layers and layers of crepe paper, like a rainbow."
PasWide,01,ch01_e141,December 17,She said isn’t it a shame that we all can’t wear pretty dresses instead of just funny ears.
PasWide,01,ch01_e141,December 17,I bit my tongue.
PasWide,01,ch01_e141,December 17,Then Mr. McLaren brought in the tree.
PasWide,01,ch01_e141,December 17,We decorated it with paper chains and cut-out snowflakes and Miss Hutchinson made popcorn and we made that into strings.
PasWide,01,ch01_e141,December 17,(And we ate some too.)
PasWide,01,ch01_e141,December 17,Then we put the candles in the holders.
PasWide,01,ch01_e141,December 17,Miss Hutchinson sent us home early.
PasWide,01,ch01_e142,December 19,Ears and Above Nine o’clock in the morning and I’m still in my nightie.
PasWide,01,ch01_e142,December 19,I’m writing this in bed.
PasWide,01,ch01_e142,December 19,No church.
PasWide,01,ch01_e142,December 19,We slept in because we were so late last night.
PasWide,01,ch01_e142,December 19,Mother gave the boarders scones for breakfast so she didn’t need me to help.
PasWide,01,ch01_e142,December 19,The concert was heaps of fun.
PasWide,01,ch01_e142,December 19,The school didn’t even look like the school with the candles and lanterns and the tree and the ceiling covered in dancing streamers.
PasWide,01,ch01_e142,December 19,"Before we started Miss Hutchinson gathered us together and told us to speak up, to have fun and not to set ourselves on fire."
PasWide,01,ch01_e142,December 19,I remembered my ear piece and my A piece even though I felt my mouth was just saying the words and I was somewhere else.
PasWide,01,ch01_e142,December 19,When Abel said his chilblain poem people cheered and stomped on the floor.
PasWide,01,ch01_e142,December 19,"They stomped again after “The Christmas Senses.” And Dad went “Whoop!” which was a little embarrassing, but not too much."
PasWide,01,ch01_e142,December 19,"The little ones did their choral recitation of “The Christmas Cat” and it ended with Herman saying, “He purred in the manger and kept Jesus warm.” Then all the mothers started crying."
PasWide,01,ch01_e142,December 19,I almost did too.
PasWide,01,ch01_e142,December 19,Then there was the sound of bells outside and Santa Claus came in.
PasWide,01,ch01_e142,December 19,He had presents for everyone.
PasWide,01,ch01_e142,December 19,I got an orange and a bag of candy and a beautiful blue silk handkerchief.
PasWide,01,ch01_e142,December 19,When Santa Claus called Gladys’s name she was afraid to go and collect her present.
PasWide,01,ch01_e142,December 19,She just held onto my leg.
PasWide,01,ch01_e142,December 19,But then I told her it was just Father Christmas and she was fine.
PasWide,01,ch01_e142,December 19,It turns out she didn’t know that Santa Claus is just the Canadian name for Father Christmas.
PasWide,01,ch01_e142,December 19,(Of course it was really Bill Bowler the butcher but I didn’t tell her that.)
PasWide,01,ch01_e142,December 19,Then there was carol singing.
PasWide,01,ch01_e142,December 19,Some of the little ones went to sleep on the desks.
PasWide,01,ch01_e142,December 19,Then there was a big lunch with sandwiches and cakes and pie.
PasWide,01,ch01_e142,December 19,It was after midnight when we got home.
PasWide,01,ch01_e142,December 19,"Oh, I forgot."
PasWide,01,ch01_e142,December 19,The biggest surprise.
PasWide,01,ch01_e142,December 19,In between the Santa Acrostic and Ralph’s homesteader recitation Miss Hutchinson got up and sang a song.
PasWide,01,ch01_e142,December 19,She didn’t tell us she was going to do it.
PasWide,01,ch01_e142,December 19,It was called “The Ash Grove.” Everyone was dead quiet when she sang.
PasWide,01,ch01_e142,December 19,She looked like an angel from above.
PasWide,01,ch01_e143,December 20,Christmas Comes from Home The Christmas parcel from Auntie Lou has arrived!
PasWide,01,ch01_e143,December 20,Dad picked it up at the post office this morning.
PasWide,01,ch01_e143,December 20,Mother made us wait until William came home from the store before we were allowed to open it at all.
PasWide,01,ch01_e143,December 20,I nearly burst with waiting.
PasWide,01,ch01_e143,December 20,What if I really had and bits of me had whizzed all around the room like the exploding cocoa from Thorvald’s pail?
PasWide,01,ch01_e143,December 20,It’s like that funny poem that Dad recites about all the children who do naughty things and meet terrible ends.
PasWide,01,ch01_e143,December 20,"Here’s mine, “Ivy Weatherall, The Girl Who Burst With Waiting”: dum di dum di dum di dum … But though her family wailed and wept The moral is that if you’re kept Waiting too long you might end up dead Like The Girl Who Burst With Waiting."
PasWide,01,ch01_e143,December 20,There’s something not right with line four.
PasWide,01,ch01_e143,December 20,You might meet the fate … You might end up in bits … That’s better but still too long.
PasWide,01,ch01_e143,December 20,Why are beginnings and ending of poems easier than middles?
PasWide,01,ch01_e143,December 20,But I didn’t burst and when William FINALLY came home we opened up the box and it was a treasure chest.
PasWide,01,ch01_e143,December 20,A fruitcake in a pretty tin with fancy paper round the edge and covered in marzipan with a piece of holly.
PasWide,01,ch01_e143,December 20,A box with six glass Christmas balls.
PasWide,01,ch01_e143,December 20,You can look inside them to a little scene.
PasWide,01,ch01_e143,December 20,A tin of Lyle’s Golden Syrup.
PasWide,01,ch01_e143,December 20,(William said it made him think of collecting horse manure because he used to collect it on Halley Road with a Lyle’s box.
PasWide,01,ch01_e143,December 20,Of course it wouldn’t be our family if somebody didn’t bring that up.)
PasWide,01,ch01_e143,December 20,A box of almonds.
PasWide,01,ch01_e143,December 20,A box of Chivers Jellies.
PasWide,01,ch01_e143,December 20,A bag of ribbon sweets and humbugs.
PasWide,01,ch01_e143,December 20,A wrapped present for each of us.
PasWide,01,ch01_e143,December 20,(Mine has edges like a book).
PasWide,01,ch01_e143,December 20,Some English newspapers.
PasWide,01,ch01_e143,December 20,A big pile of Magnet s. Of course we have to save it for Christmas but Mother must have understood a little bit about bursting because she made a pot of tea and we all had a sliver of fruitcake.
PasWide,01,ch01_e143,December 20,I eat cake then marzipan.
PasWide,01,ch01_e143,December 20,William eats marzipan then cake.
PasWide,01,ch01_e143,December 20,Then William started flipping through the Magnet s. He used to buy one every Saturday at home.
PasWide,01,ch01_e143,December 20,"The Magnet is supposed to be a magazine just for boys, but I always liked it too."
PasWide,01,ch01_e143,December 20,"William started to read out loud a Famous Five story, with lovely Harry Wharton, and cheery Bob Cherry, studious Frank Nugent, Billy Bunter the fat boy, and all the other boys and masters at Greyfriars School."
PasWide,01,ch01_e143,December 20,It was like meeting old friends from home.
