book_name,chapter_id,entry_id,date,sentence
PasWide,01,ch01_e89,September 28,The Germans found out and they put her in prison and then they shot her.
PasWide,01,ch01_e89,September 28,She was a “noble character.” I think she sounds like a saint.
PasWide,01,ch01_e90,September 30,The Reader First month of school and Gladys has already read everything in the primer.
PasWide,01,ch01_e90,September 30,Miss Hutchinson says she can go on to the Canadian Reader Book One .
PasWide,01,ch01_e91,October 1,"Thunder and Kindness Today was very hot, like being under a pile of blankets."
PasWide,01,ch01_e91,October 1,"At recess we were all playing anti-I-over across the school roof when all of a sudden, out of nowhere, there was a huge crash of thunder."
PasWide,01,ch01_e91,October 1,The ground shivered.
PasWide,01,ch01_e91,October 1,I looked over at the swings where Harry was waiting for his turn and he was crouched on the ground with his hands over his ears and his eyes squeezed shut.
PasWide,01,ch01_e91,October 1,I started over to talk to him when Miss Hutchinson picked him up and took him inside.
PasWide,01,ch01_e91,October 1,When we came in from recess Miss Hutchinson was cuddling Harry on her lap.
PasWide,01,ch01_e91,October 1,His eyes were still shut.
PasWide,01,ch01_e91,October 1,On the blackboard was written.
PasWide,01,ch01_e91,October 1,“Go on with your work.
PasWide,01,ch01_e91,October 1,Nobody is to tease Harry about this.” Miss Hutchinson is a very kind person.
PasWide,01,ch01_e91,October 1,Harry likes to hear about bombs and such.
PasWide,01,ch01_e91,October 1,He loves William’s stories about hiding in the cellar during the bombing raids in London.
PasWide,01,ch01_e91,October 1,But he hates loud noises in real life.
PasWide,01,ch01_e91,October 1,I think he had better give up his plan to be an anarchist.
PasWide,01,ch01_e91,October 1,He’s not going to be very good at blowing things up.
PasWide,01,ch01_e92,October 2,Harvest Today I went over to Elizabeth’s to help take doughnuts to the harvesters.
PasWide,01,ch01_e92,October 2,"The harvesters have their breakfast (bacon, sausages, eggs, pancakes, toast, jam and apple pie) at five o’clock, so by nine o’clock they need more food."
PasWide,01,ch01_e92,October 2,Mrs. Muller’s doughnuts are delicious.
PasWide,01,ch01_e92,October 2,"No, delicious isn’t the right word."
PasWide,01,ch01_e92,October 2,It is too little.
PasWide,01,ch01_e92,October 2,They are manna.
PasWide,01,ch01_e92,October 2,"Last Sunday in church, Mr. Quigley read the lesson about the children of Israel lost in the wilderness and how God sent them manna in the morning."
PasWide,01,ch01_e92,October 2,Mr. Quigley said that the Bible said that manna was like wafers made with honey and we should think of the most delicious thing we could.
PasWide,01,ch01_e92,October 2,I thought of Mrs. Muller’s doughnuts.
PasWide,01,ch01_e92,October 2,She piles those doughnuts into big baskets lined with napkins and Elizabeth and I take them out to the fields.
PasWide,01,ch01_e92,October 2,Then when we come back Mrs. Muller gives us little round doughnut holes.
PasWide,01,ch01_e92,October 2,Then we went out to watch the threshing machine.
PasWide,01,ch01_e92,October 2,It is a wonder.
PasWide,01,ch01_e92,October 2,It looks like a hungry animal gobbling the sheaves of grain.
PasWide,01,ch01_e92,October 2,You can watch it for hours without getting bored.
PasWide,01,ch01_e92,October 2,Gears and wheels and belts and big knives and a big steam engine.
PasWide,01,ch01_e92,October 2,Grain spilling into the granary and straw blowing out a pipe and making a big pile.
PasWide,01,ch01_e92,October 2,Mr. Muller walks around oiling and greasing and adjusting bits of machinery.
PasWide,01,ch01_e92,October 2,It is the first time I’ve seen him smile.
PasWide,01,ch01_e92,October 2,One more thing about doughnuts and manna.
PasWide,01,ch01_e92,October 2,The best part of the Bible story is how the children of Israel aren’t allowed to save any of their manna for the next day.
PasWide,01,ch01_e92,October 2,If they try it the manna gets worms in it and goes all nasty.
PasWide,01,ch01_e92,October 2,Mrs. Muller wouldn’t need to worry about that.
PasWide,01,ch01_e92,October 2,There would be no chance of finding worms in the doughnuts the next day because the harvesters never leave ANY LEFTOVERS.
PasWide,01,ch01_e93,October 3,Harvest Done The harvest is over and I think there is going to be trouble at Elizabeth’s house.
PasWide,01,ch01_e93,October 3,Today just as we were getting ready to take out the doughnuts all the men arrived home.
PasWide,01,ch01_e93,October 3,Nine o’clock in the morning and the harvest was done!
PasWide,01,ch01_e93,October 3,"Mrs. Muller took a kitchen chair out to the yard and put a basin of water on it, and a towel over the back and the men took off their shirts."
PasWide,01,ch01_e93,October 3,"When they take off their shirts it is like they still have pale shirts on, with brown necks and arms and the rest white."
PasWide,01,ch01_e93,October 3,They started washing and spraying drops of water over the yard and running water through their hair.
PasWide,01,ch01_e93,October 3,"All those drops of water just lay in the dust, not sinking in."
PasWide,01,ch01_e93,October 3,"The men ate doughnuts and drank coffee and larked about, whooping, and carrying on like it was the last day of school."
PasWide,01,ch01_e93,October 3,One of the harvesters juggled doughnuts and another one walked on his hands.
PasWide,01,ch01_e93,October 3,Mr. Muller didn’t fool about though.
PasWide,01,ch01_e93,October 3,He didn’t eat doughnuts either.
PasWide,01,ch01_e93,October 3,He’s like that thin man in Mother Goose: “Jack Spratt would eat no fat.” But then Gerhard threw his hat way up into the tree.
PasWide,01,ch01_e93,October 3,"All the men laughed and one said, “How are you going to get your hat down?” There was a long silence and then Gerhard said, “I don’t need to get it down."
PasWide,01,ch01_e93,October 3,I don’t need that hat.
PasWide,01,ch01_e93,October 3,That’s it.
PasWide,01,ch01_e93,October 3,I got in this harvest and now I’m never going to farm one more minute in my entire life.” The words just sat there like drops of water in the dust.
PasWide,01,ch01_e93,October 3,"Gerhard didn’t sound angry, just very clear."
PasWide,01,ch01_e93,October 3,I saw Hans and Elizabeth all sneak looks at their father.
PasWide,01,ch01_e93,October 3,I did too.
PasWide,01,ch01_e93,October 3,He looked like his face was made of rock.
PasWide,01,ch01_e93,October 3,And he just turned and went into the house.
PasWide,01,ch01_e93,October 3,Gerhard went back to his doughnut.
PasWide,01,ch01_e93,October 3,I wonder what will happen.
PasWide,01,ch01_e93,October 3,Elizabeth will tell me.
PasWide,01,ch01_e94,October 4,Harvesters Home Dad and William are home.
PasWide,01,ch01_e94,October 4,Tonight at supper they told us all about threshing.
PasWide,01,ch01_e94,October 4,Dad drove the rack and team.
PasWide,01,ch01_e94,October 4,William was a spike pitcher.
PasWide,01,ch01_e94,October 4,That is the person who loads bundles with the pitchfork.
PasWide,01,ch01_e94,October 4,He said that after his first day he was so weary that he couldn’t even eat his supper.
PasWide,01,ch01_e94,October 4,"The farm family was so sorry for him that they let him sleep in their spare bedroom, rather than in the granary on a cot with the rest of the crew."
PasWide,01,ch01_e94,October 4,But it wasn’t much of a favour because the bed had bedbugs and he didn’t sleep a wink!
PasWide,01,ch01_e94,October 4,But after that things got easier and he loved the food.
PasWide,01,ch01_e94,October 4,"Later, when we were alone, William told me that a man on their crew got his hand caught in the machinery and lost two fingers."
PasWide,01,ch01_e94,October 4,William is blinking a lot again.
PasWide,01,ch01_e95,October 5,A Package from Eaton’s My long underwear arrived.
PasWide,01,ch01_e95,October 5,Two pairs.
PasWide,01,ch01_e95,October 5,They are scratchy and they make me look lumpy.
PasWide,01,ch01_e95,October 5,Mother says I have to wear them even though it is hardly cold at all.
PasWide,01,ch01_e95,October 5,I’m sure that Renee Adoree never had to wear long underwear.
PasWide,01,ch01_e96,October 6,News from the Mullers Gerhard is gone.
PasWide,01,ch01_e96,October 6,Elizabeth says he was very cheerful and helpful for a few days and this morning he was gone.
PasWide,01,ch01_e96,October 6,He left a note saying he was going to Calgary and that they were not to worry.
PasWide,01,ch01_e96,October 6,Elizabeth says her father read the note out loud and then he crumpled it up and threw it in the stove.
PasWide,01,ch01_e96,October 6,Then he said they were not to mention Gerhard again.
PasWide,01,ch01_e96,October 6,Elizabeth said that Gerhard didn’t even say goodbye to her.
PasWide,01,ch01_e96,October 6,I feel sorry for Elizabeth with such a stern father.
PasWide,01,ch01_e96,October 6,"If William ran away from home (maybe you can’t call it running away when someone is sixteen, like Gerhard) Dad would never say he wouldn’t talk about him."
PasWide,01,ch01_e96,October 6,Elizabeth was very quiet in school today.
PasWide,01,ch01_e96,October 6,She’s biting her nails again.
PasWide,01,ch01_e96,October 6,Herman was so naughty that Miss Hutchinson made him stand in a corner.
PasWide,01,ch01_e96,October 6,And Hans didn’t come to school.
PasWide,01,ch01_e96,October 6,I wonder if Gerhard said goodbye to Worm-Emily Piggott?
PasWide,01,ch01_e97,October 9,The Truth About Long Underwear It stretches.
PasWide,01,ch01_e97,October 9,Every day the legs get longer and longer.
PasWide,01,ch01_e97,October 9,After the third day you have to roll them up.
PasWide,01,ch01_e97,October 9,By Friday – elephant legs!
PasWide,01,ch01_e98,October 10,Marrow Memories Harvest Festival at church today.
PasWide,01,ch01_e98,October 10,The flowers and fruit made it look just like St. Edmund’s at home.
PasWide,01,ch01_e98,October 10,I must have started thinking about home because there were big squashes on the altar steps and whilst the sermon was on I remembered the time Ethel and I wrote rude words with pins on her father’s baby vegetable marrows.
PasWide,01,ch01_e98,October 10,The marrows grew and grew and the rude words grew and grew.
PasWide,01,ch01_e98,October 10,Nobody knew who had done it.
PasWide,01,ch01_e98,October 10,I almost started to laugh so I had to pretend I was coughing.
PasWide,01,ch01_e98,October 10,Why does church make me get the giggles?
PasWide,01,ch01_e99,October 12,Worry Dot is sick.
PasWide,01,ch01_e99,October 12,When I went to get her from the barn after school she was lying down and she wouldn’t get up.
PasWide,01,ch01_e99,October 12,I didn’t know what to do but Miss Hutchinson said I should go to the livery stable and get Mr. Battrum.
PasWide,01,ch01_e99,October 12,He said that it was likely colic and he came over to the school with some ginger and turpentine.
PasWide,01,ch01_e99,October 12,But Dot still didn’t get up.
PasWide,01,ch01_e99,October 12,Mr. Battrum said it would take a while and we should just walk home.
PasWide,01,ch01_e99,October 12,He said he would keep an eye on Dot until tomorrow.
PasWide,01,ch01_e99,October 12,It was a long sad walk home.
PasWide,01,ch01_e99,October 12,Harry held my hand and tried to cheer me up by saying riddles.
PasWide,01,ch01_e99,October 12,I wish I could have stayed with Dot.
PasWide,01,ch01_e99,October 12,I love her.
PasWide,01,ch01_e100,October 13,Worry Over Dot is right as rain.
PasWide,01,ch01_e100,October 13,She was very happy to see me.
PasWide,01,ch01_e100,October 13,I gave her extra oats.
PasWide,01,ch01_e101,October 15,Horrible News Children are slaves.
PasWide,01,ch01_e101,October 15,Children don’t have any say and they just get pushed around.
PasWide,01,ch01_e101,October 15,It is NOT FAIR.
PasWide,01,ch01_e101,October 15,At tea Dad announced that we’re moving to town.
PasWide,01,ch01_e101,October 15,Since one of the banks closed down there is an extra building and we’re going to rent it and live there and run it as a hotel.
PasWide,01,ch01_e101,October 15,He also said that it will be much easier for us to get to school in winter and for William to get to the store.
PasWide,01,ch01_e101,October 15,"Also, Mr. Battrum has offered Dad work at the livery stables."
PasWide,01,ch01_e101,October 15,This whole idea is silly.
PasWide,01,ch01_e101,October 15,The argument about school is silly.
PasWide,01,ch01_e101,October 15,It will be no problem getting to school from the farm.
PasWide,01,ch01_e101,October 15,We don’t need to move into town for that.
PasWide,01,ch01_e101,October 15,If we can’t ride Dot we can hitch her to a sleigh.
PasWide,01,ch01_e101,October 15,I could drive a sleigh.
PasWide,01,ch01_e101,October 15,Hans and Elizabeth do.
PasWide,01,ch01_e101,October 15,Elizabeth told me all about it.
PasWide,01,ch01_e101,October 15,They have hot hard-boiled eggs to keep their hands warm and then they eat the eggs for lunch.
PasWide,01,ch01_e101,October 15,It is perfectly fine.
PasWide,01,ch01_e101,October 15,I want to drive a sleigh.
PasWide,01,ch01_e101,October 15,William could come in the sleigh to work.
PasWide,01,ch01_e101,October 15,The VERY WORST THING is that we have to give Dot back to Mr. Burgess.
PasWide,01,ch01_e101,October 15,Why don’t I get a say?
PasWide,01,ch01_e101,October 15,"Women have the vote, but not children."
PasWide,01,ch01_e101,October 15,I told Mother and Dad that our family was not a democracy.
PasWide,01,ch01_e101,October 15,And they laughed!
PasWide,01,ch01_e101,October 15,I am cross as hops.
PasWide,01,ch01_e101,October 15,I am going out to the barn to visit Dot and if they think I’m going to do any chores tonight they are wrong.
PasWide,01,ch01_e101,October 15,Chores can go hang.
PasWide,01,ch01_e102,October 16,Barn Thoughts I’m in the barn.
PasWide,01,ch01_e102,October 16,Dad and William have gone to town.
PasWide,01,ch01_e102,October 16,Dad asked me if I wanted to come.
PasWide,01,ch01_e102,October 16,But I said no thank you.
PasWide,01,ch01_e102,October 16,I also said no thank you to breakfast.
PasWide,01,ch01_e102,October 16,I am treating them with cold disdain.
PasWide,01,ch01_e102,October 16,"Mother is in the kitchen ordering things like sheets and celery dishes from the catalogue, for when we have the hotel."
PasWide,01,ch01_e102,October 16,This is daft.
PasWide,01,ch01_e102,October 16,Why don’t they just take the money they’re going to spend on that stuff and use it so we can stay on the farm?
PasWide,01,ch01_e102,October 16,My days with Dot are numbered so I’m just going to go for a ride.
PasWide,01,ch01_e102,October 16,Maybe I won’t come back.
PasWide,01,ch01_e102,October 16,If Mother needs me to mind the twins or anything I just won’t be here.
PasWide,01,ch01_e102,October 16,She hasn’t said anything about me not doing the chickens.
PasWide,01,ch01_e102,October 16,What about the egg money?
PasWide,01,ch01_e102,October 16,We won’t have that when we’re in town.
PasWide,01,ch01_e102,October 16,That’s what I should have said.
PasWide,01,ch01_e102,October 16,Later It didn’t work.
PasWide,01,ch01_e102,October 16,I took Dot out for a ride and she wouldn’t go any direction except toward school.
PasWide,01,ch01_e102,October 16,"When I tried to make her go the other way she just stood there, completely still."
PasWide,01,ch01_e102,October 16,So much for escaping.
PasWide,01,ch01_e102,October 16,Tonight is bath night.
PasWide,01,ch01_e102,October 16,Mother is heating the water right now.
PasWide,01,ch01_e102,October 16,I would like to refuse with cold disdain.
PasWide,01,ch01_e102,October 16,"I would like to say, “I don’t want to share water with traitors.” But I don’t think I’ll be able to manage it."
PasWide,01,ch01_e102,October 16,I like bath night too much.
PasWide,01,ch01_e103,October 17,Visit to the Prison Today we went to see the bank-hotel-house.
PasWide,01,ch01_e103,October 17,Mother was full of plans.
PasWide,01,ch01_e103,October 17,She went on and on about how lovely the floor is.
PasWide,01,ch01_e103,October 17,Who cares about floors when you have to give your horse away?
PasWide,01,ch01_e103,October 17,The bank part is going to be the parlour and sitting room for the guests.
PasWide,01,ch01_e103,October 17,In the back and upstairs is like a normal house.
PasWide,01,ch01_e103,October 17,The kitchen has a trapdoor that leads down into the cellar by a ladder.
PasWide,01,ch01_e103,October 17,This is the only thing that is one bit interesting.
PasWide,01,ch01_e103,October 17,Daisy will go back to the Mullers.
PasWide,01,ch01_e103,October 17,How can Mother do this?
PasWide,01,ch01_e104,October 18,"Dull Day Packing, cleaning, sorting, packing, cleaning, sorting."
PasWide,01,ch01_e104,October 18,Dull to do.
PasWide,01,ch01_e104,October 18,Dull to write about.
PasWide,01,ch01_e104,October 18,It’s Halley Road all over again.
PasWide,01,ch01_e104,October 18,Today the chickens went.
PasWide,01,ch01_e104,October 18,Some farmer came and took them.
PasWide,01,ch01_e104,October 18,I did collect the eggs this morning because I knew it would be the last time.
PasWide,01,ch01_e104,October 18,Lhicken pecked me as usual.
PasWide,01,ch01_e104,October 18,I’m trying to remember every step of riding Dot to school.
PasWide,01,ch01_e104,October 18,Today we had a grammar bee.
PasWide,01,ch01_e104,October 18,I did not excel.
PasWide,01,ch01_e104,October 18,Grammar is just as confusing in Canada as it was in England.
PasWide,01,ch01_e104,October 18,I know when to say me and I and all that.
PasWide,01,ch01_e104,October 18,Mother is very stern about that kind of grammar.
PasWide,01,ch01_e104,October 18,But I just can’t do parsing.
PasWide,01,ch01_e104,October 18,I can’t remember what parts of the sentence are called.
PasWide,01,ch01_e104,October 18,What does it matter if something is an adverb clause?
PasWide,01,ch01_e104,October 18,I guess it matters to Klaus Berg.
PasWide,01,ch01_e104,October 18,"He won, and his family doesn’t even speak English at home."
PasWide,01,ch01_e104,October 18,The only good thing about today was that I wore the new frock that Mother made me out of one of her old ones.
PasWide,01,ch01_e104,October 18,But then even that was spoiled.
PasWide,01,ch01_e104,October 18,"Nyla looked at it, looking down her nose the way she does, and said, “That’s an interesting style."
PasWide,01,ch01_e104,October 18,"Did it come from the Eaton’s catalogue?” I said no, that Mother made it and she said, “Oh,” (little pause), “homemade.” She makes me cross enough to spit."
PasWide,01,ch01_e104,October 18,Of course she knew it was homemade.
PasWide,01,ch01_e104,October 18,I fell for it.
PasWide,01,ch01_e104,October 18,"I should have just said, “No, Nyla,” and left her hanging."
PasWide,01,ch01_e105,October 19,Black Tuesday Dot has gone.
PasWide,01,ch01_e105,October 19,I’m too sad to write.
PasWide,01,ch01_e106,October 21,I don’t know what to do.
PasWide,01,ch01_e106,October 21,I’m in the farmhouse alone with the twins.
PasWide,01,ch01_e106,October 21,Today is moving day and Mother and Dad and William have gone to town with the first load of furniture.
PasWide,01,ch01_e106,October 21,They borrowed a team of horses and a hay rack to move us.
PasWide,01,ch01_e106,October 21,But they haven’t come back and it is snowing hard.
PasWide,01,ch01_e106,October 21,At first it was fun being in the house alone.
PasWide,01,ch01_e106,October 21,We played hide and seek and yelled a lot.
PasWide,01,ch01_e106,October 21,We ate bread and molasses for lunch and didn’t use table manners.
PasWide,01,ch01_e106,October 21,Then we played cross-channel ferry which is where you put a twin in the wash tub and push it around the floor.
PasWide,01,ch01_e106,October 21,But after lunch it got very dark and we looked out and it was snowing.
PasWide,01,ch01_e106,October 21,So we all ran outside.
PasWide,01,ch01_e106,October 21,Our first snow!
PasWide,01,ch01_e106,October 21,We ran around and tried to catch it on our tongues.
PasWide,01,ch01_e106,October 21,I remember snow once at home but the twins don’t remember it at all.
PasWide,01,ch01_e106,October 21,Harry wanted to build an igloo right away but there wasn’t enough snow and it wasn’t sticky.
PasWide,01,ch01_e106,October 21,Then we were all cold and the snow had turned into needles.
PasWide,01,ch01_e106,October 21,So we came in.
PasWide,01,ch01_e106,October 21,And the fire was nearly out.
PasWide,01,ch01_e106,October 21,I put more coal in and we ate more bread and molasses.
PasWide,01,ch01_e106,October 21,Then we told stories.
PasWide,01,ch01_e106,October 21,I told them The Three Pigs and The Three Bears and a made-up story about chickens.
PasWide,01,ch01_e106,October 21,Then Harry told a story about the bogeyman and the bogeywife and the bogeyhouse and the bogeybaby who went around in a bogeypram.
PasWide,01,ch01_e106,October 21,It was very silly but Gladys loved it.
PasWide,01,ch01_e106,October 21,They seem happy enough.
PasWide,01,ch01_e106,October 21,But now it is getting dark and Mother and Dad are not back.
PasWide,01,ch01_e106,October 21,Where are they?
PasWide,01,ch01_e106,October 21,Later I just put the last piece of coal in the stove.
PasWide,01,ch01_e106,October 21,The fire is eating it up very fast.
PasWide,01,ch01_e106,October 21,I found some candles.
PasWide,01,ch01_e106,October 21,You can’t see anything out the windows except snow blowing in the darkness.
PasWide,01,ch01_e106,October 21,The little ones are hungry but they don’t want more bread and molasses which is the only thing we have.
PasWide,01,ch01_e106,October 21,I want Mother and Dad to come right now.
PasWide,01,ch01_e106,October 21,Before I finish writing this extra-long-waiting-to-hear-them sentence I want to hear them in the yard.
PasWide,01,ch01_e106,October 21,Before I finish writing this long sentence I want to hear the horses.
PasWide,01,ch01_e106,October 21,Can horses walk in snow?
PasWide,01,ch01_e106,October 21,What if they all got caught in the snow?
PasWide,01,ch01_e106,October 21,They are not here.
PasWide,01,ch01_e106,October 21,What would Louis and Hector and Catharine do?
PasWide,01,ch01_e106,October 21,I’m trying to remember the book.
PasWide,01,ch01_e106,October 21,Even Later Why doesn’t somebody come?
PasWide,01,ch01_e106,October 21,I don’t know what time it is.
PasWide,01,ch01_e106,October 21,I found some rugs and wrapped up the twins in front of the stove.
PasWide,01,ch01_e106,October 21,There isn’t any more coal.
PasWide,01,ch01_e106,October 21,I’m burning the meadow muffins that I collected last summer.
PasWide,01,ch01_e106,October 21,But there aren’t many more.
PasWide,01,ch01_e106,October 21,If only I could go to town and get help.
PasWide,01,ch01_e106,October 21,But how?
PasWide,01,ch01_e106,October 21,"When they left Dad said, “Take care of the little ones.” I’m trying."
PasWide,01,ch01_e106,October 21,I don’t want to have to be the grown-up.
PasWide,01,ch01_e106,October 21,I’m looking at the kitchen chairs and I don’t see chairs.
PasWide,01,ch01_e106,October 21,I see wood.
PasWide,01,ch01_e106,October 21,"There used to be a hatchet propped just outside the door, unless they took it."
PasWide,01,ch01_e107,October 22,The Story of Yesterday Yesterday was the most frightening day of my life.
PasWide,01,ch01_e107,October 22,After I finished writing that about the chairs I decided I did have to chop them up for the stove.
PasWide,01,ch01_e107,October 22,I could feel the cold creeping down the walls and Harry was crying.
PasWide,01,ch01_e107,October 22,But I couldn’t open the door to look for the hatchet because snow was drifted against it.
PasWide,01,ch01_e107,October 22,So I broke the kitchen window and crawled out and felt around in the snow and I did find the hatchet.
PasWide,01,ch01_e107,October 22,I tried to wedge the washtub into the broken window with some rags but it didn’t work very well.
PasWide,01,ch01_e107,October 22,It is harder to chop up chairs than it looks.
PasWide,01,ch01_e107,October 22,And all the time I was wondering if I was going to get into the biggest trouble ever.
PasWide,01,ch01_e107,October 22,But I did it.
PasWide,01,ch01_e107,October 22,"First the six kitchen chairs and then, when they were burnt up, Mother’s rocking chair that she brought from England."
PasWide,01,ch01_e107,October 22,The twins just stared at me.
PasWide,01,ch01_e107,October 22,Then I think I must have gone to sleep because I woke up to Dad and Mr. Burgess coming in the door.
PasWide,01,ch01_e107,October 22,The snow had stopped.
PasWide,01,ch01_e107,October 22,They came in a sleigh.
PasWide,01,ch01_e107,October 22,Dad hugged us all together and cried.
PasWide,01,ch01_e107,October 22,He said he got trapped in town in the blizzard.
PasWide,01,ch01_e107,October 22,He said that chopping up the chairs was a very sensible thing to do and that he was proud of me and that I was becoming very Canadian.
PasWide,01,ch01_e107,October 22,Then they wrapped us all in rugs and took us to town and Mother hugged us and cried too.
PasWide,01,ch01_e107,October 22,Even William got wet eyes.
PasWide,01,ch01_e107,October 22,I’m very tired.
PasWide,01,ch01_e108,October 23,First Day in the Hotel Everything is higgledy piggledy but Mother let me lie in anyway.
PasWide,01,ch01_e108,October 23,She brought me tea and porridge in bed just like I was sick.
PasWide,01,ch01_e108,October 23,The sun has come out and there is a sound of dripping outside the windows.
PasWide,01,ch01_e108,October 23,The twins are roaring around in some room or other.
PasWide,01,ch01_e108,October 23,I need to get up and explore the Weatherall Hotel.
PasWide,01,ch01_e108,October 23,Evening Dad brought home the Milorie Messenger to show us the advertisement for the hotel.
