book_name,chapter_id,entry_id,date,sentence
SofS,c07,chc07_e11,"October 19, 1847","Neither the sister’s letter nor mine had produced any reply, and the newspaper that had printed my notice had received no reply regarding me."
SofS,c07,chc07_e11,"October 19, 1847","“You have a home here for as long as you care to stay,” Mrs. Hall said."
SofS,c07,chc07_e11,"October 19, 1847",Mr. Hall nodded his agreement.
SofS,c07,chc07_e11,"October 19, 1847",“You have made yourself a member of our family.
SofS,c07,chc07_e11,"October 19, 1847",I know Lucy would be heartbroken if you were to leave us.” I thanked her for her kindness.
SofS,c07,chc07_e11,"October 19, 1847",It is nice to have a place in the world.
SofS,c07,chc07_e11,"October 19, 1847",But how I wished that the news had been different!
SofS,c07,chc07_e11,"October 19, 1847",How I wished that my true place was with my brother and my uncle — with blood family.
SofS,c07,chc07_e11,"October 19, 1847",I tucked the letter in the pocket of my dress and busied myself with my work.
SofS,c07,chc07_e11,"October 19, 1847","I pulled it out again later, when I was alone, and reread it."
SofS,c07,chc07_e11,"October 19, 1847",This time I could not hold back my tears.
SofS,c07,chc07_e11,"October 19, 1847",Michael had been gone for so long without a word of news.
SofS,c07,chc07_e11,"October 19, 1847","Had he fallen ill, as Da had?"
SofS,c07,chc07_e11,"October 19, 1847",Had some other misfortune befallen him?
SofS,c07,chc07_e11,"October 19, 1847",And what of Uncle Liam?
SofS,c07,chc07_e11,"October 19, 1847",Was I doomed forever to be a kinless stranger in this country?
SofS,c07,chc07_e11,"October 19, 1847",I wept until I fell asleep.
SofS,c07,chc07_e12,"October 21, 1847","While he was in Sherbrooke, Mr. Hall accepted employment from a logging company."
SofS,c07,chc07_e12,"October 21, 1847",Nearing and Mr. Webley.
SofS,c07,chc07_e12,"October 21, 1847",Men are needed to build a road for what Mr. Hall calls the winter sleigh haul.
SofS,c07,chc07_e12,"October 21, 1847",They will be gone for a few weeks.
SofS,c07,chc07_e12,"October 21, 1847",After Christmas the logging company will take them on again to transport the logs over the road to the edge of a river.
SofS,c07,chc07_e12,"October 21, 1847","In spring, when the ice breaks up, the logs are floated to sawmills or to ports to be loaded onto ships."
SofS,c07,chc07_e12,"October 21, 1847","The company pays cash, which Mrs. Lyons says is scarce but is needed to buy certain items."
SofS,c07,chc07_e12,"October 21, 1847",Mrs. Lyons has also left for a while.
SofS,c07,chc07_e12,"October 21, 1847","She has been called to her brother’s house to attend the funeral of her nephew, who perished after being thrown from a horse."
SofS,c07,chc07_e13,"October 23, 1847","There are just three of us in the house — Mrs. Hall, Lucy and me."
SofS,c07,chc07_e13,"October 23, 1847",I am grateful that Mrs. Hall is slowly coming back to herself.
SofS,c07,chc07_e13,"October 23, 1847","She even smiles from time to time, but not with the same brightness as before."
SofS,c07,chc07_e13,"October 23, 1847",I think she is remembering small moments with Catherine.
SofS,c07,chc07_e13,"October 23, 1847",The other day I heard her singing softly.
SofS,c07,chc07_e13,"October 23, 1847","It was not one of the gay tunes she used to sing, swirling around the room with one or other of her girls in her arms, but was slow and sombre like a hymn."
SofS,c07,chc07_e13,"October 23, 1847",Mrs. Hall goes often to visit Catherine under the oak tree and sometimes sits and stares out the window at the little hill and the small marker on it.
SofS,c07,chc07_e13,"October 23, 1847",At least she has that comfort.
SofS,c07,chc07_e13,"October 23, 1847","I have none when I think of my dear ma and wee Patrick, who found their rest in the deep, dark sea."
SofS,c07,chc07_e13,"October 23, 1847","Nor of my da, buried somewhere in Montreal without a marker on his grave."
SofS,c07,chc07_e13,"October 23, 1847",I think of Michael and wonder where he is.
SofS,c07,chc07_e13,"October 23, 1847",I think too of Uncle and wonder what has become of him.
SofS,c07,chc07_e13,"October 23, 1847",Does he know that I am alive?
SofS,c07,chc07_e13,"October 23, 1847",The air turns cooler every day.
SofS,c07,chc07_e13,"October 23, 1847","When my chores are done for the day, I sit with Mrs. Hall and work on my quilt."
SofS,c07,chc07_e13,"October 23, 1847",I am making good progress.
SofS,c07,chc07_e13,"October 23, 1847","Mrs. Hall is making long sturdy socks that Mr. Hall will wear when he goes about his winter work, which she says will consist mainly of working for the logging company."
SofS,c07,chc07_e13,"October 23, 1847",She says there is little besides that and indoor work that can be done during the winter months in this country.
SofS,c07,chc07_e13,"October 23, 1847","Mrs. Hall is also knitting warm stockings, mittens and a muffler for Lucy."
SofS,c07,chc07_e14,"October 26, 1847",Our days pass in quiet industry.
SofS,c07,chc07_e14,"October 26, 1847",I rise to a room so cold that my breath hangs in a cloud above my head.
SofS,c07,chc07_e14,"October 26, 1847",I dress quickly and steal down to the kitchen to stir up the fire and put on the kettle.
SofS,c07,chc07_e14,"October 26, 1847",I help Mrs. Hall prepare the morning meal.
SofS,c07,chc07_e14,"October 26, 1847",I sweep and wash and scrub.
SofS,c07,chc07_e14,"October 26, 1847",I play with Lucy while her mother attends to her own affairs.
SofS,c07,chc07_e14,"October 26, 1847",I help Mrs. Hall prepare the afternoon meal.
SofS,c07,chc07_e14,"October 26, 1847",I clean again.
SofS,c07,chc07_e14,"October 26, 1847",I work on my quilt and I learn from Mrs. Hall.
SofS,c07,chc07_e14,"October 26, 1847","She always has some piece of work to hand, and she shows me what she is doing and how it is done."
SofS,c07,chc07_e14,"October 26, 1847","She says that once all preparations are made for winter, she will help me cut down an old dress of hers to remake into one for me."
SofS,c07,chc07_e14,"October 26, 1847",She will show me every step so that I will learn what she says is important for any woman to know.
SofS,c07,chc07_e15,"October 28, 1847",Fanny came over today to lighten the workload and brighten the mood of the house.
SofS,c07,chc07_e15,"October 28, 1847",Here is something I did not know about her.
SofS,c07,chc07_e15,"October 28, 1847","Not only does she love to sing, but she has a beautiful voice!"
SofS,c07,chc07_e15,"October 28, 1847","She taught Lucy and me some songs with different parts, and when we sang them together, Fanny taking one part and Lucy and I the other, Mrs. Hall declared that we sounded like a choir of angels."
SofS,c07,chc07_e15,"October 28, 1847","She even joined in, taking a third part, when we sang the song again."
SofS,c07,chc07_e15,"October 28, 1847",It was the happiest day the house has seen in a long time.
SofS,c07,chc07_e16,"October 31, 1847",Hallow Eve.
SofS,c07,chc07_e16,"October 31, 1847",It makes me homesick to remember the bone fires that would burn at home.
SofS,c07,chc07_e16,"October 31, 1847",It makes me miss Grandda too.
SofS,c07,chc07_e16,"October 31, 1847",He loved to tell stories on Hallow Eve about the spirit world and the fires that warmed wandering souls.
SofS,c07,chc07_e16,"October 31, 1847",He never minded the priests when they scolded him for such talk.
SofS,c08,chc08_e1,"November 4, 1847",Mrs. Lyons has returned.
SofS,c08,chc08_e1,"November 4, 1847",Mrs. Hall was so glad to see her that she hugged her.
SofS,c08,chc08_e1,"November 4, 1847",So did Lucy.
SofS,c08,chc08_e1,"November 4, 1847","I would have hugged her as well, but I was too shy."
SofS,c08,chc08_e1,"November 4, 1847",Her return will brighten the days.
SofS,c08,chc08_e1,"November 4, 1847",It has been so cold that the windows are frozen over and it is impossible to see through them.
SofS,c08,chc08_e1,"November 4, 1847",The water in the little jug in my room is frozen solid when I get out of bed in the morning and the edge of my blanket is covered in ice where my breath freezes on it.
SofS,c08,chc08_e1,"November 4, 1847",We are all wearing shawls and blankets over our clothes to keep warm.
SofS,c08,chc08_e1,"November 4, 1847",Mrs. Hall made a bed on the sofa for Lucy and she played quietly under her blankets all day.
SofS,c08,chc08_e1,"November 4, 1847","Mr. Fenton, who dropped by yesterday, said that he doesn’t remember such cold so early in the season."
SofS,c08,chc08_e1,"November 4, 1847",But he said it was not as bad as one year early in his marriage when he was in his workshop making chairs for the parlour.
SofS,c08,chc08_e1,"November 4, 1847",So frigid was it that a nail froze to his bare hand before he could hammer it into the piece of wood he was working on.
SofS,c08,chc08_e1,"November 4, 1847","He tore the skin getting it off, and Mrs. Fenton had to bandage it."
SofS,c08,chc08_e1,"November 4, 1847","Fanny says that ever after, her mother cautioned him to wear mittens while working with nails during winter."
SofS,c08,chc08_e2,"November 6, 1847","The sky was as grey as stone yesterday morning, but the air was not as cold as it has been."
SofS,c08,chc08_e2,"November 6, 1847",Mrs. Lyons said that this was because it was going to snow.
SofS,c08,chc08_e2,"November 6, 1847","Sure enough, by mid-morning the sky was thick with fluffy flakes."
SofS,c08,chc08_e2,"November 6, 1847",They wafted down slowly and landed as lightly as if they were feathers.
SofS,c08,chc08_e2,"November 6, 1847",I bundled Lucy up and we went for a walk around the yard.
SofS,c08,chc08_e2,"November 6, 1847",By midday the snow was up to the middle of my calf and was falling more thickly than ever.
SofS,c08,chc08_e2,"November 6, 1847",It snowed all day.
SofS,c08,chc08_e2,"November 6, 1847",At night the wind came up and blew the snow everywhere.
SofS,c08,chc08_e2,"November 6, 1847","When I arose this morning and went down to the kitchen to stir up the fire, I could not see out the kitchen window."
SofS,c08,chc08_e2,"November 6, 1847",I confess that I panicked.
SofS,c08,chc08_e2,"November 6, 1847",I thought that so much snow had fallen that the house was buried and that we would never get out nor anybody get in.
SofS,c08,chc08_e2,"November 6, 1847",Then Mr. Fenton came through the front door.
SofS,c08,chc08_e2,"November 6, 1847",He had come to check that all was well in Mr. Hall’s absence and laughed to see me so obviously relieved.
SofS,c08,chc08_e2,"November 6, 1847",He took me to the veranda to show me that the snow was so high only on the north side of the house where the kitchen is and on the north side of the barn.
SofS,c08,chc08_e2,"November 6, 1847",This is because the wind blew from the north and gusted the snow.
SofS,c08,chc08_e2,"November 6, 1847","Where it could not be blown, it piled up in high drifts."
SofS,c08,chc08_e2,"November 6, 1847",How quiet and mysterious a house seems when it is cocooned in the white stuff.
SofS,c08,chc08_e3,"November 10, 1847","Mr. Fenton and Fanny drove over in a cutter to take Mrs. Hall, Lucy and me for a ride."
SofS,c08,chc08_e3,"November 10, 1847",He bundled us all up under a great bearskin to keep us warm and we flew off across the snow.
SofS,c08,chc08_e3,"November 10, 1847",The horses’ breath drifted back in clouds toward us.
SofS,c08,chc08_e3,"November 10, 1847",Fanny taught me a song about sleigh-riding that she says is quite popular.
SofS,c08,chc08_e3,"November 10, 1847",We saw tracks in the snow — Mr. Fenton says they are deer.
SofS,c08,chc08_e3,"November 10, 1847",And all the trees — those without leaves and those that are always green — were frosted with snow.
SofS,c08,chc08_e3,"November 10, 1847",Everything was so pretty.
SofS,c08,chc08_e3,"November 10, 1847","We came back with apples in our cheeks and all feeling merry, and Mrs. Lyons had hot tea and bread and butter for us all."
SofS,c08,chc08_e4,"November 14, 1847","Lucy was restless today, and no wonder."
SofS,c08,chc08_e4,"November 14, 1847",Mr. Hall is due back any day.
SofS,c08,chc08_e4,"November 14, 1847",Lucy runs to the door constantly to see if she can catch a glimpse of him.
SofS,c08,chc08_e4,"November 14, 1847","Mrs. Hall has been feeling poorly for the past two days, so when Mrs. Fenton came to visit yesterday, she decided to stay."
SofS,c08,chc08_e4,"November 14, 1847",This put Mrs. Lyons’s nose out of joint.
SofS,c08,chc08_e4,"November 14, 1847",She muttered to herself for much of the morning.
SofS,c08,chc08_e4,"November 14, 1847",She thinks she is quite able to look after Mrs. Hall and feels that Mrs. Fenton does not trust her to do so.
SofS,c08,chc08_e4,"November 14, 1847",Mrs. Fenton told us both that Mrs. Hall is in a nervous state.
SofS,c08,chc08_e4,"November 14, 1847",Because of this she has forbidden any noise.
SofS,c08,chc08_e4,"November 14, 1847","She will not let me take Lucy outside, saying I am needed to mind my chores."
SofS,c08,chc08_e4,"November 14, 1847",Poor Lucy chafes for something to do.
SofS,c08,chc08_e4,"November 14, 1847","So this afternoon when Mrs. Fenton and Mrs. Lyons were busy in the kitchen, I told Lucy some fairy stories."
SofS,c08,chc08_e4,"November 14, 1847","To give her greater pleasure, I acted out the parts."
SofS,c08,chc08_e4,"November 14, 1847","I was careful to be quiet, telling Lucy that it is the custom to tell these stories in a low voice so that the fairies would not overhear them and become angry."
SofS,c08,chc08_e4,"November 14, 1847",She fell easily into the small ruse.
SofS,c08,chc08_e4,"November 14, 1847","I told her three stories, then said I must get back to work."
SofS,c08,chc08_e4,"November 14, 1847",Lucy begged me for another.
SofS,c08,chc08_e4,"November 14, 1847","Just one more, she said, and she would be satisfied."
SofS,c08,chc08_e4,"November 14, 1847",So I began a story about the leprechauns and their pots of gold.
SofS,c08,chc08_e4,"November 14, 1847",At that Lucy jumped up and ran to the little desk that Mrs. Hall uses to write letters to her family.
SofS,c08,chc08_e4,"November 14, 1847",She opened one of the drawers and brought back a gold chain with a small but solid-gold pendant at one end.
SofS,c08,chc08_e4,"November 14, 1847","“It’s from Papa’s watch,” she said."
SofS,c08,chc08_e4,"November 14, 1847","“Grandfather gave it to him, but he says it’s too grand to wear."
SofS,c08,chc08_e4,"November 14, 1847","It can be the gold in the leprechaun’s pot.” I did not think this was a good idea, for it was clear the watch fob was of great value."
SofS,c08,chc08_e4,"November 14, 1847",I told her to put it back.
SofS,c08,chc08_e4,"November 14, 1847","Disappointed, she started back to the desk to do as she was told."
SofS,c08,chc08_e4,"November 14, 1847","But in her haste, she tripped and the chain and fob flew from her hand and landed under the sofa."
SofS,c08,chc08_e4,"November 14, 1847","When she went to fetch it, she couldn’t seem to get it."
SofS,c08,chc08_e4,"November 14, 1847","“It’s stuck,” she said."
SofS,c08,chc08_e4,"November 14, 1847",She pulled harder and then let out a yowl.
SofS,c08,chc08_e4,"November 14, 1847",She had tugged too hard and the golden fob separated from the chain.
SofS,c08,chc08_e4,"November 14, 1847","She thrust them into my hands just as Mrs. Fenton appeared, drawn by Lucy’s cry."
SofS,c08,chc08_e4,"November 14, 1847",“What on earth is going on?
SofS,c08,chc08_e4,"November 14, 1847",Did I not tell you to be quiet?” she hissed.
SofS,c08,chc08_e4,"November 14, 1847","I glanced at Lucy, who was staring wide-eyed at Mrs. Fenton’s angry face."
SofS,c08,chc08_e4,"November 14, 1847",Mrs. Fenton stared at the golden chain and fob in my hands and then at the open desk drawer.
SofS,c08,chc08_e4,"November 14, 1847",She snatched them from my hands and demanded to know what I was doing.
SofS,c08,chc08_e4,"November 14, 1847",“We were playing —” I began.
SofS,c08,chc08_e4,"November 14, 1847","“You were stealing, and don’t deny it,” Mrs. Fenton said."
SofS,c08,chc08_e4,"November 14, 1847",Her face was as black as the sky when a storm strikes.
SofS,c08,chc08_e4,"November 14, 1847","I tried to explain, but she wouldn’t even let me start."
SofS,c08,chc08_e4,"November 14, 1847","“Just as I have always suspected,” she said."
SofS,c08,chc08_e4,"November 14, 1847",“You people are no better than animals.” She said that she had warned Mrs. Hall not to take on an Irish girl because the Irish are lazy beggars.
SofS,c08,chc08_e4,"November 14, 1847","She threatened to tell Mrs. Hall what I had done, and said that I would be dismissed."
SofS,c08,chc08_e4,"November 14, 1847",I was so angry at the slanders that my voice trembled when I told her that I would never steal from the Halls and that we were merely playing.
SofS,c08,chc08_e4,"November 14, 1847",She slapped me.
SofS,c08,chc08_e4,"November 14, 1847",Her open hand struck my cheek with a sound like the report of a gun.
SofS,c08,chc08_e4,"November 14, 1847","She told me to gather my things, for I was dismissed immediately."
SofS,c08,chc08_e4,"November 14, 1847",Lucy began to cry.
SofS,c08,chc08_e4,"November 14, 1847",I think she was afraid that Mrs. Fenton would strike her too.
SofS,c08,chc08_e4,"November 14, 1847",I touched the spot where Mrs. Fenton had struck me — it was on fire — and told Mrs. Fenton that it was not her place to dismiss me.
SofS,c08,chc08_e4,"November 14, 1847",Her face grew even darker.
SofS,c08,chc08_e4,"November 14, 1847","I was sure that when next she spoke, thunder would echo out of her mouth and lightning bolts would flash from her eyes."
SofS,c08,chc08_e4,"November 14, 1847",Mrs. Hall appeared at that moment and asked what the matter was.
SofS,c08,chc08_e4,"November 14, 1847","Lucy ran to her, crying, and wrapped her arms around her mother’s legs, sobbing that Papa would be angry when he saw his watch chain."
SofS,c08,chc08_e4,"November 14, 1847","“Johanna took it and broke it,” Mrs. Fenton said."
SofS,c08,chc08_e4,"November 14, 1847",She held it up so that Mrs. Hall could see it.
SofS,c08,chc08_e4,"November 14, 1847",Mrs. Hall asked me if this was true.
SofS,c08,chc08_e4,"November 14, 1847","I didn’t want to lie to her, but neither did I want Lucy to take the blame for something that was an accident."
SofS,c08,chc08_e4,"November 14, 1847",So I told Mrs. Hall that no harm was meant.
SofS,c08,chc08_e4,"November 14, 1847",Mrs. Hall frowned.
SofS,c08,chc08_e4,"November 14, 1847",She looked at her sobbing daughter.
SofS,c08,chc08_e4,"November 14, 1847",Finally she knelt down before the child and made Lucy look into her eyes and swear to tell the truth.
SofS,c08,chc08_e4,"November 14, 1847",Tears rolled down Lucy’s cheeks as she spilled out the whole story.
SofS,c08,chc08_e4,"November 14, 1847",Mrs. Hall thanked her for telling the truth and said that she must not touch Papa’s things again.
SofS,c08,chc08_e4,"November 14, 1847",Then she scooped Lucy into her arms and comforted her.
SofS,c08,chc08_e4,"November 14, 1847",She suggested we all have a cup of tea and sent Mrs. Lyons and me to the kitchen to prepare it.
SofS,c08,chc08_e4,"November 14, 1847",Not another word was said about Mrs. Fenton’s accusations.
SofS,c08,chc08_e4,"November 14, 1847","Later Mrs. Lyons told me that Mrs. Fenton was not a bad person, but that she is forgetful about her own past."
SofS,c08,chc08_e4,"November 14, 1847","When I asked what she meant, she told me that Mrs. Fenton’s father had brought the family from New York to Upper Canada after the American War of Independence."
SofS,c08,chc08_e4,"November 14, 1847",He was given land and three years’ supply of food by the Crown.
SofS,c08,chc08_e4,"November 14, 1847","After the three years, there was a terrible drought, and all the crops failed."
SofS,c08,chc08_e4,"November 14, 1847","Mrs. Lyons said that Mrs. Fenton’s family and many others tried to sell parts of their land for a few barrels of flour, but found no buyers."
SofS,c08,chc08_e4,"November 14, 1847",Others ate dogs and grew fond of the taste.
SofS,c08,chc08_e4,"November 14, 1847","“To hear Mrs. Fenton tell it, sheer grit and determination got them through that terrible year,” Mrs. Lyons said."
SofS,c08,chc08_e4,"November 14, 1847","“A year which, she never omits to mention, was no fault of their own."
SofS,c08,chc08_e4,"November 14, 1847","So next time she lays into you, Johanna, think of her father gnawing the bone of some poor dog."
SofS,c08,chc08_e4,"November 14, 1847",’Twill make her seem less daunting.” Today Mrs. Lyons became a dear friend.
SofS,c08,chc08_e5,"November 16, 1847",Mrs. Hall is at the window as often as Lucy.
SofS,c08,chc08_e5,"November 16, 1847",I think she is worried that Mr. Hall has not returned yet.
SofS,c08,chc08_e5,"November 16, 1847",The house is not the same without him.
SofS,c08,chc08_e5,"November 16, 1847",But she is feeling stronger and sits with us in the evening instead of retiring early.
SofS,c08,chc08_e5,"November 16, 1847",Sometimes we tell stories.
SofS,c08,chc08_e5,"November 16, 1847",Mrs. Lyons tells about the early days in this country.
SofS,c08,chc08_e5,"November 16, 1847",Her great-grandparents were French and settled in what was then New France.
SofS,c08,chc08_e5,"November 16, 1847",Her grandmother caused a scandal by wedding an Englishman and raising her children in the English language.
SofS,c08,chc08_e5,"November 16, 1847","Mrs. Lyons also has stories about the Cree, stories that came to her from her grandmother, who heard them from her father, who was a fur trader."
SofS,c08,chc08_e5,"November 16, 1847",Even Mrs. Hall joins in with stories of some of the English kings.
SofS,c08,chc08_e5,"November 16, 1847",Last night while Mrs. Lyons was working on some clothes for the expected babe of a niece in Montreal and Mrs. Lyons and I were knitting socks — she for Mr. Hall and I finishing a pair for Fanny — Lucy asked me to tell a fairy story.
SofS,c08,chc08_e5,"November 16, 1847",I shook my head.
SofS,c08,chc08_e5,"November 16, 1847","While children enjoy my stories, grown-ups in this country do not seem to approve."
SofS,c08,chc08_e5,"November 16, 1847","But Mrs. Hall said that she would love to hear one, so I launched into the tale of the vain princess who refuses all suitors as not being grand enough or handsome enough for her."
SofS,c08,chc08_e5,"November 16, 1847",At last her impatient father marries her off to the ugliest and lowliest man in the kingdom.
SofS,c08,chc08_e5,"November 16, 1847",He takes her to his wee den of a home where she is hard put to keep it clean and tidy and must learn to cook his meals without burning them and darn his socks without pricking herself and bleeding on them.
SofS,c08,chc08_e5,"November 16, 1847",At first she is resentful at her fall from grace.
SofS,c08,chc08_e5,"November 16, 1847",She refuses to kiss her own wed husband but instead puts him off with her haughty ways.
SofS,c08,chc08_e5,"November 16, 1847",But time goes by and she learns that her husband is a good and patient man when she is a good and patient wife.
SofS,c08,chc08_e5,"November 16, 1847",She learns too that he is so wise that people from all around come to him with their problems and he solves them all in a fair way that pleases all parties.
SofS,c08,chc08_e5,"November 16, 1847","To her great surprise, she falls in love with him."
SofS,c08,chc08_e5,"November 16, 1847","And one night when he would kiss her, she lets him."
SofS,c08,chc08_e5,"November 16, 1847",Before her very eyes he is transformed into the most handsome gentleman she has ever seen.
SofS,c08,chc08_e5,"November 16, 1847","The very next day, she learns that he is no rude peasant but is the master of a vast domain and that all the people who came to him with their problems are his subjects, who adore him."
SofS,c08,chc08_e5,"November 16, 1847",“But why didn’t you tell me?” she asked him.
SofS,c08,chc08_e5,"November 16, 1847","“Because I wanted you to love me for myself,” he replied, “and not for what I possess or how I look.” Lucy was pleased to learn that the two lived happily ever after and had two lovely daughters and two brave sons."
SofS,c08,chc08_e5,"November 16, 1847",Even Mrs. Hall and Mrs. Lyons sighed contentedly at the ending.
SofS,c08,chc08_e6,"November 19, 1847",It is nearly one month since Mr. Hall went away to the logging camp.
SofS,c08,chc08_e6,"November 19, 1847","The sky was leaden all day, and there was something ominous in the air."
SofS,c08,chc08_e6,"November 19, 1847","Mrs. Lyons said it was a storm brewing, but when I went outside to get more wood for the fire, it was as still as if the air had been sucked out of all life in the area."
SofS,c08,chc08_e6,"November 19, 1847",I hastened back inside.
SofS,c08,chc08_e6,"November 19, 1847","The evening was starless because of the clouds, and there was no moon to be seen."
SofS,c08,chc08_e6,"November 19, 1847",The dishes had been washed and cleared away and the floors swept.
SofS,c08,chc08_e6,"November 19, 1847",The house was silent.
SofS,c08,chc08_e6,"November 19, 1847","Lucy had been out of sorts all day, so Mrs. Hall put her down in her own bed."
SofS,c08,chc08_e6,"November 19, 1847","Mrs. Lyons and I expected her to come back, but she did not."
SofS,c08,chc08_e6,"November 19, 1847","At last Mrs. Lyons tiptoed to the threshold, and a smile appeared on her lips."
SofS,c08,chc08_e6,"November 19, 1847","“They are asleep in each other’s arms,” she said."
SofS,c08,chc08_e6,"November 19, 1847",“I think maybe the new child will make things easier on her.” “New child?” It took me a minute to understand that a new babe was on its way.
SofS,c08,chc08_e6,"November 19, 1847",I had had no inkling.
SofS,c08,chc08_e6,"November 19, 1847",Mrs. Lyons smiled and nodded.
SofS,c08,chc08_e6,"November 19, 1847",I hoped it would bring a fresh smile to Mrs. Hall’s face.
SofS,c08,chc08_e6,"November 19, 1847",Mrs. Lyons asked me to tell her a story.
