book_name,chapter_id,entry_id,date,sentence
SofS,c01,chc01_e1,"April 30, 1847","When Grandda told me all the stories he had about fairies and pookas and banshees, and about the ancients, such as the great Cuchulain, he said that stories hold a people together."
SofS,c01,chc01_e1,"April 30, 1847","I wonder what he would think if he were still here, for Da says that this great trouble we are in is tearing our people apart."
SofS,c01,chc01_e1,"April 30, 1847",It has sent many to their deaths and now it drives us from our home.
SofS,c01,chc01_e1,"April 30, 1847",That is why I have decided to write down our story.
SofS,c01,chc01_e1,"April 30, 1847",I want to write about what is happening to us and what will happen next.
SofS,c01,chc01_e1,"April 30, 1847","Tomorrow we leave, and Da says we may never return."
SofS,c01,chc01_e1,"April 30, 1847","He and Ma, Michael, wee Patrick and I are to walk to Dublin, where we will take a steamer to Liverpool in England."
SofS,c01,chc01_e1,"April 30, 1847",He says it is our only hope.
SofS,c01,chc01_e1,"April 30, 1847","Even in spite of this, Ma is sad to leave."
SofS,c01,chc01_e1,"April 30, 1847","She says, how can we think of making a fresh start in a new land, Canada, when we have to rely on charity to get ourselves there?"
SofS,c01,chc01_e1,"April 30, 1847","She says, if anything happens, what will become of us without friends and neighbours close by?"
SofS,c01,chc01_e1,"April 30, 1847",Da reminds her that his bother Liam is in Canada and will surely help us.
SofS,c01,chc01_e1,"April 30, 1847","I barely remember him, I was so small when he left."
SofS,c01,chc01_e1,"April 30, 1847","For myself, I think of Anna going out there last year with her family."
SofS,c01,chc01_e1,"April 30, 1847",I am not afraid.
SofS,c01,chc01_e1,"April 30, 1847",Leaving is like being granted three wishes all at once.
SofS,c01,chc01_e1,"April 30, 1847","When we leave, all the sadness and misery around us will vanish."
SofS,c01,chc01_e1,"April 30, 1847","When we leave, we will go to a place where people eat meat and drink milk every day."
SofS,c01,chc01_e1,"April 30, 1847","When we leave, it will bring the day closer when I will be with Anna again and once more hear Da tease us by calling us AnnaJohanna all in one breath, as if we were one person."
SofS,c01,chc01_e1,"April 30, 1847",I close my ears when Da tells me that I must not get my hopes up.
SofS,c01,chc01_e1,"April 30, 1847","He says that Canada is a big country and that, anyway, many Irish leave Canada to go to America, which is bigger than Ireland."
SofS,c01,chc01_e1,"April 30, 1847",He says that the Irish in America are scattered like the stars across the sky and that any one of them will be hard to find.
SofS,c01,chc01_e1,"April 30, 1847",But how many Anna Riordans can there be?
SofS,c01,chc01_e1,"April 30, 1847",I know I will find her.
SofS,c02,chc02_e1,"May 1, 1847",I heard Ma crying in the night when everyone else was asleep.
SofS,c02,chc02_e1,"May 1, 1847","She says she would rather go to England, where she is sure a fine carpenter like Da will find work."
SofS,c02,chc02_e1,"May 1, 1847",But Da says things are hard for Irish there and that Canada is a better place.
SofS,c02,chc02_e1,"May 1, 1847",He says it is full of promise.
SofS,c02,chc02_e1,"May 1, 1847",He tries to soothe Ma by reading Uncle Liam’s old letters aloud again.
SofS,c02,chc02_e1,"May 1, 1847",Uncle Liam writes that he dines like a king on wheat bread with butter made from the milk of his own cows and on eggs from the chickens he keeps.
SofS,c02,chc02_e1,"May 1, 1847",He eats beef and pork.
SofS,c02,chc02_e1,"May 1, 1847",He makes meat sausage in the autumn that he says smells glorious as it sizzles over the fire.
SofS,c02,chc02_e1,"May 1, 1847","Just thinking about sizzling sausage makes my mouth water, even though I have never eaten it."
SofS,c02,chc02_e1,"May 1, 1847",Sizzling is such a fine word.
SofS,c02,chc02_e1,"May 1, 1847",I think that anything that sizzles must taste delicious.
SofS,c02,chc02_e1,"May 1, 1847",Ma frets that Da has received no letter from Liam in nearly a year.
SofS,c02,chc02_e1,"May 1, 1847",She says something may have happened to him.
SofS,c02,chc02_e1,"May 1, 1847",But Da refuses to worry.
SofS,c02,chc02_e1,"May 1, 1847",He says his brother is probably busy with his animals and his crops.
SofS,c02,chc02_e1,"May 1, 1847",Perhaps he has even married and has a baby to attend to.
SofS,c02,chc02_e1,"May 1, 1847","No matter, he says."
SofS,c02,chc02_e1,"May 1, 1847",A man who has his own land is a man who is always easily found.
SofS,c02,chc02_e2,"May 3, 1847",I am crouched behind a rock at the side of the road.
SofS,c02,chc02_e2,"May 3, 1847",I do not want Ma to see me.
SofS,c02,chc02_e2,"May 3, 1847","Last year when things got bad, she had to sell or trade everything we had of value — it was the only way to pay our debts and buy food."
SofS,c02,chc02_e2,"May 3, 1847","One by one her precious little store of books left her by her own da, my dear grandda, vanished — all save this little one that I am writing in."
SofS,c02,chc02_e2,"May 3, 1847","I hid it, thinking it worthless to anyone, for many of the pages are used and others are tattered."
SofS,c02,chc02_e2,"May 3, 1847","But if Ma saw me with it, she might become angry."
SofS,c02,chc02_e2,"May 3, 1847","My feet are sore, my legs ache and my stomach growls like a wild beast."
SofS,c02,chc02_e2,"May 3, 1847",We walked all day yesterday and the day before and have eaten most of the little store of food we brought with us.
SofS,c02,chc02_e2,"May 3, 1847",Da tries to keep our spirits up.
SofS,c02,chc02_e2,"May 3, 1847","He says we are better off than some, and this is true."
SofS,c02,chc02_e2,"May 3, 1847",We passed many wretched-looking people who have nothing at all to eat.
SofS,c02,chc02_e2,"May 3, 1847",One woman wept as she knelt over a man who had collapsed at the side of the road.
SofS,c02,chc02_e2,"May 3, 1847","Some we passed looked like wraiths risen from their shrouds, so hollow were their eyes and so sharply did their bones show through their grey skin."
SofS,c02,chc02_e2,"May 3, 1847",And such tales we have heard!
SofS,c02,chc02_e2,"May 3, 1847",Fifty folk are said to be dying each day in one county.
SofS,c02,chc02_e2,"May 3, 1847","One man swears he has seen coffins with trap doors in the bottom, which allow the coffin maker to sell and use the same coffin over and over."
SofS,c02,chc02_e2,"May 3, 1847",Another tells of two families who died from eating the diseased carcass of a horse.
SofS,c02,chc02_e2,"May 3, 1847",Da tells us not to listen.
SofS,c02,chc02_e2,"May 3, 1847","He says that if we keep going, we will be on the steamer for Liverpool the day after tomorrow and on our way across the ocean soon after that."
SofS,c02,chc02_e2,"May 3, 1847",I have never been on a steamer before.
SofS,c02,chc02_e2,"May 3, 1847",Steamer is another fine word.
SofS,c02,chc02_e2,"May 3, 1847",It makes me think of the little cloud of steam that rises when you break open a potato hot from the fire.
SofS,c02,chc02_e2,"May 3, 1847","I wish I had a potato now, with a little salt and a little milk."
SofS,c02,chc02_e2,"May 3, 1847",Some days I think that all I do is wish.
SofS,c02,chc02_e3,"May 6, 1847",We left Ireland yesterday and have reached Liverpool at last.
SofS,c02,chc02_e3,"May 6, 1847",Steamer is not such a fine word after all.
SofS,c02,chc02_e3,"May 6, 1847",I will be happy if I never have to set foot on another steamer again.
SofS,c02,chc02_e3,"May 6, 1847",The weather coming across to England was foul.
SofS,c02,chc02_e3,"May 6, 1847",Da says we were lucky to be on deck where people could be sick over the side of the vessel.
SofS,c02,chc02_e3,"May 6, 1847","In the hold, they had to use buckets or the floor."
SofS,c02,chc02_e3,"May 6, 1847",But I did not feel lucky.
SofS,c02,chc02_e3,"May 6, 1847","The wind whipped us the whole way across, and the rain, when it came, drove into my skin like needles of ice."
SofS,c02,chc02_e3,"May 6, 1847",Ma held Patrick close and sang softly to him when she wasn’t fretting about how we would manage if the whole journey was as miserable.
SofS,c02,chc02_e3,"May 6, 1847",Da tried to tease her out of her mood.
SofS,c02,chc02_e3,"May 6, 1847",He told her to try for a change to imagine the best instead of the worst.
SofS,c02,chc02_e3,"May 6, 1847",But Ma is not like Da.
SofS,c02,chc02_e3,"May 6, 1847",Ma worries all the time.
SofS,c02,chc02_e4,"May 7, 1847","From a distance, the stone piers and docks of Liverpool looked quite majestic, but close up they are crowded with people and ships, and the air is filled with shouts and cries, clatters and bangs."
SofS,c02,chc02_e4,"May 7, 1847","You cannot walk more than two paces without being crashed into or having some beggar’s hand thrust out before you and a plea made, often by some poor soul from home."
SofS,c02,chc02_e4,"May 7, 1847",The ships in the water jostle each other as roughly as the people on land do.
SofS,c02,chc02_e4,"May 7, 1847",They are not steamers.
SofS,c02,chc02_e4,"May 7, 1847",They are sailing ships.
SofS,c02,chc02_e4,"May 7, 1847",Michael says a steamer would likely run out of coal before it got very far and that we are going very far indeed.
SofS,c02,chc02_e4,"May 7, 1847","Da says that there are steamships that cross the ocean, but they are for rich folk, not for the likes of us."
SofS,c02,chc02_e4,"May 7, 1847",We are to board our ship tomorrow.
SofS,c02,chc02_e4,"May 7, 1847",Da says this makes us among the fortunate.
SofS,c02,chc02_e4,"May 7, 1847",Some folk arrived in Liverpool a week or more ago and had to spend every penny they had on lodging and food until the ship was ready to sail.
SofS,c02,chc02_e4,"May 7, 1847",I feel sorry for Da.
SofS,c02,chc02_e4,"May 7, 1847","He tries to keep our spirits up, but Ma smothers his efforts and calls him a dreamer."
SofS,c02,chc02_e4,"May 7, 1847",I remember when she used to say this fondly.
SofS,c02,chc02_e4,"May 7, 1847",There is no fondness in her words now.
SofS,c02,chc02_e5,"May 8, 1847","As we waited to board, I heard someone say that there will be more than three hundred passengers."
SofS,c02,chc02_e5,"May 8, 1847","The ship is large, but still I cannot see how it will fit so many people."
SofS,c02,chc02_e5,"May 8, 1847",We had to wait for such a long time before boarding that my legs got weary from standing.
SofS,c02,chc02_e5,"May 8, 1847",I sat on the ground and nearly had the life crushed out of me by a great horse of a girl.
SofS,c02,chc02_e5,"May 8, 1847","She was as heavy as a cartload of potatoes when she fell on me, and I know I will be bruised all over."
SofS,c02,chc02_e5,"May 8, 1847",She picked herself up as if she had tripped over a rock and started off again without so much as asking if I was hurt.
SofS,c02,chc02_e5,"May 8, 1847","“Excuse me, I’m sure,” I said in a loud voice, but she did not take the hint."
SofS,c02,chc02_e5,"May 8, 1847","Instead, she looked down at me in annoyance and said, “You could have done me an injury sitting in the road like that.” She meant it, too!"
SofS,c02,chc02_e5,"May 8, 1847",She is the rudest and least handsome girl I ever saw.
SofS,c02,chc02_e5,"May 8, 1847",I was hot and tired and hungry by the time we filed on board.
SofS,c02,chc02_e5,"May 8, 1847","But instead of being allowed to settle ourselves, we were held at one end of the ship in a great crush."
SofS,c02,chc02_e5,"May 8, 1847",Sailors went down below with long poles that had great spikes at the end.
SofS,c02,chc02_e5,"May 8, 1847","“They are searching for stowaways,” Michael whispered."
SofS,c02,chc02_e5,"May 8, 1847","But they must not have found any for they returned empty-handed, and roll call began."
SofS,c02,chc02_e5,"May 8, 1847","When the name Leary was called, Da stepped forward with our tickets, and we were permitted to go below."
SofS,c02,chc02_e5,"May 8, 1847","Later I am glad that our names were called early, for the hold where we are to sleep is as gloomy as a November evening."
SofS,c02,chc02_e5,"May 8, 1847","But because we were among the first to go below, we were able to choose a place close to one of the hatches."
SofS,c02,chc02_e5,"May 8, 1847",Ma keeps looking up at the grey patch of sky above.
SofS,c02,chc02_e5,"May 8, 1847","She doesn’t say anything, but I think she is nervous."
SofS,c02,chc02_e5,"May 8, 1847","The hold seemed large enough when we came down, but it filled quickly."
SofS,c02,chc02_e5,"May 8, 1847",There is hardly any space to walk on the floor (is a floor called a floor in a ship?
SofS,c02,chc02_e5,"May 8, 1847","), and the ceiling is so low that the taller men can barely stand upright."
SofS,c02,chc02_e5,"May 8, 1847","Our new home, as Da calls it, consists of one berth, which is only a grand name for a bit of plank, like a shelf, set into the side of the ship."
SofS,c02,chc02_e5,"May 8, 1847",The berths are three high and are so close together that you can’t even sit up once you’ve slithered in.
SofS,c02,chc02_e5,"May 8, 1847",I wonder how Anna’s family managed.
SofS,c02,chc02_e5,"May 8, 1847","They are seven and have no babies like Patrick, who takes up little space."
SofS,c02,chc02_e5,"May 8, 1847",Perhaps they were allowed two berths.
SofS,c02,chc02_e5,"May 8, 1847",Perhaps Anna got to share with her two sisters and they giggled their way across the ocean.
SofS,c02,chc02_e5,"May 8, 1847",Ma insisted on a topmost berth.
SofS,c02,chc02_e5,"May 8, 1847",She says that if it collapses — and she seems certain it will — at least we will not be crushed.
SofS,c02,chc02_e5,"May 8, 1847","Michael counted fifty-two berths altogether, in two rows."
SofS,c02,chc02_e5,"May 8, 1847",Each has five or six people in it.
SofS,c02,chc02_e5,"May 8, 1847","Between the rows there is a narrow aisle for bundles, boxes and chests."
SofS,c02,chc02_e5,"May 8, 1847",Ma says we are stacked and stored like peat.
SofS,c02,chc02_e5,"May 8, 1847",Da says we are as snug as a family of wee swallows in their nest.
SofS,c02,chc02_e5,"May 8, 1847",The berths to one side of us are taken by the family of the rude girl who nearly trampled me ashore.
SofS,c02,chc02_e5,"May 8, 1847","She is in the top berth, like me."
SofS,c02,chc02_e5,"May 8, 1847",My feet will point at her head the whole way to Canada.
SofS,c02,chc02_e5,"May 8, 1847",I will pretend to dance on it until it aches.
SofS,c02,chc02_e6,"May 9, 1847","Before we sailed, the captain ordered all the married men above deck."
SofS,c02,chc02_e6,"May 9, 1847",Da said they were told to form a committee and that he was elected head of it.
SofS,c02,chc02_e6,"May 9, 1847","The committee’s job is to keep watch during the night to make sure there are no irregularities, to alert the captain if anyone falls ill, and to secure the hatches if there is a storm."
SofS,c02,chc02_e6,"May 9, 1847",Ma looked frightened when he mentioned the word storm .
SofS,c02,chc02_e6,"May 9, 1847",I asked what irregularities the committee is to watch for.
SofS,c02,chc02_e6,"May 9, 1847","Da said, with a wink, that it must make sure all the young men and young women are where they are supposed to be and not where they should not be."
SofS,c02,chc02_e6,"May 9, 1847",Ma told him to hush.
SofS,c02,chc02_e6,"May 9, 1847",Da also said that we must air our bedding and dry-scrub our berths twice a week.
SofS,c02,chc02_e6,"May 9, 1847",No one is allowed to smoke or light a fire below deck.
SofS,c02,chc02_e6,"May 9, 1847","Finally, he said that we would receive one week’s rations at a time and that each family must take turns sending someone above to cook meals."
SofS,c02,chc02_e6,"May 9, 1847",The rations are mostly oatmeal.
SofS,c02,chc02_e6,"May 9, 1847",On some days we will get ship’s biscuit.
SofS,c02,chc02_e6,"May 9, 1847",Da does not know what the biscuit tastes like.
SofS,c02,chc02_e6,"May 9, 1847",There are two fireplaces on the deck for cooking.
SofS,c02,chc02_e6,"May 9, 1847",I climbed the ladder to peek at them.
SofS,c02,chc02_e6,"May 9, 1847","They are big wooden boxes lined with bricks, and they have metal grates set on them."
SofS,c02,chc02_e6,"May 9, 1847","Da says they will be lit at seven every morning, if the weather is fine enough, and put out at sunset."
SofS,c02,chc02_e6,"May 9, 1847",I do not know what we are supposed to do when the weather is not fine.
SofS,c02,chc02_e6,"May 9, 1847",Some of the older boys were asked to keep the deck clean and the cistern filled with water.
SofS,c02,chc02_e6,"May 9, 1847",Michael raised his hand to volunteer.
SofS,c02,chc02_e6,"May 9, 1847",The great ugly girl from the next berth started to raise her hand as well.
SofS,c02,chc02_e6,"May 9, 1847",Her da grabbed hold of it and jerked it down.
SofS,c02,chc02_e6,"May 9, 1847",He told her to get her head out of the clouds.
SofS,c02,chc02_e6,"May 9, 1847","Patrick was fussing, so Ma sent me to cook the oatmeal."
SofS,c02,chc02_e6,"May 9, 1847",I was afraid to go.
SofS,c02,chc02_e6,"May 9, 1847",What if I fell overboard?
SofS,c02,chc02_e6,"May 9, 1847",What if I ruined the meal?
SofS,c02,chc02_e6,"May 9, 1847","Mrs. Keenan, the rude girl’s mother, offered to help me."
SofS,c02,chc02_e6,"May 9, 1847",She is very nice.
SofS,c02,chc02_e6,"May 9, 1847",I don’t know how she could have raised such an unpleasant daughter.
SofS,c02,chc02_e6,"May 9, 1847",The fireplace wasn’t as hard to cook on as I feared.
SofS,c02,chc02_e6,"May 9, 1847",I didn’t burn the oatmeal.
SofS,c02,chc02_e6,"May 9, 1847",The rude girl gobbled her food like a pig.
SofS,c02,chc02_e6,"May 9, 1847",Mrs. Keenan did not scold her.
SofS,c02,chc02_e7,"May 10, 1847",I am not afraid to go up on the deck anymore.
SofS,c02,chc02_e7,"May 10, 1847","In fact, I was glad to go up today so that I could breathe some fresh air."
SofS,c02,chc02_e7,"May 10, 1847","Now that the ship is underway, many people are sick."
SofS,c02,chc02_e7,"May 10, 1847",There is so much groaning and vomiting below.
SofS,c02,chc02_e7,"May 10, 1847",I heard the captain tell Da that those new to the sea often take ill.
SofS,c02,chc02_e7,"May 10, 1847",He said it always reminds him of the psalm about going down to the sea in ships.
SofS,c02,chc02_e7,"May 10, 1847",He quoted the verse: “They reel to and fro and stagger like a drunken man and are at their wit’s end.” Michael is sick.
SofS,c02,chc02_e7,"May 10, 1847",So is Ma.
SofS,c02,chc02_e7,"May 10, 1847",Da looks pale but says he is fine.
SofS,c02,chc02_e7,"May 10, 1847",I do not think I believe him.
SofS,c02,chc02_e7,"May 10, 1847",I am not bothered at all.
SofS,c02,chc02_e8,"May 11, 1847",Too queasy to write much.
SofS,c02,chc02_e8,"May 11, 1847",Michael says it serves me right for being prideful about not getting ill in the first place.
SofS,c02,chc02_e9,"May 12, 1847",Stomach turning every which way.
SofS,c02,chc02_e9,"May 12, 1847",Still too queasy to write.
SofS,c02,chc02_e10,"May 13, 1847",I hate ships as much as I hate steamers.
SofS,c02,chc02_e11,"May 14, 1847",I woke up this morning feeling better.
SofS,c02,chc02_e11,"May 14, 1847","When I took out my book to write, Ma caught me at it."
SofS,c02,chc02_e11,"May 14, 1847","I thought she would be angry, but she was not."
SofS,c02,chc02_e11,"May 14, 1847",She asked me what I was doing with it.
SofS,c02,chc02_e11,"May 14, 1847","When I told her, all she said was that she hoped it would not turn out to be a book of sorrows."
SofS,c02,chc02_e11,"May 14, 1847",She left Patrick with me and went above to cook.
SofS,c02,chc02_e11,"May 14, 1847","It took her an eternity, but she returned with an extra-large portion of oatmeal."
SofS,c02,chc02_e11,"May 14, 1847",She said we can afford it as we have barely touched the week’s rations.
SofS,c02,chc02_e11,"May 14, 1847",I was surprised how ravenous I was.
SofS,c02,chc02_e11,"May 14, 1847",I ate until I was stuffed.
SofS,c02,chc02_e11,"May 14, 1847",I wonder if Uncle Liam does the same every day — only with sausage instead of oatmeal.
SofS,c02,chc02_e12,"May 15, 1847",Michael has been grinning like a fool all day but won’t tell me why.
SofS,c02,chc02_e12,"May 15, 1847",He says it’s a secret.
SofS,c02,chc02_e12,"May 15, 1847",He can be so annoying.
SofS,c02,chc02_e12,"May 15, 1847",I went above with Ma to cook oatmeal cakes.
SofS,c02,chc02_e12,"May 15, 1847",There are always women crowded near the fireplaces.
SofS,c02,chc02_e12,"May 15, 1847",Some of them cook.
SofS,c02,chc02_e12,"May 15, 1847",Some of them wait impatiently to cook.
SofS,c02,chc02_e12,"May 15, 1847",All of them chatter and gossip.
SofS,c02,chc02_e12,"May 15, 1847","We saw three sailors sitting in a row with their legs straight out in front of them, mending sails."
SofS,c02,chc02_e12,"May 15, 1847",Mrs. Keenan said that she wished Mr. Keenan would learn to mend for it would make her work lighter.
SofS,c02,chc02_e12,"May 15, 1847",There is nothing around us but water.
SofS,c02,chc02_e12,"May 15, 1847",It is frightening to think what would become of us if the ship were to strike something and sink.
SofS,c02,chc02_e12,"May 15, 1847",Who would save us?
SofS,c02,chc02_e12,"May 15, 1847","I haven’t seen the rude girl in days, and just as well."
SofS,c02,chc02_e13,"May 16, 1847","After services on the deck this morning, I discovered Michael’s secret."
SofS,c02,chc02_e13,"May 16, 1847",He is furious with me.
SofS,c02,chc02_e13,"May 16, 1847",I saw him creep to the farthest end of the hold and tuck himself behind a pile of trunks and boxes secured with rope.
SofS,c02,chc02_e13,"May 16, 1847",I crept close and listened.
SofS,c02,chc02_e13,"May 16, 1847",The secret is this: The rude Keenan girl is a boy!
SofS,c02,chc02_e13,"May 16, 1847",His name is Connor and he is wanted by the authorities.
SofS,c02,chc02_e13,"May 16, 1847","Although he is scarcely older than Michael, he and a band he is with threatened and robbed some of the landlords."
SofS,c02,chc02_e13,"May 16, 1847",His temper flared when I said that stealing is a sin.
SofS,c02,chc02_e13,"May 16, 1847","“If that is so, then why are the landlords and the merchants not charged for stealing the bounty of Ireland and selling it abroad while the people of Ireland starve to death?” he demanded."
SofS,c02,chc02_e13,"May 16, 1847",And he went on and on about that coroner in County Waterford saying that so many deaths there were caused by “the negligence of the government” in not providing food to the people.
SofS,c02,chc02_e13,"May 16, 1847","Michael agreed with him immediately, saying that while the potatoes rot and common folk starve, the landlords have been selling oats, wheat, barley, beef and pork abroad."
SofS,c02,chc02_e13,"May 16, 1847","I did not have to ask where he had heard this, for Connor nodded with every word."
SofS,c02,chc02_e13,"May 16, 1847","Nor could I dispute what he said, though the heartlessness of the landlords does not excuse the sin of robbery."
SofS,c02,chc02_e13,"May 16, 1847","But I was not in a mood to argue about what was right and what was wrong, especially when the two of them would have countered every word."
SofS,c02,chc02_e13,"May 16, 1847","Instead, I looked at Connor."
SofS,c02,chc02_e13,"May 16, 1847","“I have heard that a person’s opinions may break his nose or even cut his throat,” I said."
SofS,c02,chc02_e13,"May 16, 1847","“But never have I heard of a person’s mouth turning him into a girl, although in your case it clearly has."
SofS,c02,chc02_e13,"May 16, 1847","And a clumsy one at that.” “Pay no attention to my baby sister,” Michael said."
SofS,c02,chc02_e13,"May 16, 1847","I hate when he calls me that, as if I’m a mere child."
SofS,c02,chc02_e13,"May 16, 1847","“I’m no baby,” I said."
SofS,c02,chc02_e13,"May 16, 1847",“I’m thirteen.
SofS,c02,chc02_e13,"May 16, 1847","And you’re only a year older than I, Michael Leary.” “A year and a half,” Michael sniffed, as if that made all the difference."
SofS,c02,chc02_e13,"May 16, 1847","Connor laughed and said he had never met a baby with such a sharp tongue, but he didn’t seem at all put out."
SofS,c02,chc02_e13,"May 16, 1847","He said that his ma was so afraid he would be arrested and hanged that she dressed him as a girl and claimed he was her daughter, but that no matter how hard he tried, he could never master a girl’s ways."
SofS,c02,chc02_e14,"May 19, 1847","It has been days since I have written, for no sooner had I left Michael and Connor above deck than Da and Mr. Sullivan came down to announce that a storm was coming."
SofS,c02,chc02_e14,"May 19, 1847",That set Mrs. Tattersall to wailing.
SofS,c02,chc02_e14,"May 19, 1847",Mr. Tattersall said that she is deathly afraid of the sea.
SofS,c02,chc02_e14,"May 19, 1847","She dreamt while they waited at Liverpool that she and her babies fell into the ocean and were swallowed up by waves, and that she had clawed her way through the cold water to try to catch them as they dropped like stones into the bottomless sea."
SofS,c02,chc02_e14,"May 19, 1847",She woke up screaming.
SofS,c02,chc02_e14,"May 19, 1847","Da said we mustn’t panic, although I noticed that he fingered his little tin St. Joseph medal, which he always does when he’s whispering a prayer."
SofS,c02,chc02_e14,"May 19, 1847","(It is a poor thing, dented in one side."
SofS,c02,chc02_e14,"May 19, 1847","St. Joseph himself is worn almost smooth from Da’s rubbing him with his thumb, but it has hung around Da’s neck for as long as I can remember.)"
SofS,c02,chc02_e14,"May 19, 1847",He said the captain would shut the hatches to keep the water from coming in.
SofS,c02,chc02_e14,"May 19, 1847","That set another woman to wailing, and her terror made some of the wee ’uns cry."
SofS,c02,chc02_e14,"May 19, 1847","Da went to her and told her calmly but firmly she mustn’t carry on so, as it set a poor example for the children."
SofS,c02,chc02_e14,"May 19, 1847",The woman clamped her mouth shut as if God had reached down and pinched it closed.
