chapter_id,date,sentence
5,le 17 septembre 1666,"At the last moment, Minette, who had somehow escaped from my cabin, leaped down into my lap and settled herself there."
10,le 9 février 1667,Marie came all the way from France to make a life here.
3,le 5 juillet 1666,He saw me and shouted that I must go below.
10,le 20 février 1667,Then the beer will disappear more quickly.
4,may,"You do trade, I have heard.” Monsieur Aubry said nothing."
1,may,My sister is so lovely.
5,le 20 septembre 1666,"“You must get out, Hélène!” she screamed."
1,le 26 mai 1666,He made very strange choking noises on the other side of the little screen when I told him what I had said.
1,le 25 mai 1666,Catherine and Madeleine argued today.
6,le 14 octobre 1666,"It amounted to nothing, I said."
9,le 31 janvier 1667,Most people were at home.
2,le 21 juin 1666,It is night.
6,le 5 octobre 1666,"“This is my niece, Hélène, Bernadette,” Tante Barbe went on."
7,le 23 novembre 1666,An unspeakable thing.
8,le 14 decembre 1666,"“I suffer for fashion, but I hate cold, wet feet."
1,le 24 mai 1666,"“I can embroider and make lace,” Catherine offered."
5,le 13 septembre 1666,"He blamed le bon Dieu for a long while,” she told me."
4,le 25 août 1666,It cheered my heart and moved me deeply.
6,may,"We can take her there first rather than to la Soeur Bourgeoys’s, can we not, Papa?” I was so distressed that I did not answer."
8,le 14 decembre 1666,"Alone now, I examined the room."
9,le 6 janvier,I could at last leave.
5,may,"Is her milk rich with cream?” “You are a widower with six children, monsieur."
6,may,"Since I left Le Cadeau , so many changes have taken place in my life."
12,may,"I can tell by looking at you, Papa,” Kateri cried."
5,le 15 septembre 1666,Canoes filled with Indians or coureurs de bois — which is what they call the men who go out to trade with the Indians here — carry large bales of furs past us.
5,le 23 septembre 1666,His sort angers me.
5,le 17 septembre 1666,"Until that moment, I had not really felt myself to be one of les filles à marier ."
12,le 13 avril 1667,"Jean, Séraphin and Kateri are precisely like Tante Barbe in that they will eat anything."
5,le 17 septembre 1666,Even Marie with the missing front tooth was particularly lovely.
6,may,"She bustled me up to a small room, told me I must eat, wash my hands and face, change into my nightdress, say my prayers and climb under the quilts."
2,may,"“Ridiculous,” Catherine said to Monsieur Deschamps."
6,may,"Deschamps is like so many of the other minor nobles here, Hélène."
5,le 8 septembre 1666,"Then they attended mass, their souls pure and clean."
5,le 28 septembre 1666,I must ask Kateri if the advice was hers or his.
10,Février,"Tante Barbe had found her in my chest, for the lid has been open of late, and she was not alone."
13,le 2 mai 1667,Then anger crept into my words.
8,le 14 decembre 1666,“I truly have no appetite.” We had no other customers for the moment.
3,le 26 juillet 1666,That he had been a scholar and a natural philosopher.
6,may,There is nothing savage about either of them.
13,le 2 mai 1667,"He walked ahead of us with Séraphin, the two victorious hunters carrying the squirrels they had shot, talking to the tall man."
6,may,"Kateri seemed confused when I told her that her father had only wished to ask my opinion of the weather, but Tante Barbe did not."
5,le 16 septembre 1666,"Of course, I knew that she was running off to tell her father."
5,le 17 septembre 1666,These young women are meant for the lucky fellows in Montréal.
4,le 25 août 1666,"It began with one small bird, a sort of finch."
6,le 8 octobre 1666,Then I went back to the kitchen where Tante Barbe had set Séraphin to work carrying in wood.
7,le 28 novembre 1666,"On a night like this, with the wind howling, I can almost agree with him."
4,le 14 août 1666,"I am tired today, for I could not sleep last night, having wakened in the dark from the saddest dream."
5,le 17 septembre 1666,"I would learn later that some were local merchants, traders and farmers who either lived here or who had come into the town on some business or other."
8,le 6 decembre 1666,All my life Papa told me about the sacredness of marriage.
3,le 6 juillet 1666,She has nothing left to bring up.
10,le 3 février 1667,"I turned away from him, fighting my anger."
1,le 17 mai 1666,One was all the way from New France.
12,le 30 avril 1667,I know it is a childish thing.
2,le 14 juin 1666,Sailors brought down our chests.
10,le 17 février 1667,"Molasses should have been added, but there is none, so we used a bit of sugar."
12,le 12 avril 1667,She did not answer.
5,may,"only pray a few might be persuaded to change their minds, as is their right, and settle here.” Monsieur Deschamps made his apologies, and led us on to an inn where we were to take refreshment."
5,le 30 septembre 1666,"Hopefully you will always see New France in the same way,” he answered."
5,le 30 septembre 1666,It horrifies Madame Laurent.
11,le 7 mars 1667,"“He was a pompous fool, but he did not deserve that end.” No one does."
6,le 2 octobre 1666,"Kateri grew very excited, and said something to her father in a tongue that I had never heard."
6,le 5 octobre 1666,"You will have an honest wage for what you do here, as well."
9,le 6 janvier,You did.
8,le 14 decembre 1666,It wrapped around the leg and was laced shut in a criss-cross manner.
7,le 28 novembre 1666,I said it was a lovely house.
2,le 26 juin 1666,He looks quite strong and much older than his fifteen years.
6,le 11 octobre 1666,"If it is not one task then it is another, and some of them are very strange."
5,le 27 septembre 1666,“There are so many things he does not do because they remind him of her.
10,Février,"in Mohawk is Enniska , which means lateness ."
13,le 2 mai 1667,She knows how important Minette is to me.
6,le 16 octobre 1666,"It is long and narrow, running right to the river as all the farms do."
11,le 19 mars 1667,"Once I awoke, it seemed so strange to lie here, while downstairs the life of the house went on."
6,le 14 octobre 1666,"I am a wealthy man, mademoiselle,” he said quickly."
5,le 9 septembre 1666,There were ten men or so in the three vessels that Séraphin said were war canoes.
2,le 6 juin 1666,"Monsieur Deschamps has travelled on ahead to the ship, but Madame Laurent has remained here at Le Cadeau so that she might act as our chaperone on the journey."
10,le 16 février 1667,They say that the surgeon bled them all to no effect.
4,le 24 août 1666,"“Mademoiselle, it is only Newfoundland, a large island."
9,le 31 janvier 1667,“It cannot be.
8,le 5 decembre 1666,Tante Barbe sent Kateri and me to the hospital today with fresh bread and a pot of soup.
5,le 16 septembre 1666,It soothes my mind.
10,le 17 février 1667,They burn too quickly.
1,may,Catherine thinks she cannot possibly be respectable.
9,le 6 janvier,"When he saw the blisters that were all over his arms, he closed his eyes so that he would not have to face the horror of it."
2,le 12 juin 1666,There will be another home for us some day.
12,le 13 avril 1667,"There are some wildflowers, and best of all, he said, the ferns are coming up in a few sheltered places where the sun warms the earth."
11,le 15 mars 1667,"Their mouths are bleeding, their arms, legs and bellies are terribly swollen, and they cannot walk."
6,le 1 octobre 1666,If the French would eat like the Indians they would be far more content.
6,le 2 octobre 1666,They are muscular men with darkly tanned skin that they rub with grease.
10,le 20 février 1667,He had one this evening as we sat near the fire.
2,le 14 juin 1666,"They must share beds, and all they have for privacy is a curtain."
5,le 17 septembre 1666,I had not spent all these weeks talking about a prospective husband.
6,le 1 octobre 1666,"I did take a small taste and then a larger serving, for they were quite tasty."
10,Février,How strange that such a small thing gives me such pleasure.
10,le 24 février 1667,I admit that I felt a certain pride that I was beginning to master the pistol.
4,may,"I could have sworn that sparks flew between them, but perhaps it was only lightning."
5,le 13 septembre 1666,“Papa did the same when Maman died.
9,le 31 janvier 1667,One night Tante Barbe sang to us.
13,le 2 mai 1667,These women must get into the warmth of a building.
6,le 25 octobre 1666,I have never felt such a cold as I have since I came to New France.
2,le 20 juin 1666,"Monsieur Deschamps says that a man must have a licence to trade for the furs and, to keep that licence, these days a man must marry."
2,le 20 juin 1666,They say there are many beavers in New France.
5,may,We had left the inn to return to the ship.
5,le 29 septembre 1666,Our group was split amongst six canoes.
5,le 3 septembre 1666,She had something in a basket.
6,le 5 octobre 1666,How exciting.
4,le 18 août 1666,They have always been my favourite.
3,le 20 juillet 1666,"Père Denis blessed her with the holy oil of the sick, and so she is in heaven with Maman and Papa."
4,le 4 août 1666,I now know.
1,le 19 mai 1666,It rained all day today.
6,le 14 octobre 1666,The urge to neigh was powerful.
6,le 5 octobre 1666,She shook her head firmly.
1,le 9 mai 1666,She does not say this to be cruel.
5,le 9 septembre 1666,Sometimes in recent days I have heard the men talking when they think we cannot hear them.
4,le 29 août 1666,I have never seen such a wide river.
5,may,"The fresh bread and cheese were lovely, and the innkeeper did not mind a cat in his inn, but it would have been more a pleasure to have shared the meal with Kateri."
5,le 20 septembre 1666,"He was in the boat alongside the ship where Madame Laurent, Monsieur Deschamps and the Maries all sat crammed in with our priest."
3,le 18 juillet 1666,"Celine died this morning, and so did Lise, just at sunset."
5,may,"But there were women, and near noon the canoes were paddled to the shore and we were allowed to go into the bushes."
4,le 24 août 1666,"“There is a long way to go as yet.” The captain sent Séraphin below to bring up a map, what they call a chart, and yes, it was true."
9,le 6 janvier,Perhaps it is true.
8,le 14 decembre 1666,"“Come join us, mademoiselle,” Monsieur Aubry said gently."
5,may,"It seems that if there had been no women in the party, the canoes would not have stopped until nightfall."
2,may,Heavy shoes would keep my feet dry if it was damp.
8,le 14 decembre 1666,"She made sure Monsieur Aubry would escort me back, then, before either he or I could say a word, she hurried away."
2,may,I cannot imagine marrying at eleven or twelve years of age.
2,le 15 juin 1666,I woke this morning before dawn to the most peculiar world.
1,le 28 mai 1666,She was Madame Laurent.
6,le 8 octobre 1666,"I just stood there while he babbled, making excuse after excuse for himself."
2,may,“Would you not like to be the wife of a Montréal merchant?” I could not help myself.
9,le 6 janvier,I am happy is wakatshennonni .
5,may,"Monsieur Deschamps, Madame Laurent and the Maries were already standing near the water."
4,may,"Instead, I did not mind at all."
6,may,They seem to hate each other.
6,le 3 octobre 1666,“Mademoiselle St. Onge
7,le 5 novembre 1666,It snowed hard in the night.
8,le 2 decembre 1666,"Still, it is something to do in the evenings before we retire."
9,le 31 janvier 1667,We hurried to the kitchen.
3,le 26 juillet 1666,Perhaps you will take up where he left off.
4,may,What else had she told him?
5,le 24 septembre 1666,"Once we were deposited on the shore, the boats went back for our chests."
7,le 28 novembre 1666,"It is most unusual for such a sign to have words at all, and I suspect that Monsieur Aubry is very proud of his shop."
10,may,I feared for a moment that Monsieur Deschamps’s eyes would pop from his head and roll across the floor.
5,le 29 septembre 1666,What a difference there was between them.
1,le 17 mai 1666,"They will bring their daughter, Cousine Anne."
9,le 31 janvier 1667,How could she have known that it is my favourite Christmas song?
6,le 3 octobre 1666,My heart thumped hard.
2,le 13 juin 1666,But this!
2,le 6 juin 1666,"It is generous, I suppose, and I pray it will be enough."
6,le 1 octobre 1666,He found some shaggy-mane mushrooms in the forest.
9,le 31 janvier 1667,I tossed my cloak to the floor and knelt beside him.
8,le 6 decembre 1666,Most Mohawk women do not want to marry them.
10,le 17 février 1667,It is so cold here that it takes a great amount of wood to keep a room warm.
2,may,I put down my quill and hugged her.
5,le 29 septembre 1666,“Surely your cat
5,le 30 septembre 1666,"When I said that aloud, Monsieur Aubry, who paddles behind me, informed me that these trees have never been cut."
12,le 29 avril 1667,"Sottise came home, I thank le bon Dieu ."
5,le 30 septembre 1666,The men sing.
12,le 19 avril 1667,"“Finally, Monsieur Lespérance opened them, leaned out and tossed down some coins."
7,may,"It is quite good, especially with fresh butter."
2,le 30 juin 1666,Catherine came out on deck today for the first time.
10,le 4 février 1667,Food is all I think of some days.
10,Février,Minette has ceased her wandering.
5,may,Now they need not travel on to Montréal.” I know short Marie and Marie with the freckles have found what they wanted.
6,le 5 octobre 1666,"No job is too lowly, Tante Barbe said."
9,le 6 janvier,He smiled crookedly.
5,may,"The man made a joke about how it was the girls who would likely do the choosing, but by then the afternoon had been spoilt for me."
2,may,"“Come now, mademoiselle,” he said."
5,le 24 septembre 1666,"I write this at yet another setting, one that could not be more different from the ship or the inn."
2,le 7 juin 1666,Madeleine made a suggestion once or twice.
7,le 5 novembre 1666,“And now we must do the laundry inside and use the drying racks.
8,le 14 decembre 1666,"“Bonjour, mademoiselle,” he said to me and he made a little bow."
1,may,"In Montréal, they stay with a woman named la Soeur Marguerite Bourgeoys who looks after them."
6,le 8 octobre 1666,"Tante Barbe took him on as an engagé , saying that she needs the help of a strong young man."
6,le 2 octobre 1666,"They will travel with us up river, they say.” The Mohawks wear only breechcloths."
2,le 26 juin 1666,"If they were on the deck, they would probably consider it inappropriate that I speak with Séraphin."
10,le 22 février 1667,It is not.
2,le 7 juin 1666,I have helped Louise carefully fold and pack Catherine’s trousseau.
7,le 13 novembre 1666,"Kateri is much better, but seeing her in the bed, so unwell, brought back the sad memories of Catherine’s passing."
10,le 3 février 1667,His face grew ashen and then very red.
2,may,"We do not look the least alike, for she is fair and I am dark."
5,le 16 septembre 1666,"I added that that should not be a problem, since I was not exactly the sort of girl men looked at twice."
2,le 23 juin 1666,"“We shall make our friends among the better people in Montréal,” she says."
5,le 23 septembre 1666,"At once, the girls began to chatter and plan."
12,le 11 avril 1667,"“Do not say it, Hélène."
3,le 26 juillet 1666,I cannot swim.
2,may,I myself wonder if it is the right thing.
5,le 13 septembre 1666,She says that the other girls speak of my refusal of the sacrament as a sin.
5,le 13 septembre 1666,"I have wakened, and if I do not write quickly I shall fall asleep again."
12,le 13 avril 1667,"Tante Barbe was seized with the need to clean everything, and so I tied a scarf over my hair and helped her."
9,le 6 janvier,Tears came to my own eyes.
6,le 14 octobre 1666,“All I require to make my life complete is a wife whose breeding will complement my own.
9,le 6 janvier,"He has scars on his face, but inside himself, where it matters, there are no scars at all."
3,le 9 juillet 1666,The ink bottle spilled and there is a black stain upon the blanket.
2,may,"For a moment, I feared that my heart would break."
12,may,"“Of course she said yes.” I was an intelligent girl with a very pink face, I fear."
5,le 27 septembre 1666,I have been to weddings before back in France.
13,le 4 mai 1667,And the tall man who would carry my letter back to Cousin Pierre?
10,le 20 février 1667,"“There is only one response I will accept, and that is yes."
5,le 14 septembre 1666,"Monsieur Aubry, I have learned, is able to walk very quietly so that he is there before you even notice him."
13,le 5 mai 1667,"Papa said once that a dragonfly is the perfect symbol of life, and indeed, of one’s search for knowledge and understanding."
5,le 23 septembre 1666,"So was I, although I hid it as well as I could."
8,le 21 decembre 1666,She was pleased when we both said yes.
8,le 3 decembre 1666,How Kateri laughed at that.
6,may,“Marriage is a business arrangement of the most delicate sort.
5,le 27 septembre 1666,She welcomed we filles à marier with such generosity.
8,le 14 decembre 1666,"She decided to walk with us, although it had nothing to do with propriety; Monsieur Aubry was a gentleman."
8,le 3 decembre 1666,He and other engagés have worked these last few days with the soldiers to replace a section of the palisade.
6,le 22 octobre 1666,That leaves Marie who never speaks.
2,le 23 juin 1666,"Besides, Minette likes Kateri and she is the best judge of character that I know."
10,le 4 février 1667,"Séraphin told her that he had worked hard this morning, mucking out the cowshed and chopping wood, so Tante Barbe agreed."
4,le 24 août 1666,"No ice mountains have been sighted, either."
12,le 13 avril 1667,"With the fine weather, the forest across the river has begun to come alive once more."
2,le 26 juin 1666,"That was an error, to think of the garden."
5,le 14 septembre 1666,"He put his arm around his daughter, but he spoke almost as though neither of us was there."
6,le 10 octobre 1666,For some reason she had it wrapped in a blanket.
7,le 24 novembre 1666,"“They say your papa has gone to the Mohawks once more,” the coureur de bois called out to Kateri’s back."
5,le 20 septembre 1666,Last night there was a fire in the ship’s galley.
6,may,That is how I came to be here in this warm bed under the roof of ma Tante Barbe.
5,le 14 septembre 1666,He stopped speaking for a moment and glanced at me.
6,le 5 octobre 1666,She also hates being pecked.
3,le 20 juillet 1666,"I could not pull the sheet up over her face, so the captain did it."
10,le 20 février 1667,"As she always does, Tante Barbe hung several small spruce branches on the door to tell passers-by that fresh spruce beer is available here."
11,le 20 mars 1667,"“You know, yourself,” he said, “to leave a sickbed too soon is foolishness.” I whispered to him that one more dose of that tea would have drowned me."
2,le 13 juin 1666,I am used to odours; the dovecote was all feathery and the barn had milk cows and sometimes their calves.
6,may,There is a rumble of low talk and laughter from downstairs.
6,le 25 octobre 1666,Food interests them far more than washing and changing the clothing in which they have been living for weeks.
5,le 14 septembre 1666,The trading post became this town of Québec.
1,le 25 mai 1666,It is Madeleine’s fault.
1,le 8 mai 1666,"I cannot remember Maman, since I was an infant when she died, but Papa, dear Papa, I shall never forget."
7,le 28 novembre 1666,"He, though, hating the cold beyond all reason, merely went back to France."
10,le 19 février 1667,What a chance this is for him.
5,le 6 septembre 1666,That seemed to satisfy her.
9,le 31 janvier 1667,"So many days have passed since I last opened this diary, that at first I wondered if I would even remember how to write."
6,le 2 octobre 1666,"Madame Laurent says it is indecent, and that we should avert our eyes."
5,le 20 septembre 1666,"I went below to dress presentably, and the stink of the smoke was everywhere."
5,le 9 septembre 1666,I will try not to think about that.
3,le 13 juillet 1666,I begged Catherine to take a deep breath.
12,le 5 avril 1667,Jean says that the sap has begun to run in the maple trees.
6,le 2 octobre 1666,Kateri says this is called a roach.
5,le 17 septembre 1666,"I was so startled that I could not say a word, only sat there rubbing my arm."
8,le 6 decembre 1666,"“I try, Hélène,” she whispered finally, “but it hurts me.” I held her as she wept."
8,le 4 decembre 1666,They are asleep inside their houses before even we retire for the night.
5,le 17 septembre 1666,I did not dress in my best so that I would be appealing to a single man.
12,le 11 avril 1667,He put up his hand and stopped me.
10,le 12 février 1667,"He added that he had heard that some in Montréal are celebrating, and some are even praying that the smallpox takes all the Mohawks."
1,le 19 mai 1666,Then he sighed.
7,le 24 novembre 1666,"One woman was fingering a roll of cloth, her back to us."
7,le 2 novembre 1666,Perhaps in time.
2,le 20 juin 1666,Père Denis is tall and rather unkempt.
7,le 24 novembre 1666,We walked back in silence.
2,le 28 juin 1666,"Our bedding has an unpleasant dampness to it now, but I am still grateful for the privacy I have as I write this."
5,le 27 septembre 1666,"I might have felt grief rise up in me, yet mercifully it did not."
5,le 27 septembre 1666,"It is wonderful to see him taking pleasure in such things again.” She tilted her head to one side thoughtfully and added, “You and Maman would have liked one another, I think.” I suspect I would have liked this woman, Sesi."
5,le 17 septembre 1666,I suppose that when one is looking for a husband it is important to look appealing at all times.
5,le 29 septembre 1666,Men were waiting outside the convent to carry our chests to the Lower Town.
4,le 27 août 1666,"We pass as much time together as possible, sitting outside when the weather is fine."
5,le 17 septembre 1666,"If I was to have an adventure, then she would as well."
12,le 20 avril 1667,What hissing and growling there is yet again!
6,le 25 octobre 1666,He stood at the doorway and held a lace-trimmed handkerchief over his nose for a moment.
10,may,I hope I never learn the truth of that.
7,le 2 novembre 1666,Catherine and I had planned to do the same for Maman and Papa today.
6,le 12 octobre 1666,"“She is a cat, Hélène,” Tante Barbe said gently when I said that I would keep Minette tied or locked in my room."
6,le 16 octobre 1666,"“Some do!” he confided, and told me of a boy he saw being flogged today when he went out for water."
6,may,I will send word to Madame Laurent of your whereabouts.
2,le 18 juin 1666,He showed the girls and me the ship today.
6,le 5 octobre 1666,"I have the two rooms upstairs that I let for ten sols a night, and I serve good food and weak beer."
5,le 16 septembre 1666,"I said that my future was too uncertain and at least in this way, if I had no other choice, with a dowry I would be viewed as a possible wife."
9,le 31 janvier 1667,Tante Barbe came later that afternoon to see why I had not returned.
8,le 20 decembre 1666,Her nipples stuck out and were very pink.
5,le 9 septembre 1666,The canoes came quite close to the ship.
3,le 6 juillet 1666,Monsieur Aubry I saw once as he carried a bucket away from her cabin.
6,le 22 octobre 1666,How will she say yes or no to a suitor if she never speaks?
10,may,Monsieur Aubry stood.
2,may,Those with no money must share a common space.
5,le 30 septembre 1666,I cannot understand the weather here.
2,le 21 juin 1666,Will I see beavers there?
2,le 26 juin 1666,I refuse to think of pirates.
6,le 11 octobre 1666,"Today I learned of another creature that some people eat, since it swims like a fish."
1,le 10 mai 1666,"How many hours had he spent here working on his book, writing in his journal, carrying on the work he was never to finish?"
2,may,Then the hated corps .
8,le 14 decembre 1666,"Few French or even Canadienne girls wear them, but you are sensible and will immediately see why you should.” “Papa!” cried Kateri."
2,may,I made a horrible face at this girl as I combed and put up my hair.
2,le 23 juin 1666,"She rubs against his legs, but he ignores her."
5,le 30 septembre 1666,"“Think of the wonder of such beauty that has never been touched,” I said, and looked back at him to ask if he agreed."
3,le 20 juillet 1666,"They picked her up, set her on a sheet of canvas, and then set a cannon ball near the bottom."
2,le 28 juin 1666,I have not been able to see land for six days.
5,le 24 septembre 1666,It made the water come into my mouth and made me think of home.
1,le 10 mai 1666,"A Treatise on the Natures of Men and Dragonflies , it was to be called."
4,le 4 août 1666,She is my daughter’s friend.
5,le 28 septembre 1666,She smiles and nods.
1,may,"There had been letters when Oncle Jules was alive, but they slowly ended, the way things sometimes do."
3,le 9 juillet 1666,The sky was black and neither the moon nor stars showed.
13,le 2 mai 1667,"It was very early, and so few people were about."
5,le 29 septembre 1666,It has been a long and tiring day.
8,le 6 decembre 1666,"He is French, and yet there is a part of him that became Mohawk."
5,le 3 septembre 1666,The second makes me shiver.
4,le 24 août 1666,How much longer?
6,may,"I blinked and blinked to force them back, and I could barely see Minette, who happily walked ahead of me on her lead."
12,le 16 avril 1667,He will take me there to pick some in time.
7,le 28 novembre 1666,"Below that was the image of a musket, for many people would not have been able to read the words."
7,le 24 novembre 1666,"I had a list of things for the house that I was to give to the proprietor: candles, soap, flour, lard."
4,le 30 août 1666,How can anyone make a home in such a place?
2,le 28 juin 1666,Often they do not even flap their wings.
6,le 11 octobre 1666,"“Are you certain you do not want to try one, Hélène?” she asked mischievously."
3,le 13 juillet 1666,"It is bold, the others said, to do such things on our own, since decent girls do not wander about unaccompanied by a chaperone."
